"conversation_id_str","created_at","favorite_count","full_text","id_str","image_url","in_reply_to_screen_name","lang","location","quote_count","reply_count","retweet_count","tweet_url","user_id_str","username"
"1841475724550754718","Wed Oct 02 13:50:00 +0000 2024","4","‍| En su discurso de toma de protesta @Claudiashein acusó de mentir a quienes señalan como un peligro el empoderamiento de las Fuerzas Armadas: Quien crea que la Guardia Nacional estando en la Sedena es militarización está totalmente equivocado . https://t.co/Yil0L6iVWR","1841475724550754718","","","es","México","0","0","0","https://x.com/LaFabricaMX_/status/1841475724550754718","1472810798414184450","LaFabricaMX_"
"1842701042363896018","Sat Oct 05 22:58:58 +0000 2024","2","Claudia Sheinbaum Presidenta de México anuncia apoyos para el campo a mujeres en infraestructura carretera para Morelos y dice que regresará. https://t.co/b1yLhe6SFF","1842701042363896018","https://pbs.twimg.com/ext_tw_video_thumb/1842700721155690498/pu/img/s4ku8AnN9pwTItTx.jpg","","es","Cuernavaca Morelos, México","0","0","2","https://x.com/ZonaCNoticias/status/1842701042363896018","599574140","ZonaCNoticias"
"1841852529442742369","Thu Oct 03 14:47:17 +0000 2024","24","Día 2: El mismo día que el Ejército mató a seis migrantes incluida una niña el nuevo gobierno ofrece una disculpa pública por la masacre del 2 de octubre de 1968. https://t.co/5tLaOLAycL vía @pajaropolitico","1841852529442742369","","","es","","0","1","15","https://x.com/dmorenochavez/status/1841852529442742369","190143362","dmorenochavez"
"1842359911222751468","Sat Oct 05 00:23:26 +0000 2024","490","Vehículos blindados desfilaron frente a la Comandancia Suprema de las Fuerzas Armadas encabezada por Claudia Sheinbaum en conmemoración de la creación de las Armas de México. #Video de @Elkizz_ | EL UNIVERSAL https://t.co/zLPXzJ8y9W","1842359911222751468","https://pbs.twimg.com/ext_tw_video_thumb/1842359809712001024/pu/img/fhkXHJ6vIUN72Axv.jpg","","es","Centro de la Ciudad de México","13","31","62","https://x.com/El_Universal_Mx/status/1842359911222751468","16676396","El_Universal_Mx"
"1841604306102792399","Wed Oct 02 22:20:56 +0000 2024","11","Gobierno de Sheinbaum inicia con 80 homicidios; Guanajuato tiene la cifra más alta https://t.co/t1l868T9kH a través de @pajaropolitico","1841604306102792399","","","es","","0","0","7","https://x.com/dmorenochavez/status/1841604306102792399","190143362","dmorenochavez"
"1840923730643411399","Tue Oct 01 01:16:34 +0000 2024","4222","#ÚLTIMAHORA Claudia Sheinbaum presenta el nuevo emblema del Gobierno Federal; una joven mexicana lo encabeza https://t.co/gYqPCPyy5Y","1840923730643411399","https://pbs.twimg.com/media/GYxGWZgWAAA1sJd.jpg","","es","Centro de la Ciudad de México","117","478","634","https://x.com/El_Universal_Mx/status/1840923730643411399","16676396","El_Universal_Mx"
"1842214460766801996","Fri Oct 04 14:45:28 +0000 2024","305","#EnLaMañanera | En ningún lugar dice que la Suprema Corte puede cambiar la Constitución : la presidenta Claudia Sheinbaum informa que la #ReformaAlPoderJudicial seguirá adelante: no vamos a caer en ninguna provocación; ellos saben que lo que están haciendo está mal . https://t.co/jx1QVHkHTO","1842214460766801996","https://pbs.twimg.com/media/GZDcPG3WsAAibH-.jpg","","es","México","27","167","73","https://x.com/ElFinanciero_Mx/status/1842214460766801996","119051398","ElFinanciero_Mx"
"1842220112847254013","Fri Oct 04 15:07:56 +0000 2024","692","Es mi placer mostrarles cómo la presidenta Claudia Sheinbaum le rompió los dientes al machista y misógino de Rafael Inclán. Soy Presidenta abuela mamá y ama de casa con gran orgullo 🇲🇽 https://t.co/IyaGKXDRyL","1842220112847254013","https://pbs.twimg.com/amplify_video_thumb/1842219985030053888/img/Gv6pviSR3TztJ76K.jpg","","es","México","1","28","305","https://x.com/guruchuirer/status/1842220112847254013","545061074","guruchuirer"
"1842715000085082435","Sat Oct 05 23:54:26 +0000 2024","2","Today we're republishing MND CEO Travis Bembenek's wish list for President Claudia Sheinbaum. Sheinbaum was sworn in on Tuesday for a 6-year term. Among Travis's wishes: Be proactive on nearshoring and make Mexico a leader in renewable energy. https://t.co/s9IHW8BZ7m","1842715000085082435","","","en","Mexico","0","1","0","https://x.com/mexicond/status/1842715000085082435","2575981471","mexicond"
"1842680855875272889","Sat Oct 05 21:38:46 +0000 2024","7037","Me comprometí a ser un gobierno de territorio no solo de escritorio. Estamos en Jantetelco Morelos con la gobernadora Margarita González informaremos los Programas de Bienestar y obras para el estado. https://t.co/9dNgaeQLWh","1842680855875272889","","","es","Ciudad de México","53","500","2108","https://x.com/Claudiashein/status/1842680855875272889","591361197","Claudiashein"
"1842684453556207923","Sat Oct 05 21:53:03 +0000 2024","270","🇲🇽Tuve el gusto de saludar a @ClaraBrugadaM en la toma de protesta de la presidentA Claudia Sheinbaum Me enorgullece decir que a partir de hoy esta luchadora es nuestra Jefa de Gobierno Es tiempo de mujeres #ClaraJefaDeGobierno #ClaudiaSheinbaumPresidenta https://t.co/AWuPKe5ODP","1842684453556207923","https://pbs.twimg.com/amplify_video_thumb/1842683584936660992/img/Hg404XyXgNWioagc.jpg","","es","Madrid","0","4","94","https://x.com/Sasialejandre/status/1842684453556207923","998257907270668288","Sasialejandre"
"1841146585683529811","Tue Oct 01 16:02:07 +0000 2024","3871","No le puedo desear éxito a Sheinbaum porque su éxito representa que logren acabar con la libertad y la democracia del país. Entonces no no le deseo ni tantito éxito en sus perversos objetivos.","1841146585683529811","","","es","Ciudad de México","76","638","1035","https://x.com/AmerangelLorenz/status/1841146585683529811","1961366972","AmerangelLorenz"
"1840969873733668917","Tue Oct 01 04:19:56 +0000 2024","4213","Disfruten. https://t.co/RBQj7g0jub","1840969873733668917","","","es","","56","423","2309","https://x.com/hdemauleon/status/1840969873733668917","390356716","hdemauleon"
"1841598738915328334","Wed Oct 02 21:58:49 +0000 2024","2","Desde el aumento de los programas sociales y un estado de bienestar hasta la justicia del caso Ayotzinapa y la reforma electoral que López Obrador dejó inconclusa durante su gobierno estas son las 100 promesas de Claudia Sheinbaum ⬇️ https://t.co/RimTy3T7xr","1841598738915328334","","","es","Mexico","0","0","0","https://x.com/SerendipiaData/status/1841598738915328334","856644015026053124","SerendipiaData"
"1842661689394651576","Sat Oct 05 20:22:36 +0000 2024","0","Primera caravana migrante en gobierno de Sheinbaum parte de Tapachula a Ciudad de México https://t.co/MDsf1pHqsz","1842661689394651576","","","es","Mexico D.F.","0","0","0","https://x.com/alexmelon/status/1842661689394651576","29749190","alexmelon"
"1841572443191697656","Wed Oct 02 20:14:19 +0000 2024","3337","El 75% de los mexicanos cree que el país va estar mejor con Sheinbaum // la especialidad del mexicano hacerse la puñeta mental !!! Hoy se los digo al menos los próximos dos años serán muy difíciles económicamente y chance y 3 https://t.co/GNmbh7DHO3","1841572443191697656","","","es","Culiacán, Sinaloa, México.","35","685","1173","https://x.com/ClouthierManuel/status/1841572443191697656","249875929","ClouthierManuel"
"1842058046442504560","Fri Oct 04 05:12:58 +0000 2024","18","@Natushka_nms El hecho de que Claudia Sheinbaum sea mujer y durante 6 años esté al frente de un país siento que haría como que difícil invisibilizar que ella es mujer y presidente tmb es interesante la aceptación del género neutro que su figura brinda ","1842070383861576141","","Natushka_nms","es","México D.F","0","1","0","https://x.com/BeckaSalas/status/1842070383861576141","202515793","BeckaSalas"
"1840944777564500336","Tue Oct 01 02:40:12 +0000 2024","3350","El mandatario colombiano Gustavo Petro reveló esta tarde que la entrante presidenta de México Claudia Sheinbaum fue militante de la guerrilla del M-19 que se desmovilizó en Colombia a finales del 80. https://t.co/9zdClgla91","1840944777564500336","","","es","México","186","273","2156","https://x.com/proceso/status/1840944777564500336","41156599","proceso"
"1842686202300059753","Sat Oct 05 22:00:00 +0000 2024","37","Así los primeros días del gobierno de Claudia Sheinbaum https://t.co/dWWQh6WUHh https://t.co/on5BTRzhOg","1842686202300059753","https://pbs.twimg.com/amplify_video_thumb/1842305151408693248/img/Rii_wOKahOawSpxE.jpg","","es","Ciudad de México","0","1","10","https://x.com/lopezdoriga/status/1842686202300059753","236636515","lopezdoriga"
"1841146651852836908","Tue Oct 01 16:02:23 +0000 2024","1"," @Claudiashein no sólo pasará a la historia como la 1° presidenta de México: también tiene la posibilidad de ser la primera en asumir el compromiso e implementar una agenda integral en materia de #EmpresasyDDHH. https://t.co/m92cai1eJL #CapturaDelEstado @pajaropolitico https://t.co/cECljEOJyN","1841146651852836908","https://pbs.twimg.com/media/GY0RHHkWYAkvBA8.jpg","","es","México y Latam","0","0","1","https://x.com/PODERlatam/status/1841146651852836908","22200424","PODERlatam"
"1841217911689523383","Tue Oct 01 20:45:32 +0000 2024","11","Trabajadores del Poder Judicial se manifiestan; policías los encapsulan previo a toma de protesta de Sheinbaum https://t.co/t9QgnQIldW a través de @pajaropolitico","1841217911689523383","","","es","","0","1","7","https://x.com/dmorenochavez/status/1841217911689523383","190143362","dmorenochavez"
"1842678734626726279","Sat Oct 05 21:30:20 +0000 2024","1","#Apoyos ️ | Claudia Sheinbaum anuncia apoyos económicos para los damnificados en Guerrero y Oaxaca tras el impacto del huracán John como parte de las medidas de emergencia. Más detalles en: https://t.co/C1XRfeNzuY #HuracánJohn #ApoyoDamnificados #Guerrero #Oaxaca","1842678734626726279","","","es","Ciudad de México","0","0","0","https://x.com/MundoEjecutivo/status/1842678734626726279","81963817","MundoEjecutivo"
"1842690377293463841","Sat Oct 05 22:16:36 +0000 2024","0","México: primera caravana migrante en el Gobierno de Sheinbaum parte desde la frontera con Guatemala https://t.co/1N1vmrnaNp","1842690377293463841","","","es","República Dominicana","0","0","1","https://x.com/acentodiario/status/1842690377293463841","229334332","acentodiario"
"1842716245210071287","Sat Oct 05 23:59:23 +0000 2024","1","La Presidenta de México Claudia Sheinbaum buscará que no aumente la canasta básica. #ImagenNoticias #ImagenInforma https://t.co/lzOqk0ryPG","1842716245210071287","https://pbs.twimg.com/amplify_video_thumb/1842715075242590208/img/T77MbO19DDJGFqHi.jpg","","es","","1","0","0","https://x.com/ImagenTVMex/status/1842716245210071287","780103512155824128","ImagenTVMex"
"1841211040190681562","Tue Oct 01 20:18:14 +0000 2024","6","‍🇲🇽 @Claudiashein rinde protesta como la primera #Presidenta de México ante el Congreso de la Unión. Conoce los detalles : https://t.co/eX5xBRPzcs","1841211040190681562","","","es","Av. Congreso de la Unión, 66. ","0","0","3","https://x.com/Mx_Diputados/status/1841211040190681562","498984649","Mx_Diputados"
"1842058046442504560","Fri Oct 04 08:42:03 +0000 2024","12","@aaliscott Por eso es como ganarles en su propio juego en aras de denostar a Sheinbaum dan herramientas para que se acepten casos como le compañere.","1842123002181541970","","aaliscott","es","México D.F","0","1","0","https://x.com/BeckaSalas/status/1842123002181541970","202515793","BeckaSalas"
"1841888896969535964","Thu Oct 03 17:11:48 +0000 2024","5471","Primera Salutación de las Fuerzas Armadas y Guardia Nacional como Presidenta Constitucional de los Estados Unidos Mexicanos. https://t.co/TgIZ6kFOlQ","1841888896969535964","","","es","Ciudad de México","80","294","2014","https://x.com/Claudiashein/status/1841888896969535964","591361197","Claudiashein"
"1841119408124485754","Tue Oct 01 14:14:07 +0000 2024","5","Con mayorías legislativas y amplios poderes Claudia Sheinbaum hereda un presidencialismo restaurado https://t.co/QPTFGdbiJS a través de @pajaropolitico","1841119408124485754","","","es","","0","0","3","https://x.com/dmorenochavez/status/1841119408124485754","190143362","dmorenochavez"
"1842334370876768648","Fri Oct 04 22:41:57 +0000 2024","29","¿Cachetada con guante blanco? La presidenta Claudia Sheinbaum (@Claudiashein) respondió este viernes 4 de octubre a los comentarios misóginos que lanzó el actor Rafael Inclán quien aseguró que México tendría una ama de casa 6 años https://t.co/EhimhcEgFS","1842334370876768648","https://pbs.twimg.com/amplify_video_thumb/1842333745660977152/img/kT62h7tWUFnRva7p.jpg","","es","México","1","14","7","https://x.com/ElFinanciero_Mx/status/1842334370876768648","119051398","ElFinanciero_Mx"
"1842217944043921463","Fri Oct 04 14:59:19 +0000 2024","5","#EnLaMañanera | La presidenta Claudia Sheinbaum asegura estar al pendiente del conflicto entre Líbano e Israel y explicó que el canciller Juan Ramón De la Fuente mantiene contacto con los mexicanos en esa región para otorgarles apoyo. https://t.co/IvCK1ZKPr8","1842217944043921463","https://pbs.twimg.com/media/GZDfcLpWIAAIP7u.jpg","","es","México","0","0","2","https://x.com/ElFinanciero_Mx/status/1842217944043921463","119051398","ElFinanciero_Mx"
"1841613987089146255","Wed Oct 02 22:59:24 +0000 2024","14","Retos económicos prioridades sexenales. Esta semana conversé con Altagracia Gómez enlace de Sheinbaum con empresarios. Nearshoring reforma judicial escenarios estratégicos. Para Al habla en @elpaismexico https://t.co/wPHdnrExKV","1841613987089146255","","","es","Mexico","0","1","2","https://x.com/warkentin/status/1841613987089146255","13320562","warkentin"
"1842204619499343960","Fri Oct 04 14:06:22 +0000 2024","10","#EnLaMañanera | Mario Delgado secretario de educación pública informa sobre la nueva beca universal Rita Cetina Gutiérrez nombre que fijó la presidenta Claudia Sheinbaum y será destinada a estudiantes de educación básica a partir de 2025. https://t.co/cEsf94nxyo","1842204619499343960","https://pbs.twimg.com/media/GZDTSUUXoAEKt4U.jpg","","es","México","0","2","8","https://x.com/ElFinanciero_Mx/status/1842204619499343960","119051398","ElFinanciero_Mx"
"1841522009424961602","Wed Oct 02 16:53:55 +0000 2024","37","¿Qué #México recibe Claudia Sheinbaum? Violencia inseguridad déficit fiscal y corrupción son los problemas endémicos del país que la nueva presidenta hereda de su sucesor y de los que dependerá en gran medida el éxito de su mandato. /pl https://t.co/8ylAbngHIL","1841522009424961602","https://pbs.twimg.com/media/GY5mmFhWAAAKfMQ.jpg","","es","Berlín, Alemania","6","19","15","https://x.com/dw_espanol/status/1841522009424961602","6135622","dw_espanol"
"1841179411237749048","Tue Oct 01 18:12:33 +0000 2024","6950","Petro dice que Claudia Sheinbaum nueva presidente de México es fue miembro del M-19 y agrega: es decir que para el que no quiere 2 tazas ahora dos presidentes en América Latina . No olvidar: M-19 fue un grupo terrorista que entre otras acciones criminales se tomó el https://t.co/RR4eLfwEhH","1841179411237749048","https://pbs.twimg.com/amplify_video_thumb/1841179358381101067/img/PdBSqwwnpf-VP3w_.jpg","","es","Bogotá, D.C., Colombia","110","887","3230","https://x.com/VickyDavilaH/status/1841179411237749048","242730842","VickyDavilaH"
"1842673219167269038","Sat Oct 05 21:08:25 +0000 2024","0","#Global | Primera caravana migrante en gobierno de Sheinbaum parte de Tapachula a Ciudad de México Amplía la información: https://t.co/zEAUDeuWzv https://t.co/EMiaIpeRPg","1842673219167269038","https://pbs.twimg.com/media/GZJ9hy5XAAAoj8B.jpg","","es","Ciudad Guayana","0","0","0","https://x.com/SoyNuevaPrensa/status/1842673219167269038","122489940","SoyNuevaPrensa"
"1841560763447620090","Wed Oct 02 19:27:55 +0000 2024","10736","Claudia Sheinbaum ha dicho que el origen de la grandeza cultural de México reside en las grandes civilizaciones que vivían en esta tierra antes de que la invadieran los españoles . No hija no. El país que presides es obra de España.","1841560763447620090","","","es","Madrid, España","84","494","2536","https://x.com/VidalQuadras/status/1841560763447620090","166100601","VidalQuadras"
"1842700713564258315","Sat Oct 05 22:57:40 +0000 2024","6"," Confío en México reconoce a Claudia Sheinbaum y le desea que le vaya bien a la presidenta de México; exige se reconozca de manera cabal lo antes posible el triunfo de Pablo Lemus @PabloLemusN como gobernador de Jalisco https://t.co/x8v8VOj2k2 vía @sdpnoticias","1842700713564258315","","","es","Guadalajara,Jalisco,Mexico","0","2","3","https://x.com/salvadorcosio1/status/1842700713564258315","95238323","salvadorcosio1"
"1842553509755171215","Sat Oct 05 13:12:44 +0000 2024","2847","Si dejas a Mónica Bellucci en vinagre un día entero te sale Claudia Sheinbaum: https://t.co/fbNUe5hCTg","1842553509755171215","https://pbs.twimg.com/media/GZIQNQlWQAAf7x9.jpg","","es","España","48","354","483","https://x.com/MonsieurSansFoy/status/1842553509755171215","477073885","MonsieurSansFoy"
"1841615725733282015","Wed Oct 02 23:06:19 +0000 2024","565","¿De dónde saldrá el dinero que va a invertir Iberdrola en energía renovable en México? De lo que le pagó el gobierno de López Obrador por energía no renovable Fue un buen negocio para los accionistas extranjeros; malo para los contribuyentes mexicanos https://t.co/OJvAGk5yqL","1841615725733282015","","","es","","4","12","266","https://x.com/CiroMurayamaMx/status/1841615725733282015","2958900403","CiroMurayamaMx"
"1841180757596713167","Tue Oct 01 18:17:54 +0000 2024","6326","#BREAKINGNEWS: Claudia Sheinbaum makes history and officially becomes the first female president of Mexico. 🇲🇽 #LIVE updates here: https://t.co/koHXO44KkR https://t.co/Ph3hgjjqBZ","1841180757596713167","https://pbs.twimg.com/media/GY0wJFQXcAQqHXP.jpg","","en","","130","258","1067","https://x.com/ABC7/status/1841180757596713167","16374678","ABC7"
"1841582473915797894","Wed Oct 02 20:54:11 +0000 2024","3","Noticia Relevante #Litio #ciberseguridad e #IA las prioridades tecnológicas de @Claudiashein en su sexenio Un texto de @Al3x_reporter: https://t.co/MTyxfyuK6L","1841582473915797894","","","es","","0","0","1","https://x.com/dpl_news/status/1841582473915797894","143988782","dpl_news"
"1841221820847972803","Tue Oct 01 21:01:04 +0000 2024","2","#México | @Claudiashein nombra a Emiliano Calderón como titular de CFE TEIT Todos los detalles por @Al3x_reporter: https://t.co/b6tkhmdIxs","1841221820847972803","","","es","","0","0","0","https://x.com/dpl_news/status/1841221820847972803","143988782","dpl_news"
"1842253800653861142","Fri Oct 04 17:21:48 +0000 2024","9","#LasEncuestas El apoyo popular a Sheinbaum. ¿Quiénes respaldan más a la presidenta y cómo se diferencia su apoyo del de AMLO? https://t.co/yhkI7U3G6H","1842253800653861142","","","es","Mexico","0","3","8","https://x.com/almorenoal/status/1842253800653861142","946901479","almorenoal"
"1841248065023300062","Tue Oct 01 22:45:22 +0000 2024","15","️Les invito a conversar con las colegas de la @RedPolitologas sobre un momento histórico de la historia de #México: por primera vez una mujer la Dra. Claudia Sheinbaum asume la Presidencia de la República después de tantos años de trabajo arduo de muchísimas mexicanas para","1841248065023300062","","","es","Ciudad de México","0","0","4","https://x.com/flaviafrei/status/1841248065023300062","156351223","flaviafrei"
"1841871694492737565","Thu Oct 03 16:03:26 +0000 2024","3","#LoMásLeído en #México 🇲🇽 | @Claudiashein nombró a Emiliano Calderón como titular de CFE TEIT Todos los detalles por @Al3x_reporter: https://t.co/b6tkhmdIxs","1841871694492737565","","","es","","1","0","0","https://x.com/dpl_news/status/1841871694492737565","143988782","dpl_news"
"1840973235631890757","Tue Oct 01 04:33:17 +0000 2024","2","AMLO hereda a Jesús Ramírez al gobierno de Sheinbaum; será coordinador de asesores. https://t.co/XNXp3EjyXL a través de @pajaropolitico","1840973235631890757","","","es","","0","1","3","https://x.com/dmorenochavez/status/1840973235631890757","190143362","dmorenochavez"
"1842656251701854322","Sat Oct 05 20:00:59 +0000 2024","30","#Video ▶️ | Sheinbaum reprocha que 'ama de casa' se utilice como algo peyorativo https://t.co/SedHd4vrNS","1842656251701854322","","","es","Ciudad de México","0","24","2","https://x.com/AristeguiOnline/status/1842656251701854322","520653311","AristeguiOnline"
"1842715392684314701","Sat Oct 05 23:56:00 +0000 2024","1","🇲🇽La presidenta Claudia #Sheinbaum atiende una agenda pendiente en materia de #seguridad equidad de género y otros temas. #MesaDeAnálisis con: @Yoeliramirez @AlbertoBello_mx Dir. de Enfoque Noticias y Luis Miguel González Dir. Editorial @eleconomista Sábado 21:00 horas https://t.co/PkQFlBOSfg","1842715392684314701","https://pbs.twimg.com/ext_tw_video_thumb/1842353014977314816/pu/img/GLv4qsG74f_-Cw-_.jpg","","es","Ciudad de México","0","0","1","https://x.com/MeganoticiasMx/status/1842715392684314701","104315704","MeganoticiasMx"
"1842409253534896164","Sat Oct 05 03:39:31 +0000 2024","215","En su primera gira pública la presidenta @Claudiashein refirió que el poder del pueblo reconocido en el articulo 39 constitucional permitió la reforma para que sean electos jueces magistrados y ministros del Poder Judicial. Info: https://t.co/GfTX2Jzz1r https://t.co/aHVxjtZwe3","1842409253534896164","https://pbs.twimg.com/amplify_video_thumb/1842408467295772672/img/PLsA28Po3G6Y8Lu6.jpg","","es","México","1","9","84","https://x.com/lajornadaonline/status/1842409253534896164","35977487","lajornadaonline"
"1842686350287380485","Sat Oct 05 22:00:36 +0000 2024","3","Claudia Sheinbaum lanzó propuestas enfocadas a salvaguardar a las mujeres; además prometió continuidad en el área económica durante su gobierno. ¿Cómo será su mandato? https://t.co/NTMUrkUU2P","1842686350287380485","","","es","Mexico","0","0","0","https://x.com/Gatopardocom/status/1842686350287380485","216807756","Gatopardocom"
"1842384329457930413","Sat Oct 05 02:00:28 +0000 2024","0","#LoMásLeído #Litio #ciberseguridad e #IA las prioridades tecnológicas de @Claudiashein en su sexenio Leer en: https://t.co/MTyxfyuK6L","1842384329457930413","","","es","","0","0","0","https://x.com/dpl_news/status/1842384329457930413","143988782","dpl_news"
"1842701850795012202","Sat Oct 05 23:02:11 +0000 2024","1","La presidenta Claudia Sheinbaum (@Claudiashein) conversa vía telefónica con Joe Biden. Más información en #ImagenNoticias #ImagenInformativa https://t.co/tvkVLvZgsn","1842701850795012202","https://pbs.twimg.com/ext_tw_video_thumb/1842701820122091520/pu/img/5CtbrIuhUxu9SZkc.jpg","","es","","1","0","0","https://x.com/ImagenTVMex/status/1842701850795012202","780103512155824128","ImagenTVMex"
"1841614184535949793","Wed Oct 02 23:00:11 +0000 2024","57","#FactChecking En su discurso la presidenta @Claudiashein dijo a los trabajadores del Poder Judicial que sus derechos y salarios están totalmente salvaguardados Este dicho es engañoso porque sí resultarían afectados con la #ReformaJudicial. https://t.co/sbUG1KjMUy","1841614184535949793","","","es","México DF","1","0","42","https://x.com/ElSabuesoAP/status/1841614184535949793","2988152505","ElSabuesoAP"
"1841180850094031205","Tue Oct 01 18:18:16 +0000 2024","2"," Nos dedicaremos a administrar la abundancia dice Claudia Sheinbaum en su toma de posesión","1841180850094031205","","","es","Estamos en todas partes","0","0","1","https://x.com/kontrakapital_/status/1841180850094031205","624955626","kontrakapital_"
"1841597384918499574","Wed Oct 02 21:58:41 +0000 2024","2","En México ¿cómo vamos? hacemos un recuento de las condiciones de finanzas públicas en las que se encuentra el país de cara al sexenio de @Claudiashein. ¿Cómo inicia el sexenio de la presidenta Claudia Sheinbaum? Volumen 3: Finanzas públicas ️https://t.co/wDXzRQ3fcU https://t.co/sutyC6nsSw","1841598705587388519","https://pbs.twimg.com/media/GY6sKy_bAAAhaxV.jpg","MexicoComoVamos","es","México","0","0","3","https://x.com/MexicoComoVamos/status/1841598705587388519","561376286","MexicoComoVamos"
"1842711869464711286","Sat Oct 05 23:42:00 +0000 2024","0","PEN Internacional hace un llamado urgente a Claudia Sheinbaum para que garantice la libertad de expresión https://t.co/en6Oth585t","1842711869464711286","","","es","México","0","0","0","https://x.com/saladeprensa/status/1842711869464711286","85130724","saladeprensa"
"1842699673183654327","Sat Oct 05 22:53:32 +0000 2024","0","La presidenta Claudia Sheinbaum (@Claudiashein) asegura estar pendiente del conflicto entre Líbano e Israel. Más información en #ImagenNoticias #ImagenInformativa https://t.co/8tlAwhFK8w","1842699673183654327","https://pbs.twimg.com/ext_tw_video_thumb/1842699640849801217/pu/img/MF3pMSv1XktRWVR4.jpg","","es","","1","0","0","https://x.com/ImagenTVMex/status/1842699673183654327","780103512155824128","ImagenTVMex"
"1842701299944710643","Sat Oct 05 23:00:00 +0000 2024","2","Presidenta Claudia Sheinbaum anuncia la nueva beca universal Rita Cetina Gutiérrez para estudiantes de educación básica. @Claudiashein; @SEP_mx; @laura_roldn #ValkiriaOnLine® Leer:⬇️ https://t.co/8i4WxJcDHb https://t.co/E7xrMIsrWm","1842701299944710643","https://pbs.twimg.com/media/GZGYJ04bMAAR-8h.jpg","","es","San Martín Texmelucan, Puebla","0","0","2","https://x.com/valkiriaonline/status/1842701299944710643","205941878","valkiriaonline"
