"conversation_id_str","created_at","favorite_count","full_text","id_str","image_url","in_reply_to_screen_name","lang","location","quote_count","reply_count","retweet_count","tweet_url","user_id_str","username"
"1847722133465514375","Sat Oct 19 19:31:00 +0000 2024","1","El PJ y sus inamovibles jueces retan al pueblo con sus defensas legulellas y artilugios panfletarios Quieren destituir a la Presidenta Tenemos la seguridad d q no procede Provoquen y el pueblo se unirá por Claudia como lo hizo por AMLO La judicatura debe ponerlos en su realidad","1847722133465514375","","","es","Tepic, Nayarit","0","0","0","https://x.com/F_VazPer/status/1847722133465514375","810223373414526976","F_VazPer"
"1847333549273215465","Fri Oct 18 17:46:54 +0000 2024","2174","#SiguesTuCalderón LLORA @CiroGomezL porque @Claudiashein no le va a hacer caso a los Porros de Piña y va a continuar con la Reforma Judicial del Pueblo Y le faltan el respeto al denigrar y equiparar a nuestra presidenta con un borracho que se pasa un alto y dice que no va a https://t.co/2Mdt6eSO1i","1847333549273215465","https://pbs.twimg.com/ext_tw_video_thumb/1847332970949988352/pu/img/mSepzzcYp32hn7Lf.jpg","","es","La Gran Tenochtitlán ","47","483","911","https://x.com/catrina_nortena/status/1847333549273215465","1485672890771070981","catrina_nortena"
"1847749145555324996","Sat Oct 19 21:18:20 +0000 2024","8","Salvador Borrego Ph. D. 19-X-2024 LA MESA GRILLERA DE SABA Temas: 1.Genaro García Luna ¿Quién sigue? ¿AMLO o Calderón? 2.¿Es Claudia? 3.¡El drama humano de los jueces ministros y magistrados https://t.co/X4BzkI8J1v","1847749145555324996","","","es","","0","0","4","https://x.com/SalvadorBorre10/status/1847749145555324996","1388333330660159495","SalvadorBorre10"
"1847460287017804024","Sat Oct 19 02:10:31 +0000 2024","1481","Los tabasqueños felices con la Presidenta @Claudiashein Se ve hermosa con la blusa de tira bordada de Tabasco la tierra de nuestro AMLO️ Vamos a guardar su legado de este gran tabasqueño que le dio tanto a nuestro país y al mundo ¡Que viva Tabasco! ¡Que viva México! https://t.co/eW8RqJ2kks","1847460287017804024","https://pbs.twimg.com/amplify_video_thumb/1847459228975288320/img/JER3CwRSmB8Y4jn9.jpg","","es","","4","54","551","https://x.com/andreitav92/status/1847460287017804024","1458887244618420224","andreitav92"
"1847855159293964621","Sun Oct 20 04:19:36 +0000 2024","5","Aviso importante para todos los de esta comunidad en X y las fuerzas de red AMLO Claudia en el segundo piso catrina norteña amlovers Epigmenio 4T para que sigamos apoyando esta iniciativa de juicio político a estos jueces corruptos y vayamos a firmar juicio político","1847855159293964621","","","es","","0","0","4","https://x.com/pacocn0666/status/1847855159293964621","1582266576077742081","pacocn0666"
"1847727635314397453","Sat Oct 19 19:52:52 +0000 2024","1454","¡AMLO no ha dejado de luchar! Así lo afirmó nuestra presidenta @Claudiashein él se fue a Palenque está escribiendo un libro sobre la grandeza cultural de México que radica en nuestros pueblos originarios . https://t.co/byzF2ZHmSo","1847727635314397453","https://pbs.twimg.com/ext_tw_video_thumb/1847726727050473472/pu/img/hFixUlrG1jfKsjvX.jpg","","es","Mexico","1","37","554","https://x.com/Mike_Oviedo/status/1847727635314397453","84953920","Mike_Oviedo"
"1847682631707873495","Sat Oct 19 16:54:02 +0000 2024","0","AMLO le sacó 18 y 24 millones a Canallin y al Meado sacó el 53% de los que votaron Claudia le sacó 20 millones a la Botarga y sacó 35 millones de votos y resulta que los malos perdedores usan al poder judicial para desconocer a bas cámaras y al poder Ejecutivo?","1847682631707873495","","","es","México","0","0","0","https://x.com/jepeal_48/status/1847682631707873495","436130702","jepeal_48"
"1847867463553233162","Sun Oct 20 05:08:29 +0000 2024","0","Tuvimos la oportunidad de solicitar el ingreso a los BRICS pero con #AMLO y CLAUDIA HELLMANS 🇮🇱️","1847867463553233162","","","es","","0","0","0","https://x.com/eccehomo777/status/1847867463553233162","3402266699","eccehomo777"
"1847769254914908196","Sat Oct 19 22:38:14 +0000 2024","4","FUIMOS 30 MILLONES CON AMLO ALCANZAMOS 35 MILLONES CON CLAUDIA Y SUBIREMOS SUBIREMOS SUBIREMOS...","1847769254914908196","","","es","Querétaro, Qro.","0","0","2","https://x.com/Migueliz8/status/1847769254914908196","1015772541124833282","Migueliz8"
"1848062059495239916","Sun Oct 20 18:01:44 +0000 2024","0","CAMPECHANEANDO SÁBADO! CLAUDIA DA NOTICIÓN ¡AMLO HARÁ ESTO DENTRO DE 3 A... https://t.co/QUNYUfvdpO a través de @YouTube","1848062059495239916","","","es","los angeles","0","0","0","https://x.com/fernand103/status/1848062059495239916","330794832","fernand103"
"1847650807484703218","Sat Oct 19 14:47:34 +0000 2024","1","NarcoSocio de Claudia-AMLO Presidente Colombiano Gustavo Petro ofrece comprar con dinero del gobierno toda la producción de coca y financiar guerrilleros y carteles https://t.co/YB4eareanx #Colombia @petrogustavo #narcoestado #guerrilla #ComunismoesSatanismo","1847650807484703218","","","es","#Juárez - #ElPaso - #Chihuahua","0","0","1","https://x.com/LaPolaka/status/1847650807484703218","35073475","LaPolaka"
"1847638378176770322","Sat Oct 19 13:58:11 +0000 2024","1789","Supongamos que Claudio X y Norma Piña vs la razón y la Constitución lograrán destituir a @Claudiashein y en el colmo de la locura encarcelarla. Aunque eso jamás va a suceder yo digo como AMLO: anotenme en la lista. Yo con mi presidentA me iría a la cárcel. Y tu? Que harías?","1847638378176770322","","","es","Mexico","61","635","895","https://x.com/epigmenioibarra/status/1847638378176770322","54649261","epigmenioibarra"
"1846712971273060754","Thu Oct 17 00:40:57 +0000 2024","539","Esta mujer Boluarte haciendo todo lo posible por pasar a la historia de la infamia como la más miserable primera presidenta: corrupta asesina y anti-mujeres y niñas.","1846712971273060754","","","es","Peru","0","11","186","https://x.com/claudiacisneros/status/1846712971273060754","32532614","claudiacisneros"
"1847990052309143894","Sun Oct 20 13:15:37 +0000 2024","1","Son actos consumados pero EN DESACATO porque existía una orden judicial ANTES DE LA PUBLICACIÓN por lo que el acto consumado causa Invalidez. Es por eso que si puede un juez actuar al respecto. AMLO publicó en desacato y ahora Claudia le sigue sin acatar. La ley a todos","1847990052309143894","","","es","Orizaba, Veracruz de Ignacio d","0","0","0","https://x.com/laehsamuel/status/1847990052309143894","117201462","laehsamuel"
"1847783705831756240","Sat Oct 19 23:35:40 +0000 2024","1","Sería bueno que como hacia AMLO Claudia empezará a mostrar todos los jueces y juezas que idioticamente se obstinen en romper la ley dando amparos ilegales contra la constitución.","1847783705831756240","","","es","","0","0","0","https://x.com/mayapipil/status/1847783705831756240","2390172864","mayapipil"
"1847471020787015859","Sat Oct 19 02:53:10 +0000 2024","4","1.- amlo 2.- claudia sheinbaum 3.- fernández noroña Así en minúsculas","1847471020787015859","","","es","","0","0","5","https://x.com/AdrianaLL011/status/1847471020787015859","1245787254288789509","AdrianaLL011"
"1847623916614787320","Sat Oct 19 13:00:43 +0000 2024","1","La présidente mexicaine Claudia Sheinbaum tous les matins comme son prédécesseur AMLO répond aux journalistes pendant 3h pour être transparente sur sa politique et ce qu elle fait pour le pays. Macron à voulu le faire. il est tellement lâche qu il l a fait ZÉRO fois","1847623916614787320","","","fr","Paris, France","0","0","0","https://x.com/ohleshistoires/status/1847623916614787320","953203279579762688","ohleshistoires"
"1847835089171882357","Sun Oct 20 02:59:51 +0000 2024","252","Los fachos dicen quien autorizó al president@ a realizar cambios en la Constitución? digo que a AMLO y Claudia Sheinbaum le otorgamos esa facultad 67 millones de votos ellos como justifican que con 250 mil votos de diferencia @FelipeCalderon Cambio 110 veces la Constitución?","1847835089171882357","","","es","","0","4","132","https://x.com/NanoDante6/status/1847835089171882357","1585796313848897539","NanoDante6"
"1847738930516676888","Sat Oct 19 20:37:45 +0000 2024","1","**La Mañanera** ya es una institución social de comunicación. Meca del periodismo independiente. Muro de lamentos de medios corporativos. De la 4t de AMLO de Claudia y de México para el mundo.","1847738930516676888","","","es","En Edo Mex y en CDMX. ","0","0","0","https://x.com/pgtecnol/status/1847738930516676888","184666653","pgtecnol"
"1848099369851244590","Sun Oct 20 20:30:00 +0000 2024","6","Claudia Sheinbaum y AMLO prometieron cambiar México pero lo que hemos visto es un desprecio constante por el Estado de derecho. ¿Hasta cuándo? #ClaudiaEnDesacato #NarcoExPresidente #MorenaDestruyendoAMexico #NarcoExPresidenteAMLO #NarcoPresidentaEspuriaClaudia #NarcoAMLO","1848099369851244590","","","es","","0","0","4","https://x.com/laexrepublica/status/1848099369851244590","1305693056742588416","laexrepublica"
"1848029558227743077","Sun Oct 20 15:52:36 +0000 2024","282"," Uyyy!! ESA ES LA CLASE DE GOBIERNOS PNDJOS QUE RATIFICARON LOS RESENTIDOS DE SU PROPIA JODIDES. LA EXTORSIÓN SE LLEVA EL PREMIO EN LOS ESTADOS GOBERNADOS POR MUGREÑA. Disfruten lo Votado maskotas!! #ClaudiaEnDesacato https://t.co/3qkZLuC2k3","1848029558227743077","https://pbs.twimg.com/ext_tw_video_thumb/1848029512820244480/pu/img/uDYgIqNC-zkekmX9.jpg","","es","Durango, México","6","18","215","https://x.com/Baldo04555156/status/1848029558227743077","1378845380960419845","Baldo04555156"
"1847784825891278994","Sat Oct 19 23:40:07 +0000 2024","0","LOS POLOS OPUESTOS: JAVIER MILEI - LIBERTARIO ECONOMISTA ULTRADERECHA Pte. de ARGENTINA. SALIENDO del TÚNEL OSCURO del SOCIALISMO. AMLO/CLAUDIA - TIRANO DICTADOR ABOGADO/CIENTÍFICA. ULTRAIZQUIERDA ENTRANDO al TÚNEL OSCURO del SOCIALISMO.","1847784825891278994","","","es","Guadalupe, Nuevo León","0","0","0","https://x.com/Bc8Dh/status/1847784825891278994","4691061792","Bc8Dh"
"1847867229016060184","Sun Oct 20 05:07:33 +0000 2024","526","NO PUEDE SER Carlos Ballarta hizo emp*tar a José Ramón López Beltrán y El George Harris va a hacer emp*tar a la BICHA digo a la espuriA Claudia Sheinbaum y al Narcopresidente AMLO No chinguen Todo México después de 15 no menos 19 días disfruten https://t.co/s5msuZOF1J","1847867229016060184","https://pbs.twimg.com/amplify_video_thumb/1847298723069796352/img/kZp3kvkIsExQ4-YV.jpg","","es","Rancho ""La Desesperanza""","2","0","232","https://x.com/ImpudorPolitico/status/1847867229016060184","1196542901993398272","ImpudorPolitico"
"1848057228101591040","Sun Oct 20 17:42:33 +0000 2024","0","... LA PAJA EN EL OJO AJENO!... AMLO &amp; CLAUDIA critican a CALDERÓN por su guerra al NARCO. Uno por EXCESO y el otro por DEFECTO.....están IGUAL! Critican a la LA CORTE por sus PRIVILEGIOS. El EJECUTIVO tiene el PRIVILEGIO de COMPRAR y COMANDAR AL EJÉRCITO.","1848057228101591040","","","es","Guadalupe, Nuevo León","0","0","0","https://x.com/Bc8Dh/status/1848057228101591040","4691061792","Bc8Dh"
"1847697378645590369","Sat Oct 19 17:52:38 +0000 2024","903","Desde #Escárcega su casa le dimos la bienvenida a nuestra presidentA @Claudiashein quien vino a hablarnos sobre los Programas para el Bienestar (@apoyosbienestar). Llegó el #TrenMaya y fue como una caricia al alma porque nos sentíamos un pueblo herido y olvidado y en lugar https://t.co/nKUOoEl93z","1847697378645590369","https://pbs.twimg.com/amplify_video_thumb/1847693947709075456/img/qcLH4OxY8PLp05ll.jpg","","es","Campeche ","3","47","380","https://x.com/LaydaSansores/status/1847697378645590369","195537412","LaydaSansores"
"1847715948641292429","Sat Oct 19 19:06:25 +0000 2024","0","¿ Que sabrá hacer tan bien el Presidente Calderón que tanto a AMLO como a Claudia nada mas la de EL les cabe ?.@lopezobrador_ @Claudiashein @CitlaHM @mario_delgado @EsDeNorona @JesusRCuevas @lumendoz @adelamicha1 @AnaPOrdorica @rivapa @PamCerdeira @PabloMajluf @JLozanoA.","1847715948641292429","","","es","","0","0","1","https://x.com/f84362722/status/1847715948641292429","1822028912899358720","f84362722"
"1846930448112296344","Thu Oct 17 15:05:07 +0000 2024","1808","#OJO | ¡ES MUY CÍNICO! ¿COMO QUE CALDERÓN VOLVERÍA A PONER A GARCÍA LUNA? Acaba de REMATAR la Presidenta @Claudiashein a lo que queda del espurio panista de Felipe Calderón. https://t.co/N2E3DkYYEt","1846930448112296344","https://pbs.twimg.com/amplify_video_thumb/1846930360015192064/img/oXhO65UCH2J9R7EB.jpg","","es","Tabasco | CDMX","5","144","733","https://x.com/YosoyPedrero/status/1846930448112296344","731142063916343297","YosoyPedrero"
"1847012963720614082","Thu Oct 17 20:33:01 +0000 2024","300","Cuanta razón tenia mi querido Presidente @lopezobrador_ al decirnos que la Presidenta @Claudiashein es una mujer honesta inteligente humana muy capaz patriota y cercana al pueblo. #ClaudiaLujoDePresidenta ️ https://t.co/R4iDr2hzrY","1847012963720614082","https://pbs.twimg.com/media/GaD14GUb0AUXupC.jpg","","es","","2","5","138","https://x.com/Humanismo4T/status/1847012963720614082","1699595648671051776","Humanismo4T"
"1848009822412955942","Sun Oct 20 14:34:10 +0000 2024","818"," AMLO no ha dejado de luchar : La presidenta @Claudiashein aseguró que @lopezobrador_ está escribiendo un libro sobre la grandeza cultural de México que radica en nuestros pueblos originarios https://t.co/ovnw0KKPZe","1848009822412955942","https://pbs.twimg.com/ext_tw_video_thumb/1847684769536163840/pu/img/2ioP5VbnE9bH0zg_.jpg","","es","Ciudad de Mexico","6","52","260","https://x.com/Rocha4T/status/1848009822412955942","2302035528","Rocha4T"
"1846959365313466485","Thu Oct 17 17:00:02 +0000 2024","10"," Tenemos una estrategia de seguridad que va a funcionar asegura Claudia Sheinbaum a 5 años del Culiacanazo https://t.co/29Qptzz704","1846959365313466485","","","es","Centro de la Ciudad de México","1","10","2","https://x.com/El_Universal_Mx/status/1846959365313466485","16676396","El_Universal_Mx"
"1847977345585447150","Sun Oct 20 12:25:07 +0000 2024","0"," #ULTIMAHORA El #NarcoExPresidente AMLO (@lopezobrador_) y la #Presirvienta Claudia Sheinbaum (@Claudiashein) afirmaron que las narcotráfico remesas del bienestar eran un mito. ¡A ver quién se traga eso #ChairosPENDEJOS! @PartidoMorenaMx https://t.co/MYPYDEKpff","1847977345585447150","","","es","Raleigh","0","0","0","https://x.com/celestexsiempr6/status/1847977345585447150","713032921129566210","celestexsiempr6"
"1847351968206893278","Fri Oct 18 19:00:06 +0000 2024","3558","Dice Claudia que el pueblo quiere destruir la Corte y que una jueza no está por encima del pueblo. Qué creen? El pueblo no quiere pagar impuestos y nada está por encima del pueblo. ️","1847351968206893278","","","es","CDMX","9","127","853","https://x.com/SimonPedro2024/status/1847351968206893278","1679615144752476160","SimonPedro2024"
"1848084270033580445","Sun Oct 20 19:30:00 +0000 2024","0","Es curioso cómo Claudia Sheinbaum y AMLO siempre tienen una excusa cuando se trata de violar la ley. ¿Hasta cuándo este doble discurso? #ClaudiaEnDesacato #NarcoExPresidente #MorenaDestruyendoAMexico #NarcoExPresidenteAMLO #NarcoPresidentaEspuriaClaudia #NarcoAMLO #Morena","1848084270033580445","","","es","","0","0","0","https://x.com/laexrepublica/status/1848084270033580445","1305693056742588416","laexrepublica"
"1847841968107159996","Sun Oct 20 03:27:11 +0000 2024","6","segun ANABEL HERNADEZ la gente que la increpo al salir de la corte en Nueva York fue un montaje de @lopezobrador_ y de @Claudiashein. ¿en serio la estupida de ANABEL HERNANDEZ cree que es el centro del universo de AMLO y de Claudia para perder su tiempo asi? vaya ego inflado","1847841968107159996","","","es","","0","1","3","https://x.com/OSIRIS2775/status/1847841968107159996","91480003","OSIRIS2775"
"1848020530575577290","Sun Oct 20 15:16:43 +0000 2024","330","Se rumorea que las #Mafin han abierto la pareja y la nueva integrante es Claudia https://t.co/MRDttXl7Jk","1848020530575577290","https://pbs.twimg.com/media/GaV84GfXsAAO75u.jpg","","es","España","4","4","12","https://x.com/CLuimelia/status/1848020530575577290","1118906998614106112","CLuimelia"
"1847416645553442833","Fri Oct 18 23:17:06 +0000 2024","9733","Claudia lleva apenas DIECIOCHO días en el poder y ya anunció que va a desacatar una suspensión definitiva por parte de una juez federal porque en sus palabras ningún juez está por encima de la voluntad del pueblo . O sea según la presidentE si sus clientes digo votantes https://t.co/sUQfLBn2LO","1847416645553442833","https://pbs.twimg.com/media/GaNXpPOW8AE4If9.jpg","","es","","116","767","3487","https://x.com/adikraj1/status/1847416645553442833","1648856478139162626","adikraj1"
"1847810399699103927","Sun Oct 20 01:21:44 +0000 2024","1","Claudia la Loca está dando palos de ciego. Esta creando buscando estimulando una crisis que va llevar a México al desastre. Y por cierto AMLO supuestamente está en la mira de la DEA.","1847810399699103927","","","es","","0","0","0","https://x.com/falcon_force/status/1847810399699103927","49211083","falcon_force"
"1847697127599698292","Sat Oct 19 17:51:38 +0000 2024","536","Sobre Calderón. Con respeto Claudia ¿no crees que Ayn Rand tenga algo de razón? Coincido con el querido @FedericoArreola y voy más allá: yo no he de soltar a Felipe Calderón hasta que lo agarren y como García Luna pague por sus crímenes. Y tú? Leer y RT https://t.co/MLeHTsdLbG","1847697127599698292","","","es","Mexico","11","48","327","https://x.com/epigmenioibarra/status/1847697127599698292","54649261","epigmenioibarra"
"1846970446102909227","Thu Oct 17 17:44:04 +0000 2024","2745","Claudia acusa a Calderón de haber llegado al poder por un fraude (mismo que Claudia demostró con cajas vacías). Pero ella llegó por una elección de Estado que contraviene la regla esencial de una elección democrática: el candidato oficial no puede recibir recursos de estado. https://t.co/T0725Gso8X","1846970446102909227","https://pbs.twimg.com/media/GaHB1Vkb0AMmtf_.jpg","","es","","47","45","1591","https://x.com/JACrespo1/status/1846970446102909227","1363739047","JACrespo1"
"1847263017496453147","Fri Oct 18 13:06:38 +0000 2024","787","Atribuirle agencia política autónoma a la bailarina de 43 años con quinto grado completo cuyo marido 35 años mayor a quien conoció en un cabarulo la designó sucesora presidencial es un temerario acto de fe.","1847263017496453147","","","es","","9","56","117","https://x.com/lucasllach/status/1847263017496453147","137568918","lucasllach"
"1847755270354788485","Sat Oct 19 22:48:46 +0000 2024","37","@vissaeusmorenae Todos esos orangutanes con toga están para acatar la constitución no para interpretarla doblarla o torcerla según les convenga. A como pintan las cosas Claudia no será igual de blandita que nuestro querido AMLO. Muy pronto pagarán muy caro su estupidez hermano.","1847771903043203368","","vissaeusmorenae","es","Puerto Vallarta, Jalisco","0","2","17","https://x.com/LouisSvarg/status/1847771903043203368","1513389100291739653","LouisSvarg"
"1847810462764966128","Sun Oct 20 01:21:59 +0000 2024","707","No nos cabe la menor duda de que nadie mejor que @Claudiashein para entendernos y para querernos porque ella sabe de luchas viene de luchar por la igualdad por la equidad y por la justicia cuando en este país era un puñado el que arriesgaba la libertad para inscribirse en la https://t.co/yFUu549apY","1847810462764966128","https://pbs.twimg.com/media/GaS9y0sWkAAj4B2.jpg","","es","Campeche ","4","60","294","https://x.com/LaydaSansores/status/1847810462764966128","195537412","LaydaSansores"
"1847662196332875870","Sat Oct 19 15:32:50 +0000 2024","9","¡Claudia igual que amlo no quiere cumplir con la ley! ","1847662196332875870","","","es","Greater Vancouver A, British C","0","0","7","https://x.com/ruleslogi/status/1847662196332875870","1245890123218051075","ruleslogi"
"1846692392574791811","Thu Oct 17 17:48:58 +0000 2024","624","@LillyTellez ¡Ah bárbara Lily Téllez! Celebras la sentencia de García Luna y no podrías hacer otra cosa pues nadie con un mínimo de integridad podría lamentar que la justicia por fin alcance a los corruptos. Pero en tu deseo de arrastrar a Andrés Manuel López Obrador con él sólo","1846971682277543992","","LillyTellez","es","CDMX ","6","61","208","https://x.com/artemisalopezc/status/1846971682277543992","477891549","artemisalopezc"
"1847333063837057355","Fri Oct 18 17:44:58 +0000 2024","6014","🇲🇽DIFUNDAN por FAVOR🇲🇽 Este DOMINGO 2️⃣0️⃣ de OCTUBRE a las 11 am en el Ángel de la Independencia. #ClaudiaEnDesacato https://t.co/8t4o7DkBZs","1847333063837057355","https://pbs.twimg.com/media/GaMLoSKWIAA7EQm.jpg","","es","Mexico","75","486","4380","https://x.com/PazConDialogo/status/1847333063837057355","91870046","PazConDialogo"
"1847478988161057215","Sat Oct 19 03:24:49 +0000 2024","2895","Les dije que Claudia era más estúpida y peligrosa que López Obrador y no me equivoqué. Olviden que alguna vez hubo Estado de derecho en México. Ya no existe se acabó. Estamos atrapados en las garras de orangutanes. Punto.","1847478988161057215","","","es","19.569300,-99.326335","12","306","733","https://x.com/LOVREGA/status/1847478988161057215","249812258","LOVREGA"
"1847104297147805878","Fri Oct 18 02:35:56 +0000 2024","3634","Ahora resulta que Claudia estuvo casada 30 años con Carlos Imaz y no sabía que él era un corrupto que recibía dinero ilegal Debería pedir perdón no? https://t.co/RzccM6a7wl","1847104297147805878","https://pbs.twimg.com/media/GaI7kSYWMAEoBLj.jpg","","es","","31","54","2147","https://x.com/BrujoAnti/status/1847104297147805878","4458914539","BrujoAnti"
"1847330095570043103","Fri Oct 18 17:33:11 +0000 2024","979","La Presidenta Claudia no sólo tiene el respaldo del pueblo de México también tiene la misión de cumplir los sueños de AMLO y por eso cree que está por encima de la Constitución!","1847330095570043103","","","es","México ","4","26","204","https://x.com/avieu/status/1847330095570043103","80144254","avieu"
"1847343992880689627","Fri Oct 18 18:28:24 +0000 2024","3503","Fácil @Claudiashein Tu no cumples la ley. Nosotros tampoco. 65 millones de mexicanos no votaron por ti. Acabas de reunirte con los gringos y sigues sin darles certeza. No eres AMLO. No te alcanza. No tienes ni un mes en el cargo y el país te explota en las manos.","1847343992880689627","","","es","Listenbourg","24","228","1467","https://x.com/AliciaAlarcon/status/1847343992880689627","24659463","AliciaAlarcon"
"1847337515541549552","Fri Oct 18 18:46:40 +0000 2024","542","@Claudiashein La voluntad del pueblo también le dió permiso a tu esposo Carlos Ímaz de agarrar moches? Y decías que no querías controlar el Poder Judicial pinche gata autoritaria. https://t.co/fSW8aW1pKd","1847348587836870927","https://pbs.twimg.com/ext_tw_video_thumb/1847348579741908992/pu/img/XOXHnsjDNI2lFEjW.jpg","Claudiashein","es","Bangkok, Tailandia","3","11","125","https://x.com/comoshingA/status/1847348587836870927","1381404904925888512","comoshingA"
"1847707526101684568","Sat Oct 19 18:32:57 +0000 2024","42","#ElPoderDeLaVerdad | Claudia López Obrador es vicepresidenta; AMLO no se ha ido: Acosta Naranjo - El integrante del Frente Cívico aseguró que el expresidente la tiene sometida . - Prueba de ello es la inclusión del hijo de @lopezobrador_ como secretario de Organización de","1847707526101684568","","","es","Xalapa, Veracruz","0","4","12","https://x.com/alcalorpolitico/status/1847707526101684568","86017565","alcalorpolitico"
"1847499090541576423","Sat Oct 19 04:44:42 +0000 2024","899","Claudia sabe que puede desacatar el mandamiento de un juzgador y no va a pasar nada. La razón es sencilla: no hay autoridad que pueda detener las arbitrariedades de los autócratas. Solo los ciudadanos pueden derrocar a la tiranía pero se necesita mucha valentía. La neta.","1847499090541576423","","","es","19.569300,-99.326335","6","123","294","https://x.com/LOVREGA/status/1847499090541576423","249812258","LOVREGA"
"1847031618759729444","Thu Oct 17 21:47:08 +0000 2024","1056","Enrique Peñalosa lanzó duras críticas contra Claudia López por atribuirse obras con las que nada tuvo que ver . Dice que la exalcaldesa es una mentirosa . https://t.co/if1kX8q65f https://t.co/4DBxX7HNVy","1847031618759729444","https://pbs.twimg.com/ext_tw_video_thumb/1847031566309933056/pu/img/O43qobA0duHlSHZZ.jpg","","es","Colombia","8","66","433","https://x.com/RevistaSemana/status/1847031618759729444","18079284","RevistaSemana"
"1847034783886352483","Thu Oct 17 21:59:43 +0000 2024","2014","Urgenteeeee 🇨🇴 Enrique Peñalosa desenmascara a Claudia López y todas las falsas atribuciones que se toma La mitad de lo que dice es mentira La señora López salió más mentirosa que Gustavo Petro Pilas Colombianos Claudia es Petro y peor ! Vamos a Replicar https://t.co/9q1OJJsaWU","1847034783886352483","https://pbs.twimg.com/ext_tw_video_thumb/1847034747068850176/pu/img/i6yCGv41A2AXmBmD.jpg","","es","BOGOTA","9","37","1152","https://x.com/Rincon001A/status/1847034783886352483","410062576","Rincon001A"
"1847439107745599669","Sat Oct 19 00:46:21 +0000 2024","663","Sra. @Claudiashein ya que usted decidió por sus pistolas DESCONOCER al PODER JUDICIAL nosotros 65 millones de ciudadanos podemos DESCONOCER la VALIDEZ JURÍDICA de su cargo. ¡Qué manera de perder el bono si es que había alguno por el hecho de ser mujer! #SOMOSREDD https://t.co/v1qRpOexos","1847439107745599669","https://pbs.twimg.com/media/GaNsFCVXQAAvSpw.jpg","","es","","6","16","377","https://x.com/CristyP2000/status/1847439107745599669","977655603349934080","CristyP2000"
