"conversation_id_str","created_at","favorite_count","full_text","id_str","image_url","in_reply_to_screen_name","lang","location","quote_count","reply_count","retweet_count","tweet_url","user_id_str","username"
"1858956459897483766","Tue Nov 19 19:32:12 +0000 2024","3797","Que Claudia haya pedido reorientar presupuesto utilizado en armamento hacia la reforestación y sustentabilidad del planeta después de que en México le metió más lana a la SEDENA y deforestó la selva Maya es hipócrita e indignante. Pero los chairos no conocen la dignidad.","1858956459897483766","","","es","Madrid/CDMX ","7","66","1243","https://x.com/MariettoPonce/status/1858956459897483766","960607092557180929","MariettoPonce"
"1858545730085908881","Mon Nov 18 18:44:51 +0000 2024","415","@arlinmedrano_ @Claudiashein Ojalá y no piensen que todas las mujeres mexicanas somos tan p3nd3j4s como la calca. Por educación la saludaron no porque sea una eminencia y una mujer segura de sí misma.","1858582157897461946","","arlinmedrano_","es","","0","6","38","https://x.com/Elizabe97472369/status/1858582157897461946","1266043383870640129","Elizabe97472369"
"1858327544585507098","Mon Nov 18 01:53:07 +0000 2024","376","No la he visto desde hace más de un año y en 13 horas más la podré abrazar. Viene volando hacia Chile y me ha avisado hace unas horas. Qué nervios pero felices nervios. Mi única hija mujer mi niñita viajera que con su cámara en mano me ha hecho viajar y conocer lugares https://t.co/8K5GeZyBqp","1858327544585507098","https://pbs.twimg.com/media/GcobDEvXAAAB3QL.jpg","","es","🎗️🎗️🎗️🇨🇱🇮🇱🇺🇸🇫🇷","4","63","30","https://x.com/ClauDePizan/status/1858327544585507098","432459828","ClauDePizan"
"1858829088359666062","Tue Nov 19 11:06:05 +0000 2024","756","4. Claudia habla con una INGENUIDAD monstruosa. Nivel la parodia de Barbie en los Simpson: Vamos a comer helado y olvídemonos de los problemas . Evidentemente Claudia no entiende un carajo de la complejidad de los conflictos internacionales y cae en el eterno error zurdo.","1858829093652807681","","IrvingGatell","es","Köapen Burg","1","9","128","https://x.com/IrvingGatell/status/1858829093652807681","304958799","IrvingGatell"
"1858883170067747320","Tue Nov 19 14:40:59 +0000 2024","405","...el más mínimo interés (de hecho no se implementó en ningún lado). Tal parece que Claudia tiene la orden de buscar que se cumplan los caprichos que no logró su amo. Lo que más llama la atención es que en la foto oficial siendo la única mujer la pusieron hasta atrás lo...","1858883171229573403","","Francis20772291","es","","0","4","74","https://x.com/Francis20772291/status/1858883171229573403","1257487835550146562","Francis20772291"
"1859644450613624973","Thu Nov 21 17:06:02 +0000 2024","15","La Presidenta Claudia dice que CON LA DESAPARICIÓN del INAI habrá más transparencia y no corrupción: Nos creé idiotas Sheinbáum le urge a usted y los zurdos de mierda cumplir con el caprichos de AMLO ustedes esconderan sus transas el sobrecosto en obras su corrupción....","1859644450613624973","","","es","","0","1","11","https://x.com/gamaride/status/1859644450613624973","309754521","gamaride"
"1858670772551602239","Tue Nov 19 00:36:59 +0000 2024","1112","Por eso López no iba a las reuniones la narrativa de los presidentes más populares del mundo es difícil de sostener lejos de los chairos A Claudia en el avión nadie la pela su discurso aburre y en la foto la mandan hasta atrás De pura suerte no le dieron escoba y recogedor","1858670772551602239","","","es","","1","50","256","https://x.com/_Gabo_N/status/1858670772551602239","243805672","_Gabo_N"
"1859224464057090154","Wed Nov 20 13:17:09 +0000 2024","1561","Mujer científica ambientalista. Mejor que calca autoritaria y bajo sospecha de coludirse con el narco. No hubo sello propio aunque los propagandistas quiera hacerle imagen de ambientalista. Mi columna de hoy en @El_Universal_Mx @Univ_Opinion https://t.co/sJb3SUSzbX","1859224464057090154","","","es","México, DF.","11","118","442","https://x.com/CarlosLoret/status/1859224464057090154","68844197","CarlosLoret"
