"conversation_id_str","created_at","favorite_count","full_text","id_str","image_url","in_reply_to_screen_name","lang","location","quote_count","reply_count","retweet_count","tweet_url","user_id_str","username"
"1863271266771210611","Sun Dec 01 17:17:42 +0000 2024","2","¡3 Autoridades en QUERÉTARO! ahora que El Economista publicó las mediciones de popularidad de Octubre de 2024 para los gobernadores podemos hacer el comparativo de las aprobaciones que logran en esa entidad sus autoridades municipales y la presidentA Claudia Shéinbaum; esta https://t.co/h9ZQnaTTcc","1863271266771210611","https://pbs.twimg.com/media/GdurVkVXAAAXIPh.jpg","","es","México City","0","1","0","https://x.com/RoyCampos/status/1863271266771210611","68036460","RoyCampos"
"1862679103272354043","Sat Nov 30 02:04:39 +0000 2024","680","Millones del pueblo de México saludan y bendicen a la Presidenta @Claudiashein https://t.co/xTIF9kIxUr","1862679103272354043","https://pbs.twimg.com/ext_tw_video_thumb/1862662433002688512/pu/img/tU98U-RnJnl0nsdu.jpg","","es","","6","78","180","https://x.com/AmirIbrahimQRoo/status/1862679103272354043","1358838060","AmirIbrahimQRoo"
"1862830799105499305","Sat Nov 30 12:07:26 +0000 2024","2342","Hoje é aniversário dela. Erundina faz 90 anos. Qualquer coisa que eu diga é muito pouco. Referência politica para milhões de pessoas. Exemplo de dignidade e compromisso com o Poder Popular! Te amo @luizaerundina ! https://t.co/fai3P7ykRk","1862830799105499305","https://pbs.twimg.com/media/GdoavK_XAAEi7AC.jpg","","pt","Rio de Janeiro, Brasil","5","83","229","https://x.com/Glauber_Braga/status/1862830799105499305","65720380","Glauber_Braga"
"1862706133615448066","Sat Nov 30 03:52:04 +0000 2024","1466","LA PRESIDENTA DEL PUEBLO Así recibió el pueblo de Monterrey a la Dra. @Claudiashein (esto no le gusta a la oposición). ‍ https://t.co/kuzPyMIAw2","1862706133615448066","https://pbs.twimg.com/amplify_video_thumb/1862706075545280512/img/bb1Cc0Affk-lRN5o.jpg","","es","","4","126","440","https://x.com/juncalssolano/status/1862706133615448066","899081012172300288","juncalssolano"
"1863169393045189008","Sun Dec 01 10:32:53 +0000 2024","372","Erundina é farol exemplo inspiração. Erundina é a prova de que a política vale a pena e de que precisamos de mais mulheres como ela nesse espaço ainda tão hostil e tão antipovo. Erundina nos lembra que o espaço institucional é apenas um instrumento popular que a escuta https://t.co/koFhJqHKPI","1863169393045189008","https://pbs.twimg.com/media/GdtOr_jXQAAJ0A9.jpg","","pt","Niterói, Brasil","1","10","15","https://x.com/taliriapetrone/status/1863169393045189008","103704608","taliriapetrone"
"1862693835941237098","Sat Nov 30 03:03:12 +0000 2024","219","LULA MELHOR PRESIDENTE ESTOU COM LULA FAZ O L LULA 2026 ATÉ 2030 CHUP@@@ GADUS. https://t.co/aReMnwnbKd","1862693835941237098","https://pbs.twimg.com/media/GdmeKKEXEAA5Me5.jpg","","pt","Niterói,RJBrasil","2","38","46","https://x.com/wwanniacbot/status/1862693835941237098","1587169006041145344","wwanniacbot"
"1863349757239771412","Sun Dec 01 22:29:36 +0000 2024","28","#ULTIMAHORA ViVa! Rocío Nahle primera mujer gobernadora de Veracruz. En el acto protocolario en el Palacio Legislativo de Xalapa estuvieron presentes la presidenta Claudia Sheinbaum y 14 gobernadores. AMLO #DisfrutandoLoVotado","1863349757239771412","","","es","","0","0","20","https://x.com/MONALI4T/status/1863349757239771412","2471183041","MONALI4T"
"1863288586776592883","Sun Dec 01 18:26:31 +0000 2024","0"," Rocío Nahle ( @rocionahle ) toma protesta como gobernadora de #Veracruz; estuvo acompañada de la presidenta presidenta Claudia #Sheinbaum ( @Claudiashein ) https://t.co/lCKHaE7gGi","1863288586776592883","","","es","Ciudad de México","0","0","0","https://x.com/QuadratinMexico/status/1863288586776592883","1663541358","QuadratinMexico"
"1862845790596530184","Sat Nov 30 13:07:01 +0000 2024","643","URGENTE: Ex-primeira-dama cabo-verdiana ataca a primeira-dama de Moçambique e chama-a de hipócrita por viajar para Cabo Verde toda sorridente num momento em que o seu país Moçambique enfrenta a pior crise de sempre. Como é que consegue viajar e sorrir? https://t.co/CU8yAFUsXP","1862845790596530184","https://pbs.twimg.com/media/GdooXo3XoAA6kUc.jpg","","pt","","10","10","180","https://x.com/cesarchiyaya/status/1862845790596530184","1075202172017623040","cesarchiyaya"
"1863280012406763793","Sun Dec 01 17:52:27 +0000 2024","381","El pasado 24 de noviembre Durazno contribuyó con 20.532 votos que hicieron posible la victoria de nuestra fórmula presidencial @OrsiYamandu y @CosseCarolina 🇺🇾 Gracias a quienes confiaron en este camino. Este triunfo no es solo un resultado electoral sino el comienzo de un https://t.co/jWOmXMOzaZ","1863280012406763793","https://pbs.twimg.com/media/GduzSqNXgAASUdN.jpg","","es","Durazno - Montevideo, Uruguay","4","22","77","https://x.com/MatiasFlamant/status/1863280012406763793","1748566587911610368","MatiasFlamant"
"1863265524051845164","Sun Dec 01 16:54:53 +0000 2024","127","🇲🇽Es un honor y distinción acompañar a mi amiga Rocio Nahle García @rocionahle a su toma de protesta como la primera mujer Gobernadora del Estado de Veracruz. También con la presencia de la Presidenta Claudia Sheinbaum. @Claudiashein . Seguimos en la 4T haciendo historia. 🇲🇽 https://t.co/UkJapdLsWd","1863265524051845164","https://pbs.twimg.com/media/GdumHbOWkAAIH_O.jpg","","es","Ciudad De México","2","33","34","https://x.com/TorrucoTurismo/status/1863265524051845164","367312782","TorrucoTurismo"
"1862852579564114296","Sat Nov 30 13:33:59 +0000 2024","894","Hoje é dia de @luizaerundina! 90 anos de uma vida dedicada à luta por um país melhor. Erundina é uma mulher forte a quem eu tenho muita admiração carinho e respeito. Parabéns querida amiga. Saúde! https://t.co/sl2tvQpoPg","1862852579564114296","https://pbs.twimg.com/media/Gdoui4TWUAAs6qf.jpg","","pt","Brasil","2","52","81","https://x.com/MarceloFreixo/status/1862852579564114296","45870897","MarceloFreixo"
"1862656270961918015","Sat Nov 30 00:33:56 +0000 2024","602","Aquí vamos con la Presidenta @Claudiashein rumbo a la Región Centro/Desierto de #Coahuila https://t.co/L1Ea5eYbxo","1862656270961918015","https://pbs.twimg.com/media/Gdl8AU8WkAAz5-P.jpg","","es","Saltillo","5","94","79","https://x.com/manolojim/status/1862656270961918015","133567388","manolojim"
"1863288043332886568","Sun Dec 01 18:24:22 +0000 2024","221","#Nacional La Presidenta @Claudiashein recordó cuando acompañó al expresidente @lopezobrador_ durante su toma de protesta como presidente de México y compartió una fotografía del pasado 1 de octubre cuando ella asumió el cargo. Andrés Manuel López Obrador gran luchador social https://t.co/oa2LrxSWub","1863288043332886568","https://pbs.twimg.com/media/Gdu6l7bWYAA2ZM_.jpg","","es","","1","15","122","https://x.com/SPRInforma/status/1863288043332886568","1494838028690362370","SPRInforma"
"1862807992057401349","Sat Nov 30 10:36:49 +0000 2024","661","Hoje celebramos 90 anos de coragem luta e inspiração dessa paraibana arretada: Luiza Erundina @luizaerundina https://t.co/xdKHCYmhnU","1862807992057401349","https://pbs.twimg.com/media/GdoEYzHW4AAFo7x.png","","pt","Exu - Pernambuco para o mundo","1","19","69","https://x.com/Brunocomunika/status/1862807992057401349","1465854252568432642","Brunocomunika"
"1863222536768475549","Sun Dec 01 14:04:04 +0000 2024","21","Me enlazo a Veracruz donde en Jalapa la Presidenta Claudia Sheinbaum @Claudiashein asistirá a la rendición de protesta de @rocionahle como la primera gobernadora del estado 104.1 FM 103.3 FM - 1500 AM 970 AM @Radio_Formula / #TeleFórmula https://t.co/5tS801cX5r","1863222536768475549","","","es","México","0","0","8","https://x.com/juanbaaq/status/1863222536768475549","49540008","juanbaaq"
"1863234007259042066","Sun Dec 01 14:49:39 +0000 2024","409","Si yo fuera la Presidenta @Claudiashein de inmediato revocaría el nombramiento de evaluadora de jueces del ejecutivo a Vanessa Romero Rocha esposa del opositor @perezricart infiltrado en el movimiento por la derecha. Ojalá @RodrigoImaz le haga saber esto a la Presidenta.","1863234007259042066","","","es","Cuauhtémoc, Distrito Federal","11","49","343","https://x.com/MexJames/status/1863234007259042066","1836011585485332480","MexJames"
"1863338494262681662","Sun Dec 01 21:44:50 +0000 2024","2","Rocío Nahle toma protesta como gobernadora de Veracruz Acompañada por la presidenta Claudia Sheinbaum gobernadores y ministras Rocío Nahle tomó protesta este domingo en Veracruz. https://t.co/agVXyWBi9W","1863338494262681662","","","es","México","1","0","1","https://x.com/ExpPolitica/status/1863338494262681662","380567317","ExpPolitica"
"1863281912879464915","Sun Dec 01 18:00:00 +0000 2024","0","🇲🇽Rocío Nahle rinde protesta como gobernadora de Veracruz en compañia de la presidenta Claudia Sheinbaum https://t.co/dpG3epdFO5","1863281912879464915","","","es","México","0","0","0","https://x.com/Univ_Opinion/status/1863281912879464915","59177051","Univ_Opinion"
"1862672289210175651","Sat Nov 30 01:37:35 +0000 2024","11","Tras finalizar su reunión con familiares de mineros fallecidos en Coahuila la Presidenta Claudia Sheinbaum ahora se dirige a Nuevo León. https://t.co/YCBbz6Fj1o","1862672289210175651","","","es","Av. México Coyoacán 40","0","3","3","https://x.com/Reforma/status/1862672289210175651","27708897","Reforma"
"1863255486600040543","Sun Dec 01 16:15:00 +0000 2024","2807","Yo no he tergiversado nada. La justicia (Corte) la está investigando a usted y a su pareja Claudia López un fiscal delegados ante la Corte de hecho ella rindió interrogatorio. ¿Ya cerraron las investigaciones contra ustedes? La justicia dirá si ustedes son inocentes o no. Yo no","1863255486600040543","","","es","Bogotá, D.C., Colombia","24","159","1406","https://x.com/VickyDavilaH/status/1863255486600040543","242730842","VickyDavilaH"
"1863284427847037249","Sun Dec 01 18:10:00 +0000 2024","8"," Al llegar a la sede del Congreso de Veracruz la presidenta Claudia Sheinbaum fue recibida por Rocío Nahle quien se convierte en la primera mujer en gobernar esta entidad. https://t.co/qS6r4MsdrB","1863284427847037249","","","es","Centro de la Ciudad de México","1","0","3","https://x.com/El_Universal_Mx/status/1863284427847037249","16676396","El_Universal_Mx"
"1862825047259332975","Sat Nov 30 11:44:35 +0000 2024","491","VIVA LUIZA ERUNDINA que hoje completa 90 anos de uma vida dedicada à luta por justiça e igualdade. Mulher socialista e guerreira. Ícone da esquerda exemplo para as novas gerações. https://t.co/QYCCaPC3kE","1862825047259332975","https://pbs.twimg.com/media/GdoU_kcXoAATa3D.jpg","","pt","São Paulo/SP","2","28","68","https://x.com/IvanValente/status/1862825047259332975","112498734","IvanValente"
"1863267727433150852","Sun Dec 01 17:42:21 +0000 2024","327","@Claudiashein Hace seis años llegó al poder el mayor destructor del país. Al tiempo vocera con A @Claudiashein se verá la ruindad de este régimen en la vida de millones de mexicanos que confiaron en el mayor fraude que representan.","1863277471384109301","","Claudiashein","es","Cancún, Q. Roo.","0","3","21","https://x.com/Marimarfgp/status/1863277471384109301","1469487916606971914","Marimarfgp"
"1863222315917402518","Sun Dec 01 14:03:11 +0000 2024","8","Por cada 131 empleos que empresas de #EEUU crean en México en Estados Unidos se generan 333 afirmó la Presidenta Claudia Sheinbaum @Claudiashein #FórmulaNoticias 104.1 FM 103.3 FM - 1500 AM 970 AM @Radio_Formula / #TeleFórmula https://t.co/5tS801cX5r","1863222315917402518","","","es","México","0","0","3","https://x.com/juanbaaq/status/1863222315917402518","49540008","juanbaaq"
"1863244631736996209","Sun Dec 01 15:31:52 +0000 2024","0","Monreal reconoce actuación de presidenta Claudia Sheinbaum ante grandes desafíos nacionales e internacionales https://t.co/Yf6rh0KOcD","1863244631736996209","","","es","Mexico","0","0","0","https://x.com/billieparkernot/status/1863244631736996209","115460880","billieparkernot"
"1863299340061528327","Sun Dec 01 19:09:15 +0000 2024","35","Tras rendir protesta como Gobernadora y acompañada de la Presidenta Claudia Sheinbuam la morenista Rocío Nahle aseguró que no le fallará al pueblo de #Veracruz. https://t.co/QMjFDi6zgW","1863299340061528327","","","es","Av. México Coyoacán 40","6","83","8","https://x.com/Reforma/status/1863299340061528327","27708897","Reforma"
"1863027448583254409","Sun Dec 01 01:08:51 +0000 2024","5"," México va a dar ejemplo al mundo de que somos el único país que va a elegir al Poder Judicial señaló la presidenta Claudia Sheinbaum durante la inauguración de un hospital de salud mental en Orizaba Veracruz. #FórmulaNoticias con Juan Pablo Pérez-Díaz (@perezdiazmx). https://t.co/SiwujQIzrY","1863027448583254409","https://pbs.twimg.com/amplify_video_thumb/1863026852077633536/img/IaPTTxxWyjM_xebR.jpg","","es","Ciudad de Mexico","0","5","2","https://x.com/Radio_Formula/status/1863027448583254409","148372339","Radio_Formula"
"1863044002708144416","Sun Dec 01 02:14:38 +0000 2024","256","La #PresidentA @Claudiashein reconoce la gran labor de @rocionahle reitera que será buena gobernadora y trabajarán en común 2 mujeres UN CAMINO (el de la 4T) #PresidetaClaudia #rocionahle https://t.co/hjjZM55DSP","1863044002708144416","https://pbs.twimg.com/ext_tw_video_thumb/1863043276984434688/pu/img/JoXdvJ2bIIl26d2b.jpg","","es","Corazon ","1","13","70","https://x.com/elitvoficial/status/1863044002708144416","549601908","elitvoficial"
"1863086356924362759","Sun Dec 01 05:02:56 +0000 2024","229","Foi uma mulher @dilmabr Dilma Vanna Rousseff quem enfrentou os resquícios autoritários que ainda rondam o Brasil. Como Presidenta resistiu às pressões e não se submeteu aos interesses dos golpistas militares e civis e de nações como os EUA que buscavam enfraquecer a https://t.co/7mTr7vtAlw","1863086356924362759","https://pbs.twimg.com/media/GdsDKu-WoAAMDGg.jpg","","pt","Rondonópolis, Brasil","1","12","68","https://x.com/arc_maiana/status/1863086356924362759","1478873305402818561","arc_maiana"
"1862966030013792294","Sat Nov 30 21:04:48 +0000 2024","302","90 anos de @luizaerundina referência para a luta democrática e por um país mais justo. É uma honra imensa dividir lutas e ser amiga de Erundina a quem chamo carinhosamente de ErunDIVA! Exemplo de parlamentar de militante e uma figura humana inigualável. Parabéns! https://t.co/dIHyhBrrz4","1862966030013792294","https://pbs.twimg.com/media/GdqUOysWUAA81gk.jpg","","pt","Brasil, Distrito Federal","0","19","22","https://x.com/erikakokay/status/1862966030013792294","87021796","erikakokay"
"1863278464838574494","Sun Dec 01 17:46:18 +0000 2024","862","¡Valera #Trujillo Venezuela y el mundo saben la verdad! El 28 de julio ganamos las elecciones y nuestro presidente electo @EdmundoGU es el legítimo ganador. Las paredes de nuestras calles en Valera gritan la verdad: ¡Edmundo González Urrutia es nuestro presidente! https://t.co/Djd5uqgmwh","1863278464838574494","https://pbs.twimg.com/media/Gdux40pWsAA4uT6.jpg","","es","Venezuela","1","16","397","https://x.com/ConVzlaComando/status/1863278464838574494","2364388706","ConVzlaComando"
"1863079300921966947","Sun Dec 01 04:34:54 +0000 2024","12","En la inauguración del Hospital IMSS Bienestar de Salud Mental de Orizaba Veracruz la presidenta Claudia Sheinbaum anunció que el gobernador saliente Cuitláhuac García se incorpora al gobierno federal. https://t.co/EIaFVsX45P https://t.co/swLDWW2HJR","1863079300921966947","","","es","Mexico City","0","5","4","https://x.com/nmas/status/1863079300921966947","25401359","nmas"
"1863225527617929494","Sun Dec 01 14:15:57 +0000 2024","21","Israel Aldave nos actualiza con los recientes discursos de la presidenta Claudia Sheinbaum quien anuncia la incorporación de un nuevo integrante a su gabinete y aborda diversos temas clave de su administración. #FórmulaNoticias con Juan Becerra Acosta (@juanbaaq). https://t.co/woKuLpeDSZ","1863225527617929494","https://pbs.twimg.com/amplify_video_thumb/1863223413994586112/img/axAG5PkJBcxgzUaz.jpg","","es","Ciudad de Mexico","0","2","4","https://x.com/Radio_Formula/status/1863225527617929494","148372339","Radio_Formula"
"1863210474055065859","Sun Dec 01 13:16:08 +0000 2024","232"," Dilma Rousseff: uma história de luta superação e força feminina De presa política durante a ditadura a presidente do Brasil e agora à frente do BRICS o caminho de Dilma Rousseff é a prova viva de que a vida nos leva a lugares inimagináveis. Uma trajetória marcada pela https://t.co/OHMleCCA7N","1863210474055065859","https://pbs.twimg.com/media/Gdt0DFvW8AAGq_G.jpg","","pt","Rio de Janeiro, Brasil","3","6","53","https://x.com/roberta_bastoss/status/1863210474055065859","1272507913991585793","roberta_bastoss"
"1863019158536897017","Sun Dec 01 00:35:55 +0000 2024","210","La Presidenta @Claudiashein dijo que el gobernador de Veracruz saliente @CuitlahuacGJ formará parte de su gobierno. No le avisen a @lopezdoriga que se nos va de un coraje https://t.co/KFF8nQsR0T","1863019158536897017","https://pbs.twimg.com/ext_tw_video_thumb/1863016755595010048/pu/img/HbhfrQOrTQhraYho.jpg","","es","Pátzcuaro, Michoacán de Ocampo","2","13","123","https://x.com/JHRomero_/status/1863019158536897017","962143729023938560","JHRomero_"
"1863326767051596267","Sun Dec 01 20:58:14 +0000 2024","6","#AlertaADN La presidenta Claudia Sheinbaum (@Claudiashein) felicita a Rocío Nahle (@rocionahle) tras asumir el cargo como gobernadora de Veracruz","1863326767051596267","","","es","México","0","0","1","https://x.com/adn40/status/1863326767051596267","84398622","adn40"
"1863333283213312268","Sun Dec 01 21:24:08 +0000 2024","25","#Nacional La Presidenta Claudia Sheinbaum (@Claudiashein) felicitó a la gobernadora de #Veracruz Rocío Nahle (@rocionahle) quien rindió protesta este 1 de diciembre como la primera mujer mandataria de dicha entidad. https://t.co/sIRHzj7xM5","1863333283213312268","https://pbs.twimg.com/media/GdvjpvPWkAAvWXc.jpg","","es","","0","0","13","https://x.com/SPRInforma/status/1863333283213312268","1494838028690362370","SPRInforma"
"1863301003417735657","Sun Dec 01 19:15:52 +0000 2024","2","Tras rendir protesta como Gobernadora y acompañada de la Presidenta Claudia Sheinbuam la morenista Rocío Nahle aseguró que no le fallará al pueblo de #Veracruz. https://t.co/C4cGceLShW","1863301003417735657","","","es","México","1","0","0","https://x.com/muralcom/status/1863301003417735657","34080203","muralcom"
"1863317902965022965","Sun Dec 01 20:23:01 +0000 2024","24","Me dio mucho gusto acompañar a mi amiga Rocío Nahle (@rocionahle) durante su toma de protesta como la primera Gobernadora de Veracruz a la que también asistió nuestra Presidenta Claudia Sheinbaum Pardo (@Claudiashein). La felicitamos y le deseamos mucho éxito en esta nueva https://t.co/BXie78cI70","1863317902965022965","https://pbs.twimg.com/media/GdvVu6mXoAAHc7c.jpg","","es","Oaxaca","0","0","9","https://x.com/salomonj/status/1863317902965022965","85383647","salomonj"
"1862932762824511580","Sat Nov 30 18:52:36 +0000 2024","1","Sheinbaum inaugurará UMF del IMSS en #NuevoLeón; le protestan a Samuel La presidenta Claudia Sheinbaum preside la inauguración de la Unidad de Medicina Familiar No. 73 en San Nicolás. https://t.co/JVnwDjcR41","1862932762824511580","","","es","Coahuila de Zaragoza","0","0","0","https://x.com/PeriodicoZocalo/status/1862932762824511580","18461620","PeriodicoZocalo"
"1863312785251119590","Sun Dec 01 20:02:41 +0000 2024","602","COMUNICADO DE LA COALICIÓN CÍVICA Elisa Carrió y otras dirigentes de la Coalición Cívica no eligieron tener custodia; tenerla es una consecuencia directa de la gravísima realidad criminal que atraviesa la Argentina y de una decisión de la Justicia. https://t.co/YIDbl72plo","1863312785251119590","https://pbs.twimg.com/media/GdvRGpIXYAAO53u.jpg","","es","","56","450","285","https://x.com/ccari_ok/status/1863312785251119590","485988630","ccari_ok"
"1863055430886605075","Sun Dec 01 03:00:03 +0000 2024","0","El presidente de la Junta de Coordinación Política (Jucopo) de la Cámara de Diputados Ricardo Monreal Ávila (@RicardoMonrealA) respaldó a la presidenta Claudia Sheinbaum ante los desafíos internacionales con Trump y Canadá https://t.co/MjavzqaZ0Z","1863055430886605075","","","es","México","0","0","0","https://x.com/LaRazon_mx/status/1863055430886605075","47379940","LaRazon_mx"
"1862957324777766949","Sat Nov 30 20:30:12 +0000 2024","809","Hoje comemoramos os 90 anos de Luiza @luizaerundina! Exemplo e referência na política brasileira por cinco décadas ela segue inspirando gerações inteiras por seu pioneirismo e pela luta por um mundo mais justo e humano. Desejo muita paz e saúde nesse novo ciclo. Parabéns ","1862957324777766949","","","pt","Curitiba - Brasil","10","293","118","https://x.com/gleisi/status/1862957324777766949","31139434","gleisi"
"1863225093989568573","Sun Dec 01 14:14:14 +0000 2024","969","#ÚLTIMAHORA Este martes 3 de diciembre María Corina Machado y Edmundo González Urrutia participarán en una audiencia pública en el Congreso de Brasil liderada por diputados de la CREDN. Será transmitida en vivo por @camaradeputados. https://t.co/8C9MKiUY89","1863225093989568573","https://pbs.twimg.com/media/GduBV8LXgAAtdfA.jpg","","es","Miami,USA","1","2","670","https://x.com/TVVnoticias/status/1863225093989568573","381515624","TVVnoticias"
"1863286525607174337","Sun Dec 01 18:18:20 +0000 2024","2","️ #ÚLTIMAHORA | La presidenta Claudia Sheinbaum (@Claudiashein) recuerda la toma de protesta del expresidente Andrés Manuel López Obrador del 1° de diciembre del 2018 https://t.co/oKgwZy4US1 : X/ Claudia Sheinbaum https://t.co/43ewFADuN6","1863286525607174337","https://pbs.twimg.com/media/Gdu5OIYWMAAa3tr.jpg","","es","México","0","1","0","https://x.com/diario24horas/status/1863286525607174337","357050985","diario24horas"
"1863364759305019789","Sun Dec 01 23:29:12 +0000 2024","2958","La narcopresidenta comunista con un inglés como sus patas. Por eso no entendió NADA de lo que habló con Donald Trump. Toy bien preparada ¿Cómo se dice bloqueo en inglés?: @Claudiashein I don't arribe by my self https://t.co/qsM9pHNTzq","1863364759305019789","https://pbs.twimg.com/amplify_video_thumb/1863364566031409152/img/6nAJrOeWlof1ZLtP.jpg","","es","","82","678","1062","https://x.com/JJDiazMachuca/status/1863364759305019789","1005155561313308672","JJDiazMachuca"
"1863019507616457133","Sun Dec 01 00:37:18 +0000 2024","2","El gobernador de Coahuila Manolo Jiménez Salinas recibió a la presidenta Claudia Sheinbaum en su primera gira por la entidad en el cargo. #ImagenNoticias #ImagenInforma por @ImagenTVMex","1863019507616457133","","","es","Ciudad Imagen","0","0","1","https://x.com/Imagen_Mx/status/1863019507616457133","88957440","Imagen_Mx"
"1863241324171776448","Sun Dec 01 15:18:43 +0000 2024","3","#Entérate Tras primera reunión oficial en NL como Presidenta Claudia Sheinbaum afirma que buscarán apoyar al Estado en proyectos de salud y en tren. https://t.co/fqdB1TAC2P","1863241324171776448","","","es","Monterrey, Nuevo León","0","0","0","https://x.com/elnortelocal/status/1863241324171776448","161743777","elnortelocal"
"1863300436179947550","Sun Dec 01 19:13:37 +0000 2024","3","Tras rendir protesta como Gobernadora y acompañada de la Presidenta Claudia Sheinbuam la morenista Rocío Nahle aseguró que no le fallará al pueblo de #Veracruz. https://t.co/YZe6djFSUH","1863300436179947550","","","es","Monterrey","1","0","0","https://x.com/elnorte/status/1863300436179947550","41925129","elnorte"
"1863213964475195480","Sun Dec 01 13:30:00 +0000 2024","14","De gira por Nuevo León la presidenta Claudia Sheinbaum volvió a describir la relación que tendrá México con Estados Unidos y Donald Trump. prevalecerá siempre el diálogo y la colaboración https://t.co/ZhFHVuMoOm","1863213964475195480","","","es","Ciudad de México","2","25","2","https://x.com/lopezdoriga/status/1863213964475195480","236636515","lopezdoriga"
"1862755767322812512","Sat Nov 30 07:09:17 +0000 2024","624","Lula criou o governo do descaso do ódio e da vingança.","1862755767322812512","","","pt","Brasilia, Brasil","3","13","301","https://x.com/ClauAker/status/1862755767322812512","1544094079218327553","ClauAker"
"1863038865876942959","Sun Dec 01 01:54:13 +0000 2024","99","La presidenta Claudia Sheinbaum (@Claudiashein) confirmó este sábado que el gobernador saliente de #Veracruz Cuitláhuac García (@CuitlahuacGJ) se sumará a su equipo de trabajo en un área estratégica del Gobierno Federal. ️ https://t.co/QHJbnZBXWO https://t.co/DuY0tIjtqW","1863038865876942959","https://pbs.twimg.com/media/GdrXp1mWsAAudLv.jpg","","es","México","28","208","44","https://x.com/ElFinanciero_Mx/status/1863038865876942959","119051398","ElFinanciero_Mx"
"1863213988617568277","Sun Dec 01 14:44:34 +0000 2024","421","@Thaisgmsv imagina não poder passar a semana gritando em casa SOU CAMPEÃO DA LIBERTADORESSSS e com vuvuzela no ouvido da pessoa Cruz credo melhor separar","1863232730160316756","","Thaisgmsv","pt","","4","1","8","https://x.com/juliapagodinho/status/1863232730160316756","1097841914487943168","juliapagodinho"
"1863325011446026539","Sun Dec 01 20:51:16 +0000 2024","539","Ah pero Carrió y coso milei ‍️ La hija de Yuyito González confirmó que su mamá tiene custodia presidencial y explicó los motivos #BuenDomingo https://t.co/cJfuX8QIfj","1863325011446026539","","","es","Buenos Aires, Argentina","25","85","357","https://x.com/RicBenedetti/status/1863325011446026539","71360442","RicBenedetti"
