"conversation_id_str","created_at","favorite_count","full_text","id_str","image_url","in_reply_to_screen_name","lang","location","quote_count","reply_count","retweet_count","tweet_url","user_id_str","username"
"1868436470782177757","Sun Dec 15 23:22:23 +0000 2024","10"," Gracias presidente Andrés Manuel @lopezobrador_por todo y por tanto! Tenemos #TrenMaya y continuidad del legado de la cuarta transformación con nuestra PresidentA Claudia Sheinbaum Pardo @Claudiashein #TodosConClaudia https://t.co/5CjrAgds90","1868436470782177757","https://pbs.twimg.com/media/Ge4BkguWsAAmp_D.jpg","","es","Ciudadana del mundo 🌎 ","0","1","3","https://x.com/CPJannyBarrera/status/1868436470782177757","3395319734","CPJannyBarrera"
"1868295304656687411","Sun Dec 15 14:01:26 +0000 2024","1"," #EdiciónEspecial | El gobernador Alejandro Armenta presentó La Puebla del Futuro en la que para 2030 de la mano de la presidenta Claudia Sheinbaum Pardo la entidad poblana será un referente en materia de seguridad deporte salud y energía Más detalles aquí https://t.co/trrxX8QhO7","1868295304656687411","https://pbs.twimg.com/media/Ge2ErcAWgAAPBBT.jpg","","es","Puebla, México","0","0","1","https://x.com/Diario_Cambio/status/1868295304656687411","67388370","Diario_Cambio"
"1868445896448602191","Sun Dec 15 23:59:50 +0000 2024","6","La presidenta Claudia Sheinbaum destacó en su cuenta de X el primer aniversario del Tren Maya. Además encabezó la inauguración del tramo sur de Escárcega a Chetumal.","1868445896448602191","","","es","Mexico City","0","0","1","https://x.com/nmas/status/1868445896448602191","25401359","nmas"
"1868425432800145439","Sun Dec 15 22:38:31 +0000 2024","0","Presidenta Claudia Sheinbaum celebra primer aniversario del Tren Maya e inaugura los tramos 6 y 7 https://t.co/B5D4zFRyaM #Nacional @Claudiashein #TrenMaya @MaraLezama","1868425432800145439","","","es","","0","0","0","https://x.com/VeroBacaz/status/1868425432800145439","77650086","VeroBacaz"
"1868356815445963103","Sun Dec 15 18:05:51 +0000 2024","601","La Presidenta Claudia Sheinbaum inauguró los tramos 6 y 7 del #TrenMaya cortando el listón inaugural de los nuevos tramos en Chetumal Quintana Roo. Con lo que quedan inaugurados los 1 554 km de esta gran obra legado de AMLO. ¡Un ejemplo ante el mundo! 🇲🇽 https://t.co/bpMJD7Pqa5","1868356815445963103","https://pbs.twimg.com/ext_tw_video_thumb/1868356272526888960/pu/img/lQu28dc5iq9BMtu1.jpg","","es","","3","38","199","https://x.com/juncalssolano/status/1868356815445963103","899081012172300288","juncalssolano"
"1867968806980931661","Sat Dec 14 16:24:03 +0000 2024","1436","eu amo mt a Dilma sério coração valente mulher de fibra maravilhosa doce ela ensinando a fazer macarrão mudou minha vida https://t.co/Oh9kv9CATZ","1867968806980931661","https://pbs.twimg.com/ext_tw_video_thumb/1809362774843154432/pu/img/FtYrMar8o6WH1t5-.jpg","","pt","Brasil","7","5","184","https://x.com/mttlim/status/1867968806980931661","813107416690782209","mttlim"
"1868129490960003081","Sun Dec 15 03:02:33 +0000 2024","1","Presidenta Claudia Sheinbaum da banderazo de del parque ecoturístico La Ceiba en Palenque Chiapas https://t.co/Nq4sbN5sUO https://t.co/bHNXM93QTh","1868129490960003081","https://pbs.twimg.com/media/Gezt3zsa8AAiCmP.jpg","","es","Chiapas","0","0","0","https://x.com/3minutosinforma/status/1868129490960003081","1673812765","3minutosinforma"
"1868249652639715786","Sun Dec 15 11:00:02 +0000 2024","7","#Entérate | Desde Palenque Chiapas la presidenta Claudia Sheinbaum minimizó los recientes desacuerdos entre Adán Augusto López y Ricardo Monreal. #OnceNoticiasDigital https://t.co/vmiHxDgU73","1868249652639715786","","","es","México","0","0","1","https://x.com/OnceNoticiasTV/status/1868249652639715786","1413528254","OnceNoticiasTV"
"1868332692539879502","Sun Dec 15 16:30:00 +0000 2024","1","La presidenta Claudia Sheinbaum encabezó la ceremonia del primer aniversario del Tren Maya y la inauguración de los tramos 6 y 7 en Othón P. Blanco en Quintana Roo. https://t.co/M6bZZGC7VN Escucha https://t.co/yC5ay0VteZ #DFT","1868332692539879502","","","es","Ciudad de México","0","0","0","https://x.com/889Noticias/status/1868332692539879502","38277042","889Noticias"
"1868309593312637166","Sun Dec 15 14:58:13 +0000 2024","344","COMPROMISSO COM O BRASIL | Eu tenho um compromisso muito grande com esse país quando voltei a ser presidente a minha maior vontade era trazer o Brasil de volta à normalidade democrática afirmou o presidente @LulaOficial. https://t.co/T8Nl2PkIrx","1868309593312637166","https://pbs.twimg.com/media/Ge2RqRGWwAAU6v9.jpg","","pt","Brasília - DF","5","76","108","https://x.com/canalgov/status/1868309593312637166","18912498","canalgov"
"1868046287582749142","Sat Dec 14 21:31:56 +0000 2024","0"," Cabeza fría y unidad pide Claudia Sheinbaum a Adán Augusto y Monreal Desde Palenque Chiapas la presidenta Claudia Sheinbaum pidió a servidores de todos los niveles de gobierno y legisladores que utilicen adecuadamente los recursos públicos. https://t.co/BZDfqNPy2I","1868046287582749142","","","es","México","0","1","0","https://x.com/ExpPolitica/status/1868046287582749142","380567317","ExpPolitica"
"1868375095741428099","Sun Dec 15 19:18:30 +0000 2024","0"," La presidenta Claudia Sheinbaum Pardo encabezó el primer recorrido del tramo Palenque-Chetumal del Tren Maya. https://t.co/RoKV5BSlhC","1868375095741428099","https://pbs.twimg.com/media/Ge3NP2kWUAA5xJl.jpg","","es","México","0","0","0","https://x.com/NotaCirculoRojo/status/1868375095741428099","49747926","NotaCirculoRojo"
"1868340371886936454","Sun Dec 15 17:00:31 +0000 2024","14","La presidenta Claudia Sheinbaum confirmó la captura de Dámaso López Serrano 'El Mini Lic' en Estados Unidos acción que calificó como muy importante https://t.co/459kcuCPx9","1868340371886936454","","","es","México","1","6","1","https://x.com/JoseCardenas1/status/1868340371886936454","93797343","JoseCardenas1"
"1867790715347976692","Sat Dec 14 04:36:23 +0000 2024","2172","¡GrandiosA! Así se vivió la visita de nuestra presidenta @Claudiashein a Chichén Itzá y la pirámide de Kukulkán. https://t.co/n8emwc4ADR","1867790715347976692","https://pbs.twimg.com/ext_tw_video_thumb/1867790666694086656/pu/img/AV_XyANcycO1-YB7.jpg","","es","Mexico","5","16","713","https://x.com/Mike_Oviedo/status/1867790715347976692","84953920","Mike_Oviedo"
"1867955202512540008","Sat Dec 14 15:29:59 +0000 2024","852"," Uma mulher que nos inspira diz Lula no aniversário de Dilma https://t.co/J9A8T4dAax","1867955202512540008","","","pt","São Paulo, SP","5","52","145","https://x.com/brasil247/status/1867955202512540008","248890506","brasil247"
"1867946187183280426","Sat Dec 14 14:54:10 +0000 2024","584","No hay causa más sagrada que la defensa de nuestras y nuestros compatriotas en EUA. No hay tampoco lucha más vital que la de la defensa de la soberanía nacional. Que Trump y el mundo sepan que a @Claudiashein la apoyamos todas y todos y no llegará sola . https://t.co/zj8mfsulRR","1867946187183280426","https://pbs.twimg.com/amplify_video_thumb/1866686447241105408/img/sM_KInscBqPxpaZW.jpg","","es","Mexico","2","20","325","https://x.com/epigmenioibarra/status/1867946187183280426","54649261","epigmenioibarra"
"1868132284551102915","Sun Dec 15 03:13:39 +0000 2024","10","La presidenta Claudia Sheinbaum Pardo encabezó el primer recorrido del tramo Palenque-Chetumal del Tren Maya. https://t.co/pLsTgjl7Wr","1868132284551102915","","","es","México","0","3","4","https://x.com/Milenio/status/1868132284551102915","24969337","Milenio"
"1868143345064984985","Sun Dec 15 03:57:36 +0000 2024","808","Bienvenida siempre a #Chetumal querida Presidenta @Claudiashein. La recibimos de brazos abiertos en casa. https://t.co/ddY19jZWVi","1868143345064984985","https://pbs.twimg.com/ext_tw_video_thumb/1868143206233210880/pu/img/wYK3jJ4RliL67Jic.jpg","","es","Benito Juárez, Quintana Roo","5","98","208","https://x.com/MaraLezama/status/1868143345064984985","1886841798","MaraLezama"
"1867995469982609846","Sat Dec 14 18:10:00 +0000 2024","2175","Jorge Ramos señala en entrevista con EL UNIVERSAL que espera que en el tema de la violencia la presidenta Claudia Sheinbaum se separe de López Obrador #NotaPlus https://t.co/eqZcO0Ubc7 https://t.co/6T1KpoJ3sA","1867995469982609846","https://pbs.twimg.com/media/Gext4J8W0AAFL7i.jpg","","es","Centro de la Ciudad de México","14","207","758","https://x.com/El_Universal_Mx/status/1867995469982609846","16676396","El_Universal_Mx"
"1868017464623173883","Sat Dec 14 19:37:24 +0000 2024","21"," ES UNA DETENCIÓN MUY IMPORTANTE Claudia Sheinbaum celebra la captura del Mini Lic en EUA. 🇺🇸 La presidenta destaca el golpe al crimen organizado pero ¿qué sigue en la lucha contra el narcotráfico? ️ #Seguridad #4T https://t.co/wjH7hJrFbG","1868017464623173883","https://pbs.twimg.com/amplify_video_thumb/1868017405500309504/img/pixBMOU48SZdeRqR.jpg","","es","","1","10","4","https://x.com/LuisCardenasMx/status/1868017464623173883","69334913","LuisCardenasMx"
"1868296747044196472","Sun Dec 15 14:07:10 +0000 2024","15","La presidenta Claudia Sheinbaum se refirió al encuentro entre Adán Augusto López y Ricardo Monreal como algo menor sin embargo destacó que hay unidad en el movimiento. #FórmulaNoticias con Juan Becerra (@juanbaaq). https://t.co/xeldsN9o2n","1868296747044196472","https://pbs.twimg.com/amplify_video_thumb/1868296178929934336/img/GCJCbsP_peJwBrvI.jpg","","es","Ciudad de Mexico","0","2","3","https://x.com/Radio_Formula/status/1868296747044196472","148372339","Radio_Formula"
"1868443421528170639","Sun Dec 15 23:50:00 +0000 2024","52","🇲🇽 ️ La presidenta Claudia Sheinbaum declaró que el Tren Maya es uno de los grandes legados del expresidente López Obrador https://t.co/tqCRb3jLKA","1868443421528170639","","","es","Centro de la Ciudad de México","8","144","14","https://x.com/El_Universal_Mx/status/1868443421528170639","16676396","El_Universal_Mx"
"1868141951695868026","Sun Dec 15 03:52:04 +0000 2024","0","Entrega presidenta Claudia Sheinbaum 117 títulos profesionales a egresados de las Universidades Benito Juárez en Yucatán. #ImagenInforma #ImagenNoticias","1868141951695868026","","","es","Ciudad Imagen","0","0","0","https://x.com/Imagen_Mx/status/1868141951695868026","88957440","Imagen_Mx"
"1868423538002325696","Sun Dec 15 22:30:59 +0000 2024","1","Prensa Latina @PrensaLatina_cu La presidenta Claudia Sheinbaum inauguró hoy junto a otras autoridades los dos últimos tramos del Tren Maya al conmemorarse un año del inicio de operaciones de la emblemática obra en el sureste de México. https://t.co/W2h17Pytmn https://t.co/GtL8BYlDeb","1868423538002325696","https://pbs.twimg.com/media/Ge35QlcWoAAEHlv.jpg","","es","E #454 esq. 19 La Habana, Cuba","0","0","2","https://x.com/PrensaLatina_cu/status/1868423538002325696","119881872","PrensaLatina_cu"
"1868406636920091120","Sun Dec 15 21:23:50 +0000 2024","2","Claudia Sheinbaum inaugura tramos 6 y 7 del Tren Maya en Quintana Roo La presidenta Claudia Sheinbaum Pardo encabezó la inauguración de los tramos 6 y 7 del Tren Maya en Chetumal Quintana Roo. El recorrido de este tramo contempla desde Tulum a Chetumal Quintana Roo; y de https://t.co/hNWcUaDqBB","1868406636920091120","https://pbs.twimg.com/media/Ge3pfDCWcAAAmIF.jpg","","es","","0","0","0","https://x.com/gamavisionmx/status/1868406636920091120","1535105167443501056","gamavisionmx"
"1868356143514321303","Sun Dec 15 18:03:11 +0000 2024","489","La presidenta Claudia Sheinbaum viaja en el Tren Maya del que hoy habrá de inaugurar su último tramo.","1868356143514321303","","","es","","1","36","176","https://x.com/JorgeArmandoR_/status/1868356143514321303","1589064425855754241","JorgeArmandoR_"
"1868376149157654560","Sun Dec 15 19:22:41 +0000 2024","26","Carlos Salinas de Gortari soy desempleado pensionado ya no porque alguien nos quitó las pensiones Ese alguien fue el gran López Obrador. La presidenta Claudia Sheinbaum puede pedir su pensión del Bienestar... pero debe regresar a vivir a México #DisfrutandoLoVotado🇲🇽","1868376149157654560","","","es","","0","1","28","https://x.com/MONALI4T/status/1868376149157654560","2471183041","MONALI4T"
"1867903368397480402","Sat Dec 14 12:04:01 +0000 2024","208"," URGENTE: imagens de Dilma Rousseff as 8h da manhã de seu aniversário https://t.co/PJWcyRVChT","1867903368397480402","https://pbs.twimg.com/media/GewgNOsXYAA50gK.jpg","","pt","São Paulo, Brasil","1","1","11","https://x.com/lucianocarvaIho/status/1867903368397480402","1050174967298629633","lucianocarvaIho"
"1868003047026413964","Sat Dec 14 18:40:06 +0000 2024","349","#VideosLaJornada La presidenta @Claudiashein arriba al sitio donde encabezará el inicio de los trabajos de construcción del Parque Ecoturístico La Ceiba . https://t.co/gGinzD6dcH","1868003047026413964","https://pbs.twimg.com/ext_tw_video_thumb/1868002962812829696/pu/img/nOMJu1zWCqBb1F7_.jpg","","es","México","0","15","137","https://x.com/lajornadaonline/status/1868003047026413964","35977487","lajornadaonline"
"1868023227488010649","Sat Dec 14 20:00:18 +0000 2024","679","MY PRESIDENT!! ️️ #VivaPresidentJuliusMalema! #VivaEFF! A LUTA CONTINUA! https://t.co/7jSYq1V5sg","1868023227488010649","https://pbs.twimg.com/media/GeyNN_gWoAAUYgR.jpg","","en","Johannesburg, South Africa","2","32","92","https://x.com/niehaus_carl/status/1868023227488010649","836462730286608384","niehaus_carl"
"1868376849979740568","Sun Dec 15 19:25:28 +0000 2024","8"," El general David Lozano Águila reconoció que la presidenta Claudia Sheinbaum impulsó la infraestructura ferroviaria del Tren Maya: Se logró transformar la cara del sureste de México https://t.co/TOFZvzr1LE","1868376849979740568","","","es","Centro de la Ciudad de México","0","6","3","https://x.com/El_Universal_Mx/status/1868376849979740568","16676396","El_Universal_Mx"
"1868297711054942652","Sun Dec 15 14:11:00 +0000 2024","2","La presidenta Claudia Sheinbaum y Eduardo Ramírez Aguilar nuevo gobernador de Chiapas marcan un nuevo capítulo con la inauguración del Centro de Atención a Visitantes en Palenque ️ Te compartimos los #FrentesPolíticos de este domingo en #Excélsior. ️ https://t.co/2eCGQ75eUz https://t.co/F0PbFgVyOi","1868297711054942652","https://pbs.twimg.com/media/Ge2AGJ0W0AAP5JN.png","","es","Ciudad Imagen","0","0","0","https://x.com/Excelsior/status/1868297711054942652","104683173","Excelsior"
"1867928729395097814","Sat Dec 14 13:44:48 +0000 2024","998","Apoyemos a @Claudiashein tenemos una presidenta con un gran corazón. Feliz sábado. https://t.co/Dxy9Hvd66G","1867928729395097814","https://pbs.twimg.com/media/Gew3R6kW0AAmtRx.jpg","","es","Mexico","8","104","240","https://x.com/Mike_Oviedo/status/1867928729395097814","84953920","Mike_Oviedo"
"1868140692213563611","Sun Dec 15 03:47:04 +0000 2024","659","Nos fuimos con la presidentA @Claudiashein a Chiapas a inaugurar el Centro de Atención a Visitantes de Palenque que sin duda siguen fortaleciendo el proyecto del #TrenMaya. El cariño se siente es recíproco forjado en una lucha de muchos años. Toda una vida anhelando vivir lo https://t.co/qT7DIXV9ZB","1868140692213563611","https://pbs.twimg.com/media/Gez4DnUW8AA88_i.jpg","","es","Campeche ","68","827","123","https://x.com/LaydaSansores/status/1868140692213563611","195537412","LaydaSansores"
"1867967787609866729","Sat Dec 14 16:20:00 +0000 2024","320","Lula reaparece caminando por el hospital tras sufrir hemorragia intracraneal: Mantengan la calma soy firme y fuerte https://t.co/y9TMpTI9Vp","1867967787609866729","","","es","Chile","6","26","37","https://x.com/CNNChile/status/1867967787609866729","18248645","CNNChile"
"1868326388681593330","Sun Dec 15 16:04:57 +0000 2024","1554","Mi Presidenta @Claudiashein Sencillez y humildad ️ https://t.co/GOZd7BlfFs","1868326388681593330","https://pbs.twimg.com/ext_tw_video_thumb/1868326310751125504/pu/img/_4Q8xX5TAJl27tVM.jpg","","es","Querétaro, Méx 🇲🇽","3","8","297","https://x.com/vontau45/status/1868326388681593330","1627538989459668992","vontau45"
"1868114190327566759","Sun Dec 15 02:01:45 +0000 2024","965","Así se vivió la visita de nuestra presidenta @Claudiashein en Chiapas dio el banderazo de salida a la Construcción del Parque Ecoturístico La Ceiba . Se van a sembrar ceibas árbol de la selva chiapaneca que nos recuerda a la cultura maya de antes y de ahora . ¡Qué orgullo! https://t.co/VnKsdf4aG3","1868114190327566759","https://pbs.twimg.com/ext_tw_video_thumb/1868113103809912832/pu/img/oPkqzcMFPlAXhVDt.jpg","","es","Mexico","1","17","331","https://x.com/Mike_Oviedo/status/1868114190327566759","84953920","Mike_Oviedo"
"1867977856191434888","Sat Dec 14 17:00:00 +0000 2024","0"," La presidenta Claudia Sheinbaum destacó la capacidad del exgobernador chiapaneco para apoyar a la comunidad mexicana en Florida. ️🇲🇽 https://t.co/MHUjRVuuqq","1867977856191434888","","","es","México","0","0","0","https://x.com/NotaCirculoRojo/status/1867977856191434888","49747926","NotaCirculoRojo"
"1868298348941209622","Sun Dec 15 14:13:32 +0000 2024","20","El día de hoy la presidenta Claudia Sheinbaum llevará a cabo una ceremonia para inaugurar los tramos 6 y 7 Escárcega-Chetumal del Tren Maya. Lo detalles con Enrique Hernández. #FórmulaNoticias con Juan Becerra (@juanbaaq). https://t.co/8KwsH2WkKU","1868298348941209622","https://pbs.twimg.com/amplify_video_thumb/1868297939313098752/img/OcVYVXefaB3swhaH.jpg","","es","Ciudad de Mexico","0","2","4","https://x.com/Radio_Formula/status/1868298348941209622","148372339","Radio_Formula"
"1868108715934859680","Sun Dec 15 01:40:00 +0000 2024","17"," Así fue la aparición de la presidenta Sheinbaum a bordo del nuevo Tren Maya en la ruta Palenque-Chetumal. https://t.co/ma24srBJd6","1868108715934859680","","","es","Centro de la Ciudad de México","1","15","4","https://x.com/El_Universal_Mx/status/1868108715934859680","16676396","El_Universal_Mx"
"1868094387303178363","Sun Dec 15 00:43:04 +0000 2024","142","Desde Palenque Chiapas la presidenta Claudia Sheinbaum llamó a políticos de la 4-T a vivir en la justa medianía. En medio del escándalo por la boda de Martín Borrego ex funcionario de la cancillería en el Museo Nacional de Arte la mandataria señaló que recursos del pueblo no","1868094387303178363","","","es","","0","22","23","https://x.com/azucenau/status/1868094387303178363","93922911","azucenau"
"1868072893713727508","Sat Dec 14 23:17:39 +0000 2024","38","Detienen en EE.UU. al exlíder del cartel de Sinaloa Dámaso López Serrano informa la presidenta de México Claudia Sheinbaum https://t.co/jNUMjSoHvd","1868072893713727508","","","es","En todas partes","0","1","13","https://x.com/CNNEE/status/1868072893713727508","33884545","CNNEE"
"1868363902980944179","Sun Dec 15 18:34:01 +0000 2024","18","El ex vicepresidente del gobierno español y fundador del partido político Podemos Pablo Iglesias reconoce la mención que hizo la Presidenta Claudia Sheinbaum en Chiapas sobre el movimiento estudiantil que encabezó al lado de su amigo Antonio Santos quien ha sido nombrado","1868363902980944179","","","es","Chiapas, México","0","2","7","https://x.com/isain/status/1868363902980944179","17046947","isain"
"1867941559158882553","Sat Dec 14 14:35:47 +0000 2024","311","Hoje é o dia de homenagear a minha amiga querida @dilmabr e celebrar a sua vida! Uma mulher de coragem e coração valente. Nossa amada Presidenta! Que Deus lhe dê muita saúde! Feliz aniversário! https://t.co/Z5ozkVmdWk","1867941559158882553","https://pbs.twimg.com/ext_tw_video_thumb/1867941545774661632/pu/img/GPccGMkLbN0CPoTZ.jpg","","pt","Brasil","0","11","32","https://x.com/dasilvabenedita/status/1867941559158882553","75060031","dasilvabenedita"
"1868367923821306192","Sun Dec 15 18:54:47 +0000 2024","33","Y aunque Claudia Sheinbaum Presidenta de México y cabeza de esa corriente política dijo que deberían investigarse las acusaciones una renombrada auditora especializada en anticorrupción dudó que las denuncias presentadas ante la Auditoría Superior de la Federación tengan","1868369126428991775","","SinEmbargoMX","es","México","1","1","8","https://x.com/SinEmbargoMX/status/1868369126428991775","244218738","SinEmbargoMX"
"1868099107178385756","Sun Dec 15 01:01:49 +0000 2024","7"," Hay unidad : La presidenta Claudia Sheinbaum pidió cabeza fría y tranquilidad al senador Adán Augusto y el diputado Ricardo Monreal luego de que el primero le reclamó a Monreal por el presupuesto del Senado. #FórmulaNoticias con Juan Pablo Pérez-Díaz (@perezdiazmx) https://t.co/N4kEkX0do8","1868099107178385756","https://pbs.twimg.com/amplify_video_thumb/1868089864098369536/img/XmlQ0uBpQTaefYgO.jpg","","es","Ciudad de Mexico","0","2","2","https://x.com/Radio_Formula/status/1868099107178385756","148372339","Radio_Formula"
"1867747848902553713","Sat Dec 14 01:46:02 +0000 2024","142","#Entérate Desde Valladolid Yucatán la Presidenta Claudia Sheinbaum dijo que es falso que como se ha criticado las Universidades del Bienestar sean de segunda. https://t.co/WzrQ6G5IMv","1867747848902553713","","","es","Av. México Coyoacán 40","23","532","40","https://x.com/Reforma/status/1867747848902553713","27708897","Reforma"
"1868310531809182205","Sun Dec 15 15:01:56 +0000 2024","417","Presidente @LulaOficial cristão de verdade cuidador da nossa gente. Obrigado presidente pela obstinação coragem doação e justiça social com foco na paz. 🇧🇷 https://t.co/hHmIxknTCQ","1868310531809182205","https://pbs.twimg.com/ext_tw_video_thumb/1868310502037667840/pu/img/VL9X91B9vcd7KtWj.jpg","","pt","Belo Horizonte, Brasil","0","46","62","https://x.com/asilveiramg/status/1868310531809182205","954474096963801089","asilveiramg"
"1868348384676819435","Sun Dec 15 17:32:21 +0000 2024","4","Con la inauguración de los tramos 6 y 7 y la estación Chetumal la Presidenta Claudia Sheinbaum celebró el primer año del Tren Maya 'uno de los grandes legados de AMLO' aseguró. #RegístrateGratis https://t.co/cZHlKHoKdI","1868348384676819435","","","es","Ciudad de México","0","5","4","https://x.com/reformanacional/status/1868348384676819435","33543881","reformanacional"
"1868092594871582745","Sun Dec 15 00:35:56 +0000 2024","10","La presidenta Claudia Sheinbaum se pronunció acerca de la discusión entre Adán Augusto López y Ricardo Monreal; aseguró que hay unidad en el movimiento de la 4T. Información de Sara Pablo. #FórmulaNoticias con Juan Pablo Pérez-Díaz (@perezdiazmx). https://t.co/5TNEjbV4MM","1868092594871582745","https://pbs.twimg.com/amplify_video_thumb/1868091213108383744/img/WqRc8iAIEwZieELK.jpg","","es","Ciudad de Mexico","1","0","3","https://x.com/Radio_Formula/status/1868092594871582745","148372339","Radio_Formula"
"1868352938948661646","Sun Dec 15 17:50:27 +0000 2024","3","Con la inauguración de los tramos 6 y 7 y la estación Chetumal la Presidenta Claudia Sheinbaum celebró el primer año del Tren Maya 'uno de los grandes legados de AMLO' aseguró. https://t.co/drLZGEGPSG","1868352938948661646","","","es","Av. México Coyoacán 40","0","7","2","https://x.com/Reforma/status/1868352938948661646","27708897","Reforma"
"1868387787139059813","Sun Dec 15 20:08:56 +0000 2024","4","La presidenta Claudia Sheinbaum encabezó la ceremonia del primer aniversario del Tren Maya y la inauguración de los tramos 6 y 7 Escárcega-Chetumal en Quintana Roo. #FórmulaNoticias con Juan Pablo Pérez-Díaz (@perezdiazmx) a nombre de Michelle Rivera (@michelleriveraa). https://t.co/h95VWYyLab","1868387787139059813","https://pbs.twimg.com/amplify_video_thumb/1868387418476584961/img/8p-LB_UiG7R3nF4L.jpg","","es","Ciudad de Mexico","0","2","1","https://x.com/Radio_Formula/status/1868387787139059813","148372339","Radio_Formula"
"1868046097652076913","Sat Dec 14 21:31:10 +0000 2024","243","Hoje celebramos o aniversário de Dilma Rousseff uma mulher que marcou a história do Brasil com sua trajetória de coragem determinação e resiliência. Primeira mulher a ocupar a Presidência da República Dilma abriu caminhos em um ambiente predominantemente masculino https://t.co/R1qXnaUxAG","1868046097652076913","https://pbs.twimg.com/media/GeyiBgOWQAAh2SY.jpg","","pt","Rio de Janeiro, Brasil","1","16","27","https://x.com/roberta_bastoss/status/1868046097652076913","1272507913991585793","roberta_bastoss"
"1868355123203768441","Sun Dec 15 17:59:08 +0000 2024","1","Con la inauguración de los tramos 6 y 7 y la estación Chetumal la Presidenta Claudia Sheinbaum celebró el primer año del Tren Maya 'uno de los grandes legados de AMLO' aseguró. https://t.co/LGjOqz3VpH","1868355123203768441","","","es","México","1","0","0","https://x.com/muralcom/status/1868355123203768441","34080203","muralcom"
"1868163038601171163","Sun Dec 15 05:15:51 +0000 2024","69","#Entérate La Presidenta Claudia Sheinbaum calificó con un 10 el viaje de siete horas que realizó de Palenque Chiapas a Chetumal QR en el Tren Maya. #NoctámbulosREFORMA https://t.co/nIs5IJ9bXL","1868163038601171163","","","es","Av. México Coyoacán 40","3","78","9","https://x.com/Reforma/status/1868163038601171163","27708897","Reforma"
"1868106199520170452","Sun Dec 15 01:30:00 +0000 2024","60","#LoMásVisto Desde Yucatán la Presidenta Claudia Sheinbaum dijo que es falso que las Universidades del Bienestar sean de segunda como se ha criticado. https://t.co/55hEhFSkbf","1868106199520170452","","","es","Av. México Coyoacán 40","10","231","22","https://x.com/Reforma/status/1868106199520170452","27708897","Reforma"
