"conversation_id_str","created_at","favorite_count","full_text","id_str","image_url","in_reply_to_screen_name","lang","location","quote_count","reply_count","retweet_count","tweet_url","user_id_str","username"
"1855101005047972092","Sat Nov 09 04:12:00 +0000 2024","0","🇲🇽#México| Queremos que el pueblo de México esté representado en el Poder Judicial : Presidenta Claudia Sheinbaum |#Noticias |#México |#DiarioPresente https://t.co/LScZ4A3CLU","1855101005047972092","","","es","Villahermosa. Tab. Mx","0","0","0","https://x.com/DiarioPresente/status/1855101005047972092","82608449","DiarioPresente"
"1855385127402315831","Sat Nov 09 23:01:00 +0000 2024","260","Más de 825 mil tuits contra @Claudiashein en su primer mes de gobierno así lo dio a conocer el investigador @carlosaugustojz quien encontró una zona de interacción que utiliza métodos artificiales para amplificar sus mensajes negativos en @X. https://t.co/cWlcKgrhqN https://t.co/4VlDPKmdVR","1855385127402315831","https://pbs.twimg.com/media/Gb9yljlWcAAqqLp.jpg","","es","México","7","11","237","https://x.com/infodemiaMex/status/1855385127402315831","1277632595040272385","infodemiaMex"
"1854716832604627136","Fri Nov 08 02:45:26 +0000 2024","37","La presidenta de México Claudia Sheinbaum felicita a Donald Trump para apagar el nerviosismo en México: Tuvimos una llamada muy cordial . Insiste en que se mantendrá la buena relación entre ambos países https://t.co/0K6jQ9VqnM","1854716832604627136","","","es","Madrid","0","5","7","https://x.com/el_pais/status/1854716832604627136","7996082","el_pais"
"1855037514559492410","Fri Nov 08 23:59:43 +0000 2024","1752","Con porras y abrazos así recibieron a nuestra presidenta @Claudiashein en San Luis Potosí. ¡Gracias por el cariño; va de regreso y al doble! . https://t.co/WJvKvPYppr","1855037514559492410","https://pbs.twimg.com/ext_tw_video_thumb/1855037398884716544/pu/img/mpoUyMWUob1m0Zy-.jpg","","es","Mexico","2","17","548","https://x.com/Mike_Oviedo/status/1855037514559492410","84953920","Mike_Oviedo"
"1854898481632018632","Fri Nov 08 14:47:15 +0000 2024","557","#MañaneraDelPueblo VA @Claudiashein AL G20 en Brasil Y va a plantear que el 1% del gasto armamentista se destine para atender a los más necesitados. Tenemos Mucha Presidenta... @ManuelGaleazz1R https://t.co/xpUk7lwDGN","1854898481632018632","https://pbs.twimg.com/ext_tw_video_thumb/1854898382092763136/pu/img/dVRli3r-UfreJLzt.jpg","","es","La Gran Tenochtitlán ","4","9","227","https://x.com/catrina_nortena/status/1854898481632018632","1485672890771070981","catrina_nortena"
"1855082861579120888","Sat Nov 09 02:59:54 +0000 2024","582","Porque cuando me preguntan si llegamos todas es una sólo una frase.. aquí tienen la respuesta: Presidenta @Claudiashein https://t.co/1Dngi4Ppj7","1855082861579120888","https://pbs.twimg.com/amplify_video_thumb/1855082805253832704/img/Mzeo_P3TV4adWg78.jpg","","es","","7","63","173","https://x.com/juncalssolano/status/1855082861579120888","899081012172300288","juncalssolano"
"1854730212958675456","Fri Nov 08 03:38:36 +0000 2024","250","Así es Ro lo recuerdas muy bien yo desde que vi a la Doctora la primera vez se me iluminó el corazón y me dije ella será nuestra próxima presidenta y se lo expresé ese día. Es lo mejor que le pudo pasar a México después de un gran Presidente como @lopezobrador_ que mejor","1854730212958675456","","","es","Distrito Federal, México","1","9","62","https://x.com/EdySmol/status/1854730212958675456","789730291","EdySmol"
"1855286256004895096","Sat Nov 09 16:28:07 +0000 2024","257","AMLO nos avisó que @Claudiashein sería la mejor Presidenta del mundo. Y no se equivocó ni nos mintió. Para allá va 🇲🇽 https://t.co/8UIXcHUoqB","1855286256004895096","https://pbs.twimg.com/media/Gb9NBHYW0AARVj8.jpg","","es","Aguascalientes, México","0","47","132","https://x.com/danysantoyo_/status/1855286256004895096","265784043","danysantoyo_"
"1855112490801045665","Sat Nov 09 04:57:38 +0000 2024","5","La presidenta Claudia Sheinbaum dio detalles de la llamada telefónica que sostuvo con Donald Trump quien ya se prepara para la transición presidencial en EE. UU. #EnPunto con @JLANoticias | #DecideInformado | Síguelo por https://t.co/JpgbIc5YLX https://t.co/gKHyQ2QsNo","1855112490801045665","https://pbs.twimg.com/media/Gb61UvpWYAAA9_N.jpg","","es","Mexico City","0","0","2","https://x.com/nmas/status/1855112490801045665","25401359","nmas"
"1855221079100269033","Sat Nov 09 12:09:08 +0000 2024","1","#EnPortada | La presidenta Claudia Sheinbaum dijo estar preparada para la llegada de Trump quien amenazó con aranceles de hasta el 100# si no se frena la migración ilegal https://t.co/wbGOLdxf5b","1855221079100269033","","","es","","0","0","0","https://x.com/heraldodemexico/status/1855221079100269033","846899281806082053","heraldodemexico"
"1854872147094630432","Fri Nov 08 13:02:36 +0000 2024","10","El regreso de Donald Trump a la Presidencia de Estados Unidos ha prendido alertas en todo el mundo. En México la Presidenta Claudia Sheinbaum Pardo ha llamado a la mesura y la calma https://t.co/pajuBS5dQi","1854872147094630432","","","es","México","0","0","2","https://x.com/SinEmbargoMX/status/1854872147094630432","244218738","SinEmbargoMX"
"1855042208791249404","Sat Nov 09 00:18:22 +0000 2024","397","Estamos muy contentas porque la primera presidenta de México @Claudiashein nos representará con mucho orgullo y dignidad en el G20. Tendrá la oportunidad de compartir ante otros países que teniendo como prioridad el principio de por el bien de todos primero las y los pobres https://t.co/vxLdC0D7It","1855042208791249404","https://pbs.twimg.com/amplify_video_thumb/1855041984702128128/img/5EXh_NTQ1TtICa0t.jpg","","es","","5","1","144","https://x.com/CitlaHM/status/1855042208791249404","70567012","CitlaHM"
"1855278245869981917","Sat Nov 09 15:56:17 +0000 2024","376","Há cinco anos O Presidente LULA voltava aos braços do povo com um discurso memorável em São Bernardo do Campo. Foi o dia que em que conheci o Presidente. + https://t.co/ySaS2xnWqv","1855278245869981917","https://pbs.twimg.com/ext_tw_video_thumb/1855278213531889664/pu/img/sT6sqomkXqGNpeCe.jpg","","pt","Brasília, Brasil","0","14","84","https://x.com/Trom_Petista/status/1855278245869981917","1013494732834639874","Trom_Petista"
"1855002617803686092","Fri Nov 08 21:41:03 +0000 2024","7811","¡SE ACABARON LOS AVIONES PRIVADOS! Hoy la presidenta @Claudiashein viajó a San Luis Potosí en vuelo comercial para estar cerca de la gente. ¡No puede haber gobierno rico con pueblo pobre! 🇲🇽️ https://t.co/xmoshFqss3","1855002617803686092","https://pbs.twimg.com/amplify_video_thumb/1855002553194536960/img/wJ4uKO-Y8Wd5VvuU.jpg","","es","","81","1155","1963","https://x.com/tori_noticias/status/1855002617803686092","1458657853800009733","tori_noticias"
"1855095468575076797","Sat Nov 09 03:50:00 +0000 2024","0","La presidenta Claudia Sheinbaum Pardo (@Claudiashein) durante su visita en San Luis Potosí hizo un llamado a los jóvenes profesionistas en Derecho a inscribirse en el proceso donde se elegirán a jueces ministros y magistrados en 2025 https://t.co/IRq1IkkaS1","1855095468575076797","","","es","México","0","0","0","https://x.com/LaRazon_mx/status/1855095468575076797","47379940","LaRazon_mx"
"1855365106600907075","Sat Nov 09 21:41:27 +0000 2024","0","#NACIONAL PRESIDENTA CLAUDIA SHEINBAUM AFIRMA: DESEAMOS QUE EL PUEBLO DE MÉXICO ESTÉ ADECUADAMENTE REPRESENTADO EN EL PODER JUDICIAL EN UN LLAMADO A UNA REFORMA EN EL SISTEMA DE JUSTICIA VER NOTA: https://t.co/Vr5XOlyVg1 https://t.co/L04a5sY2Av","1855365106600907075","https://pbs.twimg.com/media/Gb-NbSLaIAAWtGk.jpg","","es","Cancún, México","0","0","0","https://x.com/macronews/status/1855365106600907075","259876618","macronews"
"1855304043238765035","Sat Nov 09 17:38:48 +0000 2024","4350","Algún Adjetivo más para la Corrupta y Mentirosa Claudia Sheinbaum? #ClaudiaPresidentaEspuria https://t.co/JFiW5zQoJ4","1855304043238765035","https://pbs.twimg.com/media/Gb9dMesXYAAuGS0.jpg","","es","Yucatán, México","58","902","2214","https://x.com/PaulinaAcevedoK/status/1855304043238765035","1426354903459368967","PaulinaAcevedoK"
"1855089451879604262","Sat Nov 09 03:26:05 +0000 2024","2064","#ULTIMAHORA |‍️‍️ ¡UNA NUEVA OPORTUNIDAD PARA CONSTRUIR UN PODER JUDICIAL MÁS JUSTO! 🇲🇽 La presidenta @Claudiashein invita a todas y todos: el próximo año si tienen hijas o hijos que estudiaron leyes y cumplen con los requisitos anímenlos a inscribirse para ser jueces https://t.co/bLPwoP0xbB","1855089451879604262","https://pbs.twimg.com/ext_tw_video_thumb/1855089325421015040/pu/img/BsWJSMWLKI4f9Ize.jpg","","es","","12","84","908","https://x.com/IsaiRamirezR/status/1855089451879604262","986841875452694529","IsaiRamirezR"
"1855357269602398254","Sat Nov 09 21:10:18 +0000 2024","1","Oficialmente la SEDENA ha cambiado su acrónimo a 'DEFENSA' así lo ha informado el Ejército Mexicano el cambio ha sido avalado por la presidenta Claudia Sheinbaum. ¿Qué opinas? https://t.co/m1NtrbCuSA https://t.co/s5pZgIdla9","1855357269602398254","https://pbs.twimg.com/media/Gb-Mw1QWQAEQ7hJ.jpg","","es","Mexico","0","0","1","https://x.com/ELDEBATE/status/1855357269602398254","57719142","ELDEBATE"
"1855360187982295496","Sat Nov 09 21:21:54 +0000 2024","1528","¿Ves a esa señora en el balcón? Es la principal líder de la oposición al gobierno de Milei. Pánico le tienen. La van a condenar como hace cualquier régimen autoritario que no puede ganarle a su oponente en buena ley. Se la condena como se hizo hace poco en Brasil con Lula.","1855360187982295496","","","es","Provincia de Buenos Aires","92","2098","614","https://x.com/ditulliojuli/status/1855360187982295496","4449919888","ditulliojuli"
"1854892552329302456","Fri Nov 08 14:23:41 +0000 2024","4","#ElAsaltoALaRazón | La insaciable avidez lopezobradorista hecha suya por la presidenta Claudia Sheinbaum para demoler la estructura constitucional de contrapesos republicanos ha tenido en el Poder Judicial su banquete más exquisito ️ Lee y escucha la columna de https://t.co/wMZsRdev8Y","1854892552329302456","https://pbs.twimg.com/media/Gb3m8LAaMAAn4GT.jpg","","es","México","1","0","2","https://x.com/Milenio/status/1854892552329302456","24969337","Milenio"
"1854909413456593094","Fri Nov 08 15:30:41 +0000 2024","435","#VIDEO | Pide @Claudiashein al #INE medirse con el presupuesto que solicita para el 2025 ¡ No puede ser! dice la presidenta https://t.co/YJyXaUJShk","1854909413456593094","https://pbs.twimg.com/ext_tw_video_thumb/1854909307558739968/pu/img/CE0ETBYCRiCZlCtd.jpg","","es","","1","17","167","https://x.com/NachoRgz/status/1854909413456593094","68723105","NachoRgz"
"1855124409171783720","Sat Nov 09 05:45:00 +0000 2024","2","El secretario de Relaciones Exteriores Juan Ramón de la Fuente adelantó que dentro de la agenda de la presidenta Claudia Sheinbaum en la reunión del G20 en Brasil participará en las sesiones plenarias del 18 de noviembre. Escúchanos en #iHeartRadio Rv","1855124409171783720","","","es","Ciudad de México","0","0","0","https://x.com/889Noticias/status/1855124409171783720","38277042","889Noticias"
"1854746467501539332","Fri Nov 08 04:43:12 +0000 2024","4","▶️ La presidenta Claudia Sheinbaum sostuvo una llamada telefónica con el virtual presidente electo Donald Trump; Sheinbaum asgura que hablaron de la buena relación que habrá entre México y EU #Milenio22h con @hzamarron https://t.co/ibXkTQWPly","1854746467501539332","https://pbs.twimg.com/amplify_video_thumb/1854743300508360705/img/zc2MRVtxL5JlY-1w.jpg","","es","México","1","4","3","https://x.com/Milenio/status/1854746467501539332","24969337","Milenio"
"1855251659078643882","Sat Nov 09 14:10:39 +0000 2024","0","#CosasDeLaCiudad: Amplio respaldo ciudadano recibió la presidenta Claudia Sheinbaum en su primera visita como mandataria nacional a SLP Lee aquí nuestra editorial: https://t.co/no6yKAfvKw https://t.co/b64COrmXMQ","1855251659078643882","https://pbs.twimg.com/media/Gb8th48WwAEAFlN.jpg","","es","San Luis Potosí, México","0","0","0","https://x.com/ElHeraldoSLP/status/1855251659078643882","242610822","ElHeraldoSLP"
"1855363869503627415","Sat Nov 09 21:36:32 +0000 2024","0","#EntérateTH️| La presidenta Claudia Sheinbaum (@Claudiashein) inauguró este sábado el Camino artesanal Pata de Gallo-Santiago Teneraca primera etapa en Mezquital Durango. https://t.co/XgVUDpMN1S","1855363869503627415","","","es","Tabasco, México.","0","0","0","https://x.com/TabascoHOY/status/1855363869503627415","81852072","TabascoHOY"
"1854936923938181277","Fri Nov 08 17:20:00 +0000 2024","62","#OchoColumnas ️ Harfuch concentrará información anticrimen: será el mando de plan nacional de seguridad La presidenta Claudia Sheinbaum busca que el secretario pase de solo proponer a coordinar y dirigir . https://t.co/bh5TvkkblV","1854936923938181277","","","es","México","1","9","17","https://x.com/Milenio/status/1854936923938181277","24969337","Milenio"
"1854719058840596948","Fri Nov 08 02:54:17 +0000 2024","141"," Luego de nueve días después de renunciar al PRI la senadora Cynthia López se reunió en Palacio Nacional con la presidenta Claudia Sheinbaum https://t.co/bEbMpl3Yih","1854719058840596948","","","es","Centro de la Ciudad de México","9","39","35","https://x.com/El_Universal_Mx/status/1854719058840596948","16676396","El_Universal_Mx"
"1854899611669794888","Fri Nov 08 17:15:55 +0000 2024","307","@luzelenachavez8 @realDonaldTrump Voy a decir una diferencia abismal entre Claudia Sheinbaum y Elena Chávez. @Claudiashein es nuestra predidentA una mujer preparada realizada profesionalmente y con amor por Mexico. Elena solo es una mujer despechada intrigosa y arguendera que va por ahí destilando odio y veneno.","1854935894857294171","","luzelenachavez8","es","","4","36","50","https://x.com/MauZavala01/status/1854935894857294171","1677432026302144513","MauZavala01"
"1855089835205095490","Sat Nov 09 03:27:37 +0000 2024","2","La titular de la Secretaría de Bienestar Ariadna Montiel visitó San Luis Potosí como parte de la gira de trabajo de la presidenta Claudia Sheinbaum. https://t.co/SbwsKXEZVd","1855089835205095490","","","es","Ciudad Imagen","0","0","1","https://x.com/Excelsior/status/1855089835205095490","104683173","Excelsior"
"1855276119617863768","Sat Nov 09 15:47:50 +0000 2024","520","Justicia a la carta para cobardes. Oiga José Luis quédese tranquilo que la justicia la va a proscribir antes así ustedes no se mueren de un susto o de un disgusto. ‍️","1855276119617863768","","","es","Provincia de Buenos Aires","16","137","178","https://x.com/ditulliojuli/status/1855276119617863768","4449919888","ditulliojuli"
"1854956654057734657","Fri Nov 08 18:38:24 +0000 2024","321","Los malos deseos de la oposición siempre se les regresan. Por más que desean que a México le vaya mal con Donald Trump todo sale perfecto. Hoy la presidenta @Claudiashein describió la llamada que sostuvo con @realDonaldTrump como muy cordial y hasta le envío saludos a AMLO. https://t.co/Bwu0YzStSF","1854956654057734657","https://pbs.twimg.com/ext_tw_video_thumb/1854954047599788032/pu/img/gkPytpqGAZXNQVAN.jpg","","es","Mexico","0","4","143","https://x.com/Mike_Oviedo/status/1854956654057734657","84953920","Mike_Oviedo"
"1855392425000173789","Sat Nov 09 23:30:00 +0000 2024","0","Durante su visita en Durango la presidenta Claudia Sheinbaum (@Claudiashein) destacó la buena comunicación y la estrecha relación con el gobierno del estado https://t.co/Mf358lrchn","1855392425000173789","","","es","México","0","1","1","https://x.com/LaRazon_mx/status/1855392425000173789","47379940","LaRazon_mx"
"1855093650868371945","Sat Nov 09 03:42:46 +0000 2024","267","EL MOMENTO️ En San Luis Potosí: una niña subió al templete y al ver a @Claudiashein gritó ¡Presidenta! La mandataria la cargó y continuó su discurso 🇲🇽‍ https://t.co/gcmnao6zok","1855093650868371945","https://pbs.twimg.com/amplify_video_thumb/1855093596753416192/img/S_Fz7HvnYXlkm-Zj.jpg","","es","","20","443","45","https://x.com/LuisCardenasMx/status/1855093650868371945","69334913","LuisCardenasMx"
"1855343905342153211","Sat Nov 09 20:17:12 +0000 2024","0","La presidenta Claudia Sheinbaum se reunió con los representantes de los pueblos originarios del municipio de Mezquital en Durango. La información con Israel Aldave. #FórmulaNoticias con Michelle Rivera (@michelleriveraa). https://t.co/cc4U1QFTTR","1855343905342153211","https://pbs.twimg.com/amplify_video_thumb/1855341962821521408/img/ZnDJ5avg4qGh9Nc9.jpg","","es","Ciudad de Mexico","0","0","0","https://x.com/Radio_Formula/status/1855343905342153211","148372339","Radio_Formula"
"1854904664577261899","Fri Nov 08 15:11:49 +0000 2024","1048","Vencemos a mentira o ódio e a injustiça. Um viva ao presidente @LulaOficial que nunca desistiu de lutar e jamais trocou a sua dignidade por sua liberdade. https://t.co/6dr9nb0xVo","1854904664577261899","https://pbs.twimg.com/ext_tw_video_thumb/1854904609145225216/pu/img/vxX4n90AF7yi8cU-.jpg","","pt","Pernambuco","14","379","150","https://x.com/senadorhumberto/status/1854904664577261899","76049312","senadorhumberto"
"1854909164159402121","Fri Nov 08 15:29:41 +0000 2024","619","El próximo miércoles 13 de noviembre a las 9 horas estaremos junto a @JuanGrabois la periodista y política brasileña @ManuelaDavila y la decana de la Facultad de Derecho de la Universidad Nacional de Avellaneda @AnabellaLucardi frente a los tribunales de Comodoro Py dictando https://t.co/9ofAlNYSif","1854909164159402121","https://pbs.twimg.com/media/Gb32CmqXYAAievT.jpg","","es","Argentina","18","84","397","https://x.com/juanmmena/status/1854909164159402121","211171480","juanmmena"
"1855377186934739175","Sat Nov 09 22:29:27 +0000 2024","2","Desde Durango la presidenta de México Claudia Sheinbaum (@Claudiashein) afirmó que continuarán todos los planes de justicia para las comunidades indígenas. https://t.co/mU2x04Hlbe","1855377186934739175","","","es","Ciudad de Mexico","0","0","1","https://x.com/Radio_Formula/status/1855377186934739175","148372339","Radio_Formula"
"1855362978683511186","Sat Nov 09 21:32:59 +0000 2024","0","#Entérate Luego de que la presidenta Claudia Sheinbaum Pardo anunció el nuevo programa Bachetón los constructores de Zacatecas esperan ser tomados en cuenta para realizar estas labores en el estado. https://t.co/wOo9CzeTW8","1855362978683511186","","","es","Zacatecas, México","0","0","0","https://x.com/ntrzacatecas/status/1855362978683511186","104977066","ntrzacatecas"
"1855326006011408819","Sat Nov 09 19:06:04 +0000 2024","734","Está encaminada la estrategia de seguridad de la Presidenta @Claudiashein cada día avanza y avanza firme. Este golpazo CO es parte de ello. https://t.co/RbWqzLkLve","1855326006011408819","https://pbs.twimg.com/amplify_video_thumb/1855325937522315265/img/gjx0NuslajZzAybs.jpg","","es","","5","54","313","https://x.com/AmirIbrahimQRoo/status/1855326006011408819","1358838060","AmirIbrahimQRoo"
"1855250444882153894","Sat Nov 09 14:05:49 +0000 2024","122","En San Luis Potosí la Presidenta Claudia Sheinbaum @Claudiashein llamó a todos los egresados de derecho del país a registrarse para participar en la elección del poder judicial 104.1 FM 103.3 FM - 1500 AM 970 AM @Radio_Formula / #TeleFórmula https://t.co/KZB8W4xhiQ","1855250444882153894","","","es","México","1","4","44","https://x.com/juanbaaq/status/1855250444882153894","49540008","juanbaaq"
"1855248980071899587","Sat Nov 09 14:00:00 +0000 2024","3","El titular de la SRE Juan Ramón de la Fuente confirmó que la presidenta Claudia Sheinbaum participará en la reunión del G20 en Río de Janeiro Brasil. Aquí te contamos cómo será su agenda.⬇️ #C21Noticias https://t.co/tbD2MnuPSS","1855248980071899587","","","es","Moras 533, Del Valle Sur, CDMX","0","0","0","https://x.com/C21Noticias/status/1855248980071899587","1278821564805414912","C21Noticias"
"1855081007587749985","Sat Nov 09 02:52:32 +0000 2024","10","Rafael Cardona y su Cristalazo comentó que la presidenta Claudia Sheinbaum ya entabló comunicación con quien será el próximo mandatario de Estados Unidos Donald Trump https://t.co/o3fFtnkD8u","1855081007587749985","","","es","México","1","2","2","https://x.com/JoseCardenas1/status/1855081007587749985","93797343","JoseCardenas1"
"1855357279945498721","Sat Nov 09 21:10:21 +0000 2024","0","La Presidenta Claudia Sheinbaum pretende mantener el aumento del salario mínimo por encima del porcentaje de inflación en el país. https://t.co/zy1VfnUm3r @raymondorta","1855357279945498721","","","es","Caracas, Venezuela","0","0","0","https://x.com/DerechoLaboral/status/1855357279945498721","48323293","DerechoLaboral"
"1855284515389821336","Sat Nov 09 16:21:12 +0000 2024","0","Así quedaría el salario mínimo para el 2025. La presidenta Claudia Sheinbaum dio a conocer que el sueldo de los trabajadores debe estar por encima ... https://t.co/naO3SUnbK7 @raymondorta","1855284515389821336","","","es","Caracas, Venezuela","0","0","0","https://x.com/DerechoLaboral/status/1855284515389821336","48323293","DerechoLaboral"
"1854955044728455402","Fri Nov 08 18:32:00 +0000 2024","320","Lutou a vida inteira como uma comunista. Em 2024 abraçou o capitalismo virou empreendedora faturou com marketing político e parece que não elegeu ninguém. https://t.co/BpkqbUlBpM","1854955044728455402","https://pbs.twimg.com/media/Gb4fyDDWkAAyz04.jpg","","pt","","4","59","26","https://x.com/TumultoBR/status/1854955044728455402","117555064","TumultoBR"
"1855159497699795379","Sat Nov 09 08:04:26 +0000 2024","0","La presidenta Claudia Sheinbaum se comprometió con los potosinos a que el tren de pasajeros conectará diversas áreas del estado cubriendo todo San Luis Potosí; ¿Crees que lo cumplirá?","1855159497699795379","","","es","San Luis Potosí, México","0","0","0","https://x.com/Planoinforma/status/1855159497699795379","168693277","Planoinforma"
"1854808143710040277","Fri Nov 08 08:48:16 +0000 2024","1906","Há 5 anos Presidente @LulaOficial era inocentado e saía livre da Polícia Federal em Curitiba. Foram 580 dias de resistência e a luta valeu a pena: Lula voltou à presidência o emprego cresceu a renda aumentou e o Brasil voltou a cuidar de quem mais precisa. Viva Lula! https://t.co/b4axk2vrjU","1854808143710040277","https://pbs.twimg.com/media/Gb2aLOXWwAA9uB7.jpg","","pt","Rio Grande do Sul, Brasil","91","1419","326","https://x.com/Pimenta13Br/status/1854808143710040277","22864100","Pimenta13Br"
"1854896351999381889","Fri Nov 08 14:38:47 +0000 2024","8"," El secretario de Relaciones Exteriores Juan Ramón de la Fuente explica cuál será la agenda de la presidenta Claudia Sheinbaum en su participación en el G20 #LaMananeraDeSheinbaum https://t.co/kZgOlKLud9","1854896351999381889","https://pbs.twimg.com/ext_tw_video_thumb/1854896301793538048/pu/img/KHBPFbVJaTFVMsAC.jpg","","es","Centro de la Ciudad de México","1","0","3","https://x.com/El_Universal_Mx/status/1854896351999381889","16676396","El_Universal_Mx"
"1854892032692564307","Fri Nov 08 14:21:37 +0000 2024","1153","#MañaneraDelPueblo | Vamos a ir en Avión comercial vamos y regresamos en avión comercial y es una muy pequeña delegación va obviamente Juan Ramón de la Fuente va Luz Elena Gonzáles porque el segundo día se tocan temas de energía va Paulina Juan José una fotógrafa y su https://t.co/Lmf7dwklDz","1854892032692564307","https://pbs.twimg.com/ext_tw_video_thumb/1854891244263989248/pu/img/Jo_0XWXcmNbwb_H3.jpg","","es","","4","51","494","https://x.com/juncalssolano/status/1854892032692564307","899081012172300288","juncalssolano"
"1855251733016133737","Sat Nov 09 14:10:56 +0000 2024","11","La presidenta Claudia Sheinbaum encabezó un evento donde presentó los programas sociales en San Luis Potosí. Destacó una pequeña que se subió al templete donde se encontraba la mandataria. Informó Israel Aldave. #FórmulaNoticias con Juan Becerra (@juanbaaq). https://t.co/OAvVkplZf1","1855251733016133737","https://pbs.twimg.com/amplify_video_thumb/1855251360134094848/img/3LNEgI2iyt_uRlQl.jpg","","es","Ciudad de Mexico","0","1","3","https://x.com/Radio_Formula/status/1855251733016133737","148372339","Radio_Formula"
"1854949308329869357","Fri Nov 08 18:09:58 +0000 2024","1","La Presidenta Claudia Sheinbaum reveló que Donald Trump le dijo see you soon (nos vemos pronto) durante la llamada que sostuvieron y que le envió saludos al ex Presidente AMLO. https://t.co/bkqcsa8ObK Especial https://t.co/cZpSpCX99e","1854949499023900841","https://pbs.twimg.com/media/Gb4atpNX0AEF-K5.png","Reforma","es","Av. México Coyoacán 40","0","2","0","https://x.com/Reforma/status/1854949499023900841","27708897","Reforma"
"1854588744692564169","Fri Nov 08 01:16:26 +0000 2024","274","@claudiacris16 @TodoNegativo La mujer más poderosa del mundo y no puede contra los narcos ","1854694436707463587","","claudiacris16","es","León, Guanajuato","0","9","0","https://x.com/JuanSoloo_O/status/1854694436707463587","2494407716","JuanSoloo_O"
"1855307189000241178","Sat Nov 09 17:51:18 +0000 2024","517","INCONSEQUENTE LULA AGREDIU TRUMP E AGORA FAZ CRÍTICAS ABSURDAS AO HOMEM MAIS FORTE DO NOVO GOVERNO https://t.co/VMwuuWxj4O Quanta debilidade. https://t.co/VMwuuWxj4O","1855307189000241178","","","pt","","4","21","124","https://x.com/JornalDaCidadeO/status/1855307189000241178","994303120376303616","JornalDaCidadeO"
"1855089664060723580","Sat Nov 09 03:26:56 +0000 2024","1","Agradece la gobernadora electa Rocío Nahle el respaldo de la presidenta Claudia Sheinbaum a Veracruz https://t.co/2nBgQzjNj6 #NiusDeVeracruz @Claudiashein @rocionahle https://t.co/wTd0I3qohb","1855089664060723580","https://pbs.twimg.com/media/Gb6Z-d8XAAAzIK7.jpg","","es","Xalapa, Veracruz, México","0","0","1","https://x.com/pablojair/status/1855089664060723580","40574138","pablojair"
