"conversation_id_str","created_at","favorite_count","full_text","id_str","image_url","in_reply_to_screen_name","lang","location","quote_count","reply_count","retweet_count","tweet_url","user_id_str","username"
"1860859738453332252","Mon Nov 25 01:35:09 +0000 2024","338","️ Mandarle mi más respetuoso saludo a los compatriotas que no nos votaron porque hoy el pueblo decidió . Así comenzó su discurso Carolina Cosse tras ser electa vicepresidenta y dijo que hoy se inicia el camino al futuro del Uruguay . #UruguayDecide ️🇺🇾 https://t.co/vK67HbLIYZ","1860859738453332252","https://pbs.twimg.com/ext_tw_video_thumb/1860859507909201920/pu/img/EBmxuA1qPXEoShd9.jpg","","es","Uruguay","4","8","31","https://x.com/TelenocheUy/status/1860859738453332252","203176940","TelenocheUy"
"1861130232863879488","Mon Nov 25 19:30:00 +0000 2024","12","#Entérate | La presidenta Claudia Sheinbaum (@Claudiashein) mantiene el respaldo de la ciudadanía al contar con 74% de aprobación de acuerdo con la encuesta nacional de Buendía &amp; Márquez. #OnceNoticiasDigital https://t.co/rUOol6eBq5","1861130232863879488","","","es","México","0","0","3","https://x.com/OnceNoticiasTV/status/1861130232863879488","1413528254","OnceNoticiasTV"
"1860839965350838479","Mon Nov 25 00:22:29 +0000 2024","782","@porktendencia Pero dice Claudia que con su mandato estaremos más seguros esperemos y mi novia pueda recuperarse de ese trauma.","1860841452391075905","","porktendencia","es","🫶🏿","0","4","11","https://x.com/Alexisssgm/status/1860841452391075905","1653941783938596864","Alexisssgm"
"1861061812516761760","Mon Nov 25 14:58:07 +0000 2024","25","#ULTIMAHORA | La presidenta Claudia Sheinbaum confirma que asistirá a la toma de posesión de Rocío Nahle como gobernadora de Veracruz https://t.co/dm1CFdbhmo","1861061812516761760","https://pbs.twimg.com/tweet_video_thumb/GdPR2Poa8AAvhBU.jpg","","es","México, Distrito Federal","1","5","7","https://x.com/lasillarota/status/1861061812516761760","152358615","lasillarota"
"1860722694292939255","Sun Nov 24 16:37:21 +0000 2024","1652","@NP__Oficial Não é um simples gesto de pouco caso é uma demonstração de dignidade. Não se aplaude fascistas defensores de tortura. Dilma é sinônimo de dignidade e coerência aos princípios democráticos. Os meus aplausos são para Ela!","1860724395880182029","","NP__Oficial","pt","","0","8","35","https://x.com/CarlaRi49818184/status/1860724395880182029","1143984421986623488","CarlaRi49818184"
"1861163215490527357","Mon Nov 25 21:41:03 +0000 2024","305"," SHEINBUAM PONE EN SU LUGAR A QUADRI La PRESIDENTA @claudiashein le da una lección de HUMILDAD al excandidato presidencial @g_quadri y expone la HIPOCRESÍA y el RACISMO de la derecha. Como dirían un sabio tabasqueño Para tener la lengua larga hay que tener la cola corta . https://t.co/drt6OqC8kz","1861163215490527357","https://pbs.twimg.com/media/GdQtNPJWkAEmyZT.jpg","","es","Ciudad de México","5","26","68","https://x.com/callodehacha/status/1861163215490527357","56800690","callodehacha"
"1861050627566211575","Mon Nov 25 14:13:40 +0000 2024","698"," A casi dos meses de haber asumido el cargo la Presidenta @Claudiashein cuenta con una aprobación de 74% revela una encuesta de @buendiaymarquez publicada en @El_Universal_Mx https://t.co/OTAOr9T95I","1861050627566211575","https://pbs.twimg.com/media/GdPHrqvaQAAvoIn.jpg","","es","Mexico","11","81","366","https://x.com/epigmenioibarra/status/1861050627566211575","54649261","epigmenioibarra"
"1861093815857090699","Mon Nov 25 17:16:49 +0000 2024","1","Durante su mañanera la Presidenta Claudia Sheinbaum habló sobre la seguridad en Tabasco tras los ataques de comandos armados en una boda y un bar. La Mandataria señaló que todo el Gabinete de Seguridad trabaja en una estrategia especial para el estado. https://t.co/tvJfC0knaZ https://t.co/oDUr3PgTTK","1861096717535383690","https://pbs.twimg.com/ext_tw_video_thumb/1861096622526017537/pu/img/tCcOMW-m6O26mNjo.jpg","Reforma","es","Av. México Coyoacán 40","0","1","0","https://x.com/Reforma/status/1861096717535383690","27708897","Reforma"
"1860849552934215799","Mon Nov 25 00:54:40 +0000 2024","301","#AHORA | Nuestra democracia goza de buena salud y eso es un triunfo de todas y todos dijo la vicepresidenta electa Carolina Cosse. https://t.co/IF8ukjqMiV","1860849552934215799","https://pbs.twimg.com/ext_tw_video_thumb/1860849033180286977/pu/img/o_VVEKFf6Ghkau9l.jpg","","es","Montevideo, Uruguay","1","12","26","https://x.com/Subrayado/status/1860849552934215799","124230776","Subrayado"
"1861142694200070438","Mon Nov 25 20:19:31 +0000 2024","411","Fue un honor acompañar a la presidenta @Claudiashein a la alcaldía #Xochimilco en la firma del Acuerdo Nacional por el Derecho Humano al Agua. Resultó satisfactorio ver el compromiso de las y los gobernadores de todo el país sumarse a este esfuerzo que garantizará el acceso a https://t.co/nOZozegwZX","1861142694200070438","https://pbs.twimg.com/media/GdQbR3iWIAA-gIv.jpg","","es","","4","29","159","https://x.com/ErnestinaGodoy_/status/1861142694200070438","574103146","ErnestinaGodoy_"
"1861061010137739559","Mon Nov 25 14:54:56 +0000 2024","464","Claudia es literalmente esto ️️ #Mafin https://t.co/6BY8bAS7Cr","1861061010137739559","https://pbs.twimg.com/ext_tw_video_thumb/1861060941145616384/pu/img/T7osL3IoRBGJzwID.jpg","","es","España","11","1","29","https://x.com/CLuimelia/status/1861061010137739559","1118906998614106112","CLuimelia"
"1861125598774448321","Mon Nov 25 19:11:35 +0000 2024","2","Esteban Villegas (@EVillegasV) aplaudió este la intención de la Presidenta Claudia Sheinbaum (@Claudiashein) de realizar un concurso de corridos para combatir apología a la violencia https://t.co/K3qnP7dulg","1861125598774448321","","","es","México","1","1","1","https://x.com/LaRazon_mx/status/1861125598774448321","47379940","LaRazon_mx"
"1861116361935622402","Mon Nov 25 18:34:53 +0000 2024","15","#Noticias: Según el más reciente estudio de opinión realizado por Buendía y Márquez la presidenta Claudia Sheinbaum (@Claudiashein) registra un índice de aprobación general del 74%. #EncuastasPresidenciales #GobiernoDeMéxico https://t.co/d7e6QUesdU","1861116361935622402","","","es","México","0","0","7","https://x.com/SentidoComunMx_/status/1861116361935622402","1513636658683469825","SentidoComunMx_"
"1861191428208239072","Mon Nov 25 23:33:10 +0000 2024","16","️ FUE TODO UN ÉXITO LA INSCRIPCIÓN DE ASPIRANTES A LA ELECCIÓN DEL PODER JUDICIAL: PRESIDENTA CLAUDIA SHEINBAUM; SE REGISTRARON 18 447 PERSONAS ● ● Fue todo un éxito algo inédito histórico la inscripción de personas para ser parte del Poder Judicial destacó la Jefa del","1861191428208239072","","","es","México, D.F.","0","0","16","https://x.com/CelesteSaenzM/status/1861191428208239072","2372314050","CelesteSaenzM"
"1861078543293096253","Mon Nov 25 16:04:36 +0000 2024","106","#MañaneraDelPueblo | La Presidenta Claudia Sheinbaum confirma que asistirá a la toma de protesta de Rocío Nahle (@rocionahle ) como Gobernadora Constitucional de Veracruz el 1 de diciembre. Y le envió este mensaje: https://t.co/rpFsH9H7yy","1861078543293096253","https://pbs.twimg.com/ext_tw_video_thumb/1861077979314503680/pu/img/VpQAzRC-21eUvmO4.jpg","","es","","0","10","37","https://x.com/juncalssolano/status/1861078543293096253","899081012172300288","juncalssolano"
"1860775570696446353","Sun Nov 24 20:00:42 +0000 2024","369","LO MÁS LEIDO | A partir del Plan Nacional Hídrico el gobierno encabezado por la presidenta @Claudiashein busca garantizar el #DerechoHumano al agua y priorizar su uso para consumo humano #Contralínea #PeriodismodeInvestigación https://t.co/704W6CdxUR","1860775570696446353","","","es","México","1","5","226","https://x.com/contralinea/status/1860775570696446353","28608099","contralinea"
"1861137673156731324","Mon Nov 25 19:59:34 +0000 2024","2","Los gobernadores junto a la presidenta Claudia Sheinbaum (@Claudiashein) firmaron el Acuerdo Nacional por el Derecho al Agua y Sustentabilidad https://t.co/OFwcOrXURK","1861137673156731324","","","es","México","0","0","1","https://x.com/diario24horas/status/1861137673156731324","357050985","diario24horas"
"1861176631001251890","Mon Nov 25 22:34:22 +0000 2024","729","La Presidenta Claudia Sheinbaum felicitó vía telefónica a Yamandú Orsi tras haber ganado las elecciones presidenciales en Uruguay","1861176631001251890","","","es","México","1","16","236","https://x.com/juanbaaq/status/1861176631001251890","49540008","juanbaaq"
"1861039177930015147","Mon Nov 25 13:28:11 +0000 2024","7","¡EN VIVO! Conferencia del pueblo de la presidenta Claudia Seinbaum https://t.co/pPSAVHSqP4","1861039177930015147","","","es","San Pejesburgo, EdoMex","0","0","1","https://x.com/Erickisback1/status/1861039177930015147","981162088482603008","Erickisback1"
"1861097410329747603","Mon Nov 25 17:19:34 +0000 2024","0","#LaMañaneradelPueblo ️| Te compartimos los puntos más relevantes de la #ConferenciaDePrensa de la presidenta Claudia Sheinbaum Pardo (@Claudiashein). #México #Tabasco #Relevante https://t.co/kIZYO1eznK https://t.co/OASYQMgbUo","1861097410329747603","https://pbs.twimg.com/media/GdPyHbGa4AAl4Zk.jpg","","es","Tabasco, México.","0","0","0","https://x.com/TabascoHOY/status/1861097410329747603","81852072","TabascoHOY"
"1861109212362805572","Mon Nov 25 18:06:28 +0000 2024","0","▶ #Video | La gobernadora de Baja California Marina del Pilar (@MarinadelPilar) agradece a la presidenta Claudia Sheinbaum (@Claudiashein) impulsar este acuerdo. Subraya que se enmarca como un acontecimiento de justicia social para garantizar este recurso a la población https://t.co/b1fz8X9B9n","1861109212362805572","https://pbs.twimg.com/ext_tw_video_thumb/1861108980040273920/pu/img/jzhZl0bu2J_zBTb3.jpg","","es","México","0","0","2","https://x.com/LaRazon_mx/status/1861109212362805572","47379940","LaRazon_mx"
"1861103164268712109","Mon Nov 25 17:42:26 +0000 2024","266","Señor presidente ésto es un tributo a su humanismo a su amor y al respeto que usted le prodiga al pueblo. Gracias porque a pesar de tanta oposición usted sigue de pie luchando por justicia social https://t.co/eAd2z2CRWY","1861103164268712109","https://pbs.twimg.com/ext_tw_video_thumb/1861103108635426816/pu/img/JnJ5aQRLLyVSa9Bt.jpg","","es","","2","1","166","https://x.com/ClaudiaWitte7/status/1861103164268712109","1016196199500713984","ClaudiaWitte7"
"1861118356696473736","Mon Nov 25 18:42:48 +0000 2024","176","Un gusto reunirme con Octavio Romero Director General del @Infonavit La agenda de vivienda digna para las mexicanas y los mexicanos es prioridad del Gobierno que encabeza la Presidenta Claudia Sheinbaum y de la mano de liderazgos como Octavio será sello de esta administración https://t.co/Sp1gvCZshL","1861118356696473736","https://pbs.twimg.com/media/GdQFRvmXkAAq9KJ.jpg","","es","Guadalajara, Jalisco","1","25","51","https://x.com/mery_pozos/status/1861118356696473736","251860161","mery_pozos"
"1861039641367069006","Mon Nov 25 13:30:01 +0000 2024","252","Sigue la #MañaneraDelPueblo de la presidenta @Claudiashein desde #PalacioNacional este lunes. #OnceNoticias #MañaneraDelPueblo #FelizLunes https://t.co/oJN9GrqkVm","1861039641367069006","","","es","","0","3","83","https://x.com/CanalOnceTV/status/1861039641367069006","80064831","CanalOnceTV"
"1861103906693984339","Mon Nov 25 17:45:23 +0000 2024","30","Claudia una Presidenta de guerra https://t.co/tgA5tLGFb5","1861103906693984339","","","es","México DF","2","10","3","https://x.com/leozuckermann/status/1861103906693984339","89327845","leozuckermann"
"1861137655586496819","Mon Nov 25 19:59:30 +0000 2024","3","La presidenta Claudia Sheinbaum calificó como un éxito el registro de aspirantes a la elección judicial: El pueblo de México está consciente y activo. El Poder Judicial se va a transformar para bien . @lopezdoriga https://t.co/mP24t8PZ5a","1861137655586496819","https://pbs.twimg.com/amplify_video_thumb/1861136328412246016/img/aWAoSUz4xVZeNwYa.jpg","","es","Ciudad de Mexico","0","1","1","https://x.com/Radio_Formula/status/1861137655586496819","148372339","Radio_Formula"
"1861146567375495359","Mon Nov 25 20:34:54 +0000 2024","0","#EntérateTH️|Con concurso de banda y corridos la presidenta Claudia Sheinbaum (@ClaudiaShein) busca promover la música mexicana pero con otras letras con otra creatividad . #ClickAquí https://t.co/bNv0D1vcTb","1861146567375495359","","","es","Tabasco, México.","0","0","0","https://x.com/TabascoHOY/status/1861146567375495359","81852072","TabascoHOY"
"1861043568791425355","Mon Nov 25 13:45:37 +0000 2024","429"," Vamos a atacar las causas de las masacres y el terrorismo. Vamos a construir trenes y plantar arbolitos... Claudia Sheinbaum","1861043568791425355","","","es","","5","10","94","https://x.com/PFifiona/status/1861043568791425355","1307515814279614464","PFifiona"
"1861038445004509343","Mon Nov 25 13:25:16 +0000 2024","9789","AMEAÇA DE PRISÃO CONTRA LULA FEITA POR LÍDER INTERNACIONAL ESCANCARA A IMAGEM SUJA DO BRASIL https://t.co/7eUDcBxuhb Vergonha internacional! https://t.co/7eUDcBxuhb","1861038445004509343","","","pt","","71","499","2753","https://x.com/JornalDaCidadeO/status/1861038445004509343","994303120376303616","JornalDaCidadeO"
"1861122212536721888","Mon Nov 25 18:58:08 +0000 2024","543","Claudia Sheinbaum (@Claudiashein) es una presidenta popular pero débil. Ella no manda. https://t.co/BJJ5HT5YOM","1861122212536721888","https://pbs.twimg.com/amplify_video_thumb/1861120730005405696/img/ild6E6JFKNzA5qYR.jpg","","es","Ciudad de México, México","5","46","173","https://x.com/Arouet_V/status/1861122212536721888","933480950515863552","Arouet_V"
"1861165373405466803","Mon Nov 25 21:49:38 +0000 2024","410","¡Con Claudia llegaron todas (las masacres) juntas!","1861165373405466803","","","es","","1","19","82","https://x.com/PFifiona/status/1861165373405466803","1307515814279614464","PFifiona"
"1861091368463901018","Mon Nov 25 16:55:34 +0000 2024","219","La vicepresidente de URUGUAY .ultra zurda. Justifica las dictaduras de Cuba y Venezuela. Uruguay Q.E.P.D. https://t.co/gFkfKAJ16I","1861091368463901018","https://pbs.twimg.com/media/GdPsuO-WIAEYMFL.jpg","","es","","6","43","141","https://x.com/LadyAMA01091892/status/1861091368463901018","1176371225779757056","LadyAMA01091892"
"1861173918763229474","Mon Nov 25 22:23:35 +0000 2024","125","La elección de Trump cambió radicalmente la Presidencia de Sheinbaum. La nueva prioridad es preparar y ejecutar una estrategia con el fin de minimizar el daño que puede hacernos Trump 2.0. https://t.co/tgA5tLHd0D","1861173918763229474","","","es","México DF","14","78","34","https://x.com/leozuckermann/status/1861173918763229474","89327845","leozuckermann"
"1861095514155958349","Mon Nov 25 17:12:02 +0000 2024","4863","VIVA MARÍA CORINA MACHADO DONDE QUIERA QUE ESTES YA CUMPLISTE LLEVASTE A EDMUNDO A LA PRESIDENCIA DESPERTASTE UN PUEBLO DOPADO Y DESENMASCARASTE EL DICTADOR JUNTO A SUS ALACRANES... SE QUE ESTAS EN EL CORAZÓN DE UN PUEBLO QUE TE QUIERE... https://t.co/OTNJwCfe74","1861095514155958349","https://pbs.twimg.com/media/GdPwgg_XIAAShYp.jpg","","es","Maracaibo, Venezuela","13","98","1710","https://x.com/PedroRe83754598/status/1861095514155958349","1236311158098927617","PedroRe83754598"
"1860856062414381445","Mon Nov 25 01:20:32 +0000 2024","335","Claudia asume la presidencia con la sombra de AMLO aún al mando. ¿Estamos frente a un nuevo maximato? Desde la CNDH hasta la reforma judicial el control de AMLO sigue presente. La gran pregunta: ¿se enfrentará Claudia a su mentor o será solo una extensión de su poder? https://t.co/aiqcVJlm8B","1860856062414381445","https://pbs.twimg.com/ext_tw_video_thumb/1860855770738257920/pu/img/8EQNC1k4w36fJ556.jpg","","es","","6","15","177","https://x.com/minutocriticomx/status/1860856062414381445","1794508440527929344","minutocriticomx"
"1860651762325073927","Sun Nov 24 11:48:44 +0000 2024","458","🇪🇸🇧🇪ALACRANESFORO CÍVICO COLETTE CAPRILES PIDE LEVANTAR-SANCIONES y ENTREGAR la PRESIDENCIA a MADURO CAPRILES TAMBIÉN GANÓ y LE ENTREGÓ a MADURO ROSALES también QUIERE el NEGOCIO en el fondo Maduro es bueno y puede liberar a los presos-políticos si lo dejan ser presidente https://t.co/1bFZVUzhg5","1860651762325073927","https://pbs.twimg.com/amplify_video_thumb/1860650785039650817/img/dGkLm-5ORH8fMALd.jpg","","es","","59","265","538","https://x.com/abogadosvenezu1/status/1860651762325073927","1100205810855096320","abogadosvenezu1"
"1861178907967574137","Mon Nov 25 22:43:25 +0000 2024","18","La presidenta Claudia Sheinbaum felicitó a Yamandú Orsi candidato de la izquierda del partido Frente Amplio por su elección nuevo presidente de Uruguay https://t.co/HMg7lIY26i","1861178907967574137","https://pbs.twimg.com/media/GdQ8Wbpa4AEYWqM.jpg","","es","","2","12","2","https://x.com/azucenau/status/1861178907967574137","93922911","azucenau"
"1861145332417200622","Mon Nov 25 20:30:00 +0000 2024","12","La presidenta Claudia Sheinbaum respaldó a Tabasco tras el ataque armado a un bar de Villahermosa con saldo de seis muertos. https://t.co/OLNKy5tL0T","1861145332417200622","","","es","Ciudad de México","0","13","3","https://x.com/lopezdoriga/status/1861145332417200622","236636515","lopezdoriga"
"1860867755387367714","Mon Nov 25 02:07:00 +0000 2024","234","En #G20Brasil2024 como Miss Universo @Claudiashein propuso elevar amor por encima del odio sembrar arbolitos y menos armas en el mundo. Pero un detallito la Presidenta con A lanzó 6 mentiras. Candil del G20 oscuridad en México. Video Completo:https://t.co/1p2699EY1T https://t.co/FGP99bzuB6","1860867755387367714","https://pbs.twimg.com/ext_tw_video_thumb/1860867733119721472/pu/img/bA2UELwuCTbB4sZU.jpg","","es","México","2","5","160","https://x.com/artur_espinosa/status/1860867755387367714","3065268433","artur_espinosa"
"1861044108795502859","Mon Nov 25 13:47:46 +0000 2024","880","Está contenta porque la ex intendente comunista de Montevideo que te contrató por USD 250.000 con la guita de los uruguayos ahora es vicepresidente? Que peligroso que triste. https://t.co/ZDGxCpmvXj","1861044108795502859","https://pbs.twimg.com/media/GdPBwNnWMAA8ORS.jpg","","es","República Argentina","7","16","202","https://x.com/TraductorTeAma/status/1861044108795502859","1266212657272696832","TraductorTeAma"
"1860813025093025975","Sun Nov 24 22:29:32 +0000 2024","310"," #AlertaLT | El PC pierde su última esperanza en Coquimbo: Cristóbal Juliá se queda con el sillón de la gobernación https://t.co/yJr3Is1OP3 https://t.co/QI5hj9d8AL","1860813025093025975","https://pbs.twimg.com/media/GdLvhCyWIAEp_Ji.jpg","","es","Santiago, Chile","5","21","91","https://x.com/latercera/status/1860813025093025975","3222731","latercera"
"1861074196589396181","Mon Nov 25 15:47:20 +0000 2024","286","La presidenta Claudia Sheinbaum adelantó que el día 1 de diciembre acompañará a Rocío Nahle a su toma de protesta como gobernadora de Veracruz si pudo hacer una refinería imagínense https://t.co/A8jHRxGEPe","1861074196589396181","https://pbs.twimg.com/ext_tw_video_thumb/1861065449611620352/pu/img/bjLcfU5es0EDjAFf.jpg","","es","","20","347","57","https://x.com/azucenau/status/1861074196589396181","93922911","azucenau"
"1861131790137860392","Mon Nov 25 19:36:11 +0000 2024","0","Durante la conferencia matutina de hoy la presidenta Claudia Sheinbaum se pronunció acerca del operativo Enjambre ; además abordó la problemática en el Estado de Tabasco. Información de Israel Aldave. #FormulaNoticias con Enrique Acevedo (@Enrique_Acevedo). https://t.co/apOc6ShoNi","1861131790137860392","https://pbs.twimg.com/ext_tw_video_thumb/1861131533488398337/pu/img/eJIfOZN1scbWhOOA.jpg","","es","Ciudad de Mexico","0","0","0","https://x.com/Radio_Formula/status/1861131790137860392","148372339","Radio_Formula"
"1860805599103234187","Sun Nov 24 22:00:01 +0000 2024","163"," Claudia Sheinbaum y sus cercanos cerraron filas para comenzar a tejer movimientos quirúrgicos que significarán una silenciosa disputa de poder con el expresidente López Obrador la #Opinión de @ClaudioOchoaH https://t.co/17ZyrmCnwx https://t.co/8z2dvLCQee","1860805599103234187","https://pbs.twimg.com/media/GdLdGasXoAAIRZ0.jpg","","es","Centro de la Ciudad de México","5","51","72","https://x.com/El_Universal_Mx/status/1860805599103234187","16676396","El_Universal_Mx"
"1861153298553643352","Mon Nov 25 21:01:39 +0000 2024","682","Tuve la oportunidad de saludar a la Presidenta @Claudiashein en la Ciudad de México. Me comentó que pronto nos reuniremos para revisar los proyectos estratégicos para #Jalisco y le aseguré que cuenta con nosotros para trabajar en equipo y poder mejorar la vida de las y los https://t.co/ly8vlkLSvs","1861153298553643352","https://pbs.twimg.com/ext_tw_video_thumb/1861153270888034304/pu/img/UNX2xw5R3DOieWI8.jpg","","es","Guadalajara","53","393","85","https://x.com/PabloLemusN/status/1861153298553643352","122200230","PabloLemusN"
"1861112561225150535","Mon Nov 25 18:19:47 +0000 2024","227","Claro Claudia es el plan A B y C de Petro. Él sabe que dentro del Pacto no hay nada y los pocos que podían tener alguito de chance como Murillo los está quemando.","1861112561225150535","","","es","Colombia","0","6","128","https://x.com/ANIABELLO_R/status/1861112561225150535","25323002","ANIABELLO_R"
"1860847084972229065","Mon Nov 25 00:44:52 +0000 2024","252","Apontem os nomes dos que não celebram hoje e não tenham dúvidas dos projectos deles para o país. Não há lugar para partidos comunistas assumidos ou envergonhados (olá livre). Com a verdade factos e ideias vamos tornar a vossa ausência simbólica no futuro. Um brinde camaradas. https://t.co/LjEN1943bF","1860847084972229065","https://pbs.twimg.com/media/GdMOj1UXkAEi_Dq.jpg","","pt","Sintra, Portugal","0","7","33","https://x.com/claudiashandi/status/1860847084972229065","1252976463189606401","claudiashandi"
"1861076775859585286","Mon Nov 25 18:19:36 +0000 2024","688","@El_Plural Lo que ha causado un daño irreparable a la Universidad Complutense es poner a Begoña Gómez una indocumentada sin título universitario alguno a dirigir una Cátedra Extraordinaria solo por ser la esposa del Presidente del Gobierno ‍️","1861112514999628161","","El_Plural","es","Valladolid, España","1","12","168","https://x.com/CarlosF66089689/status/1861112514999628161","1078226422311858181","CarlosF66089689"
"1861044536140505426","Mon Nov 25 13:49:28 +0000 2024","309","Antes de terminar su sexenio se le escapó el país de las manos. Y me refiero a Claudia...","1861044536140505426","","","es","","2","9","51","https://x.com/PFifiona/status/1861044536140505426","1307515814279614464","PFifiona"
"1861083065348657290","Mon Nov 25 16:22:34 +0000 2024","681","Respecto a las declaraciones de la Presidenta de la República @Claudiashein del día de hoy ya no se requiere tanto presupuesto porque ya no van a viajar al extranjero ya no van a gastar en antros ya no van a destinar su tarjeta Amex para quién sabe qué cosas abro ","1861083065348657290","","","es","Zacatecas, México","8","25","265","https://x.com/JulietDelrio/status/1861083065348657290","1513845212","JulietDelrio"
"1860504346909122569","Sun Nov 24 02:02:57 +0000 2024","5757","Qué ridículo hizo Claudia: Primero dijo que Trudeau le había asegurado que estaba de acuerdo con continuar el T-MEC Trudeau la desmiente y dice que si 🇲🇽 sigue comerciando con 🇨🇳 pedirán un Tratado sólo con 🇺🇸 Entonces sale Claudia a decir que van a reducir comercio con https://t.co/Xdihj1aduH","1860504346909122569","https://pbs.twimg.com/media/GdHVgWmWwAApeWq.jpg","","es","Tepeapulco, Hidalgo","37","154","1836","https://x.com/la_grenitas/status/1860504346909122569","1135682381288001537","la_grenitas"
"1861197950048969109","Mon Nov 25 23:59:05 +0000 2024","569","¡Hoy reafirmo mi compromiso con las mujeres! En el día de la eliminación de las violencias contra las mujeres les digo que seguiré trabajando por nosotras. La violencia contra nosotras no solo es física también es psicológica y no hay límite de edad desde niñas hasta adultas https://t.co/7Svpx8xtOQ","1861197950048969109","https://pbs.twimg.com/amplify_video_thumb/1861197487748329472/img/WtmCtO1eQXNQzItF.jpg","","es","Medellín, Colombia","2","72","204","https://x.com/claudiacarrasq/status/1861197950048969109","948625823782891520","claudiacarrasq"
"1861125715229655457","Mon Nov 25 19:12:03 +0000 2024","269","minha casa minha vida: Lula e Janja mostram nova cascata artificial na Granja do Torto. Residência de campo da Presidência da República foi reformada; construção lembra cascata de Collor na Casa da Dinda em 1992. https://t.co/lcET4PT5KH via @Poder360","1861125715229655457","","","pt","Brasília, DF, Brazil","14","43","83","https://x.com/FR_BSB/status/1861125715229655457","44987020","FR_BSB"
