"conversation_id_str","created_at","favorite_count","full_text","id_str","image_url","in_reply_to_screen_name","lang","location","quote_count","reply_count","retweet_count","tweet_url","user_id_str","username"
"1859978926044365257","Fri Nov 22 15:20:13 +0000 2024","529","Ahí te habla la presidenta Gabriel Quadri. El hambre es canijona. @g_quadri ‍️‍️ #MañaneraDelPueblo https://t.co/uAYFY3WtPv","1859980211020042397","https://pbs.twimg.com/ext_tw_video_thumb/1859980122972893184/pu/img/tBUQ0lxvYGw4M-I0.jpg","elgatopolitico_","es","","4","20","184","https://x.com/elgatopolitico_/status/1859980211020042397","1091416480543985664","elgatopolitico_"
"1860119167296286832","Sat Nov 23 00:32:23 +0000 2024","13","La presidenta de México Claudia Sheinbaum sostuvo reuniones con diferentes mandatarios durante el encuentro del G20. ¿Cómo calificarías la primera cumbre internacional de Claudia Sheinbaum? Participa con la etiqueta #MexOpina","1860119167296286832","","","es","Ciudad de México, México","1","5","1","https://x.com/CNNMex/status/1860119167296286832","832309426182901760","CNNMex"
"1860434518705934585","Sat Nov 23 21:25:29 +0000 2024","0","| La presidenta Claudia Sheinbaum propone reunión con padres de los 43 normalistas de Ayotzinapa para el 4 de diciembre; analizan ir si hay garantías https://t.co/QkPWIxG1Ou https://t.co/ODLDdk6ZTi","1860434518705934585","https://pbs.twimg.com/media/GdGXURaXoAAuAy8.jpg","","es","México","0","0","0","https://x.com/LaRazon_mx/status/1860434518705934585","47379940","LaRazon_mx"
"1860433391310524675","Sat Nov 23 21:21:00 +0000 2024","141","En Manzanillo Colima la Presidenta Claudia Sheinbaum @Claudiashein encabezó el Aniversario de la consolidación de la Independencia en el mar y reconoció a la Armada de México como un baluarte de libertad independencia y democracia que contribuye al desarrollo nacional https://t.co/vgYDx7UYK6","1860433391310524675","https://pbs.twimg.com/amplify_video_thumb/1860433323157327873/img/lYKXSUpJ0wYgEBg8.jpg","","es","México","0","4","62","https://x.com/juanbaaq/status/1860433391310524675","49540008","juanbaaq"
"1859977636552003939","Fri Nov 22 15:09:59 +0000 2024","10","La presidenta Claudia Sheinbaum presenta el Plan Nacional Hídrico el cual busca que deje de verse al agua como una mercancía https://t.co/UYH5gEJDgy","1859977636552003939","","","es","Centro de la Ciudad de México","1","1","6","https://x.com/El_Universal_Mx/status/1859977636552003939","16676396","El_Universal_Mx"
"1860416781900226737","Sat Nov 23 20:15:00 +0000 2024","2","#HoyEsNoticia | La presidenta Claudia Sheinbaum presentó el Plan Nacional Hídrico 2024-2030 una iniciativa que redefine la gestión del agua en México al priorizarla como un derecho humano y un bien de la nación. #OnceNoticiasDigital https://t.co/dd6yiraGH5","1860416781900226737","","","es","México","0","0","2","https://x.com/OnceNoticiasTV/status/1860416781900226737","1413528254","OnceNoticiasTV"
"1860378745011355895","Sat Nov 23 17:43:51 +0000 2024","855","La presidenta Claudia Sheinbaum recibe la medalla del Nobel de Sostenibilidad 2024 organismo con sede en Suiza creado por la familia Nobel por su compromiso y esfuerzo con iniciativas a favor de la sustentabilidad durante su paso como jefa de Gobierno de la CDMX.","1860378745011355895","","","es","","10","153","361","https://x.com/JorgeArmandoR_/status/1860378745011355895","1589064425855754241","JorgeArmandoR_"
"1860466591625863551","Sat Nov 23 23:32:55 +0000 2024","146","En la conmemoración del Día de la Armada de México la Presidenta Claudia Sheinbaum @Claudiashein dio arranque a los trabajos para el nuevo Puerto de Manzanillo donde reconoció a la Armada de México como un baluarte de libertad independencia y democracia que contribuye al https://t.co/IDTVA68zej","1860466591625863551","https://pbs.twimg.com/amplify_video_thumb/1860466390685151232/img/fpA_WQ5eCqmCBdj2.jpg","","es","México","0","0","78","https://x.com/juanbaaq/status/1860466591625863551","49540008","juanbaaq"
"1860108500564590659","Fri Nov 22 23:50:00 +0000 2024","8","#Análisis ¬ Sheinbaum critica a Quadri: Mucha simulación y poca congruencia Perla Velázquez (@LaChicaDeNeza) y Obed Rosas (@obedro) comentan las declaraciones de la Presidenta Claudia Sheinbaum quien pide congruencia al excandidato presidencial Gabriel Quadri https://t.co/6Js05R1OdP","1860108500564590659","https://pbs.twimg.com/media/GdBdVWgagAQeORS.jpg","","es","México","0","1","4","https://x.com/SinEmbargoMX/status/1860108500564590659","244218738","SinEmbargoMX"
"1859966250266538386","Fri Nov 22 14:24:45 +0000 2024","17","La presidenta parece decidida a gastar dos horas al día en un ejercicio que si bien tiene réditos para su movimiento genera propaganda le supone escuchar agendas que interesan solo a ciertos particulares ¿Sirve la mañanera de Claudia Sheinbaum? https://t.co/8v5mpOxLZ1","1859966250266538386","","","es","","0","2","4","https://x.com/SalCamarena/status/1859966250266538386","42514186","SalCamarena"
"1860404128930812186","Sat Nov 23 19:24:43 +0000 2024","61","#Nacional La Presidenta Claudia Sheinbaum (@Claudiashein) dio inicio a la construcción del Puerto Nuevo #Manzanillo ubicado en la Laguna de Cuyutlán proyecto que contará con una inversión de 63 mil millones de pesos. https://t.co/OycRDqibru","1860404128930812186","https://pbs.twimg.com/media/GdF7d2WWcAAtYXS.jpg","","es","","0","1","37","https://x.com/SPRInforma/status/1860404128930812186","1494838028690362370","SPRInforma"
"1860152338003992931","Sat Nov 23 02:44:11 +0000 2024","5","#ElFinancieroTV | La presidenta Claudia Sheinbaum informó que sugirió al Congreso recortar el presupuesto de los órganos autónomos para que esos recursos se destinen a cultura educación y a elevar los salarios del Ejército. @SofiaVillalobos https://t.co/YaGtLWGo7a","1860152338003992931","https://pbs.twimg.com/media/GdCWpk9WgAEIJ-a.jpg","","es","México","0","2","4","https://x.com/ElFinanciero_Mx/status/1860152338003992931","119051398","ElFinanciero_Mx"
"1860112573187915957","Sat Nov 23 00:19:05 +0000 2024","4","#EnVivo ¬ #LosPeriodistas La Presidenta Claudia Sheinbaum afirmó esta mañana que en Gabriel Quadri primero debe de haber consecuencia en lo dicho esto tras mostrarse una fotografía del momento en que tramitó su pensión para adultos mayores https://t.co/MI7A29zozU Nota","1860115818274779537","","SinEmbargoMX","es","México","0","1","2","https://x.com/SinEmbargoMX/status/1860115818274779537","244218738","SinEmbargoMX"
"1860401781391458782","Sat Nov 23 19:15:23 +0000 2024","33","La presidenta de #México 🇲🇽 Claudia Sheinbaum efectuó el banderazo de inicio de obras de la ampliación del puerto de Manzanillo para convertirse en uno de los grandes proyectos de infraestructura del sexenio https://t.co/oQQejXBccg","1860401781391458782","","","es","Caracas","0","1","11","https://x.com/teleSURtv/status/1860401781391458782","45013575","teleSURtv"
"1860387562692436443","Sat Nov 23 18:18:53 +0000 2024","66"," #AlMomento La presidenta Claudia Sheinbaum da banderazo de salida a construcción del Puerto Nuevo Manzanillo https://t.co/GqNsjY1XQ2","1860387562692436443","","","es","Centro de la Ciudad de México","0","3","6","https://x.com/El_Universal_Mx/status/1860387562692436443","16676396","El_Universal_Mx"
"1860299789423755664","Sat Nov 23 12:30:07 +0000 2024","6","#OpinionesCompletas | Citla Hernández y los casos emblemáticos La designación de Citlalli Hernández como primera secretaria de las Mujeres creada con el gobierno de la presidenta Claudia Sheinbaum. Escribe @Arturo_Rdgz https://t.co/VgzmOTheCz https://t.co/RlSDF71hgB","1860299789423755664","https://pbs.twimg.com/media/GdEcubQXUAAo0sR.jpg","","es","","1","0","2","https://x.com/heraldodemexico/status/1860299789423755664","846899281806082053","heraldodemexico"
"1860388459866669440","Sat Nov 23 18:22:27 +0000 2024","157","Les presentamos a la futura Presidenta la Claudia Sheinbaum Colombiana. No se diga más. https://t.co/wvuNpBKFyl","1860388459866669440","https://pbs.twimg.com/amplify_video_thumb/1860183238553059328/img/FVCY5rFKAdl1F4r-.jpg","","es","Colombia","1","4","91","https://x.com/Orlando71156528/status/1860388459866669440","1272169638831546369","Orlando71156528"
"1860004206775795736","Fri Nov 22 16:55:34 +0000 2024","9","Presentamos los temas más importantes de la conferencia de la Presidenta Claudia Sheinbaum Pardo este 22 de noviembre del 2024. #RevistaProceso #MananeraDelPueblo #ClaudiaSheinbaum https://t.co/IXjKdfR0ef","1860004206775795736","https://pbs.twimg.com/ext_tw_video_thumb/1860003832010293249/pu/img/meQ_9lKuic3HFwm1.jpg","","es","México","0","0","2","https://x.com/proceso/status/1860004206775795736","41156599","proceso"
"1860094774990241922","Fri Nov 22 22:55:27 +0000 2024","17","La presidenta Claudia Sheinbaum recibió la medalla del Nobel Sustainability Trust 2024 por su compromiso y esfuerzo con iniciativas a favor de la sustentabilidad. https://t.co/5SwtypJeGU","1860094774990241922","","","es","México","1","8","6","https://x.com/Milenio/status/1860094774990241922","24969337","Milenio"
"1860394314561651102","Sat Nov 23 18:45:43 +0000 2024","8","Querétaro recibirá más de 47 mil millones de pesos que le corresponden de recursos federales además de es prioritario y será de los más beneficiados por los proyectos de infraestructura de la Presidenta Claudia Sheinbaum indicó Alfonso Ramírez Cuéllar vicecoordinador de la https://t.co/V2bAPYQxiD","1860394314561651102","https://pbs.twimg.com/amplify_video_thumb/1860394118402416640/img/JLMe5YC7KBK6BpeX.jpg","","es","Querétaro, Querétaro Arteaga","0","1","4","https://x.com/AlertaQro/status/1860394314561651102","3453569474","AlertaQro"
"1860088283633713334","Fri Nov 22 22:29:40 +0000 2024","0","Presidenta Claudia Sheinbaum asegura que presupuesto para 2025 es muy completo y balanceado https://t.co/JoxW0411Fi","1860088283633713334","","","es","Edomex","0","0","0","https://x.com/edomexaldia/status/1860088283633713334","161420743","edomexaldia"
"1860169227241426995","Sat Nov 23 03:51:18 +0000 2024","3","#AldeaGlobal | En el G20 la presidenta Claudia Sheinbaum propuso reformar el Consejo de Seguridad de la ONU para fomentar mayor democracia y legitimidad en sus decisiones. @amsalazar https://t.co/n12XZ2QYBB","1860169227241426995","https://pbs.twimg.com/media/GdCl_1MXwAAe93v.jpg","","es","México","0","0","1","https://x.com/ElFinanciero_Mx/status/1860169227241426995","119051398","ElFinanciero_Mx"
"1860458308013830387","Sat Nov 23 23:00:00 +0000 2024","149","Sheinbaum visita Colima ¬ La Presidenta da inicio a ampliación del puerto de Manzanillo y conmemora a la Armada https://t.co/X01E5LQ1iv","1860458308013830387","","","es","México","0","2","62","https://x.com/SinEmbargoMX/status/1860458308013830387","244218738","SinEmbargoMX"
"1860137437218881837","Sat Nov 23 01:44:59 +0000 2024","3","#ElFinancieroTV | Es falso que México sea un puente para productos chinos afirmó la presidenta Claudia Sheinbaum Pardo en respuesta a las declaraciones del primer ministro de Canadá Justin Trudeau @JC_Barajas https://t.co/ek9SUvzDvp","1860137437218881837","https://pbs.twimg.com/media/GdCJF6TWsAAWfnf.jpg","","es","México","0","0","1","https://x.com/ElFinanciero_Mx/status/1860137437218881837","119051398","ElFinanciero_Mx"
"1860114293859164564","Sat Nov 23 00:13:01 +0000 2024","10","Un gusto saludar y felicitar a David Silva integrante del equipo de campaña de la Presidenta Claudia Sheinbaum y ganadores del @ReedLatino Awards 2024 | Premio a la Mejor Campaña Presidencial del Año. Máximo reconocimiento en comunicación política. https://t.co/bk8aBNT482","1860114293859164564","https://pbs.twimg.com/media/GdB0FgmaYAAYeib.jpg","","es","Mexico","0","0","3","https://x.com/DanielAceves84/status/1860114293859164564","194197173","DanielAceves84"
"1860027970234307066","Fri Nov 22 18:30:00 +0000 2024","4","La presidenta Claudia Sheinbaum se reúne con la directora ejecutiva de Fitch Ratings Shelly Shetty https://t.co/lZgY2yfp3f","1860027970234307066","","","es","Centro de la Ciudad de México","0","0","1","https://x.com/El_Universal_Mx/status/1860027970234307066","16676396","El_Universal_Mx"
"1860143899773206958","Sat Nov 23 02:10:40 +0000 2024","142","Las decantaciones del Primer Ministro de Canadá Justin Trudeau @JustinTrudeau fueron sacadas de contexto pues asegura estar en la misma posición que la Presidenta de México Claudia Sheinbaum @Claudiashein de que nuestro país permanezca en el tratado de libre comercio con https://t.co/REZb9jSBnt","1860143899773206958","https://pbs.twimg.com/amplify_video_thumb/1860143798388400128/img/8QffHZ9jMOQ3194P.jpg","","es","CDMX","1","2","60","https://x.com/Hans2412/status/1860143899773206958","99665921","Hans2412"
"1860451607420502050","Sat Nov 23 22:33:23 +0000 2024","47","Acompañamos a la Presidenta Claudia Sheinbaum Pardo (@Claudiashein) al bello puerto de Manzanillo Colima donde conmemoramos el 199 Aniversario de la Consolidación de la Independencia del Mar. Reconocemos el gran trabajo de mujeres y hombres de la Secretaría de Marina y Armada https://t.co/UoxgQfrNou","1860451607420502050","https://pbs.twimg.com/media/GdGm38EagAIvXWV.jpg","","es","DistritoFederal","0","1","8","https://x.com/Letamaya/status/1860451607420502050","213852264","Letamaya"
"1860414036875313417","Sat Nov 23 20:04:05 +0000 2024","0","La armada de México es un baluarte de libertad independencia y de democracia que contribuye al desarrollo nacional: presidenta Claudia Sheinbaum Más información en: https://t.co/2tPReq14Pr https://t.co/cuu0DwfFXx","1860414036875313417","https://pbs.twimg.com/ext_tw_video_thumb/1860413983028838402/pu/img/treCmC-bfiOXc_Bo.jpg","","es","","0","0","0","https://x.com/AdColima/status/1860414036875313417","2710757575","AdColima"
"1860450105041527031","Sat Nov 23 22:27:25 +0000 2024","5","La presidenta Claudia Sheinbaum compartió en su cuenta de X un video en el que destacó el trabajo de la Marina Armada de México como parte del aniversario de la Consolidación de la Independencia en el Mar.","1860450105041527031","","","es","Mexico City","0","0","0","https://x.com/nmas/status/1860450105041527031","25401359","nmas"
"1860316158575911100","Sat Nov 23 13:35:09 +0000 2024","6","La presidenta Claudia Sheinbaum visitó Aguascalientes y Guanajuato donde dijo que solucionar el problema de seguridad tomará tiempo pero la estrategia funcionará. https://t.co/uoGE2awirm https://t.co/X1fJEJTlbD","1860316158575911100","","","es","Mexico City","0","2","2","https://x.com/nmas/status/1860316158575911100","25401359","nmas"
"1860130660662624741","Sat Nov 23 01:18:03 +0000 2024","128","El abogado penalista César Gutiérrez Priego (@cesargutipri) señaló que se está logrando la estrategia de seguridad de los primeros cien días de gobierno de la presidenta Claudia Sheinbaum. #FórmulaNoticias con Juan Becerra (@juanbaaq). https://t.co/AXR9aaOL7W","1860130660662624741","https://pbs.twimg.com/amplify_video_thumb/1860129409371635716/img/tddEktGGLTaYDMN6.jpg","","es","Ciudad de Mexico","1","10","50","https://x.com/Radio_Formula/status/1860130660662624741","148372339","Radio_Formula"
"1860181538224156800","Sat Nov 23 04:40:13 +0000 2024","107","Gabriel Quadri denuncia acoso oficial tras ser exhibido por solicitar la Pensión para Adultos Mayores La presidenta Claudia Sheinbaum mostró en la conferencia matutina los tuits en los que el excandidato presidencial critica los programas sociales. https://t.co/RTUEdZLLqU","1860181538224156800","","","es","México","3","26","32","https://x.com/proceso/status/1860181538224156800","41156599","proceso"
"1860433463565807903","Sat Nov 23 21:21:17 +0000 2024","1","#LoMásLeído La presidenta Claudia Sheinbaum omitió etiquetar fondos para el Tren México-Puebla-Veracruz y para el saneamiento del río Atoyac en el PEF 2025. https://t.co/2K1XpR7hPM","1860433463565807903","","","es","Puebla","0","0","1","https://x.com/CentralPuebla/status/1860433463565807903","549813366","CentralPuebla"
"1860367709869154489","Sat Nov 23 17:00:00 +0000 2024","1","La presidenta Claudia Sheinbaum rechazó que México sea la puerta trasera por la que entran productos chinos a norteamérica https://t.co/ueJpTdx7qM","1860367709869154489","","","es","León, Guanajuato","0","0","0","https://x.com/soldleon/status/1860367709869154489","596044505","soldleon"
"1860453272504664205","Sat Nov 23 22:40:00 +0000 2024","1","️ En la Cumbre de Líderes del #G20 la presidenta Claudia Sheinbaum reafirmó la propuesta de perspectiva del gobierno de México para reformar el Consejo de Seguridad de la ONU con el objetivo de implementar una visión más democrática. #C21Noticias https://t.co/1lsZQLJ66k","1860453272504664205","","","es","Moras 533, Del Valle Sur, CDMX","0","0","1","https://x.com/C21Noticias/status/1860453272504664205","1278821564805414912","C21Noticias"
"1860464597087715686","Sat Nov 23 23:25:00 +0000 2024","66","El gabinete de la presidenta Claudia Sheinbaum ya tiene un grupo de estrategia que está armando todo un plan de negociación operación diplomática y cabildeo para enfrentar las tendencias antimexicanas que avanzan con fuerza en la política estadounidense y canadiense #Opinión https://t.co/J8ppAkTIQg","1860464597087715686","https://pbs.twimg.com/media/GdGt8dDWgAAmEQQ.jpg","","es","Centro de la Ciudad de México","4","16","25","https://x.com/El_Universal_Mx/status/1860464597087715686","16676396","El_Universal_Mx"
"1860347576039698792","Sat Nov 23 15:40:00 +0000 2024","3"," Como parte de las actividades de la Cumbre de Líderes del #G20 Brasil la presidenta Claudia Sheinbaum sostuvo reuniones bilaterales con los mandatarios de Estados Unidos Canadá China Colombia Vietnam y Francia. #C21Noticias https://t.co/w85GSin7ht","1860347576039698792","","","es","Moras 533, Del Valle Sur, CDMX","0","3","1","https://x.com/C21Noticias/status/1860347576039698792","1278821564805414912","C21Noticias"
"1860047195405451719","Fri Nov 22 19:46:24 +0000 2024","7","Claudia Sheinbaum presidenta de #México y la directora de la agencia Fitch Ratings Shelly Shetty se juntaron para analizar la situación económica y financiera del país X ClaudiaShein https://t.co/TTJadh5bid","1860047195405451719","https://pbs.twimg.com/media/GdA3CDFXQAAVQN9.jpg","","es","México","0","7","3","https://x.com/ElFinanciero_Mx/status/1860047195405451719","119051398","ElFinanciero_Mx"
"1860126216055071001","Sat Nov 23 01:00:24 +0000 2024","3","Gabriel Quadri (@g_quadri) fue fustigado por la presidenta Claudia Sheinbaum ya que tras haber criticado las pensiones a personas mayores se presentó a tramitar la suya en días pasados. Se dijo víctima de acoso oficial. https://t.co/WGzO5CTjQa","1860126216055071001","","","es","México DF","0","0","2","https://x.com/revistaetcetera/status/1860126216055071001","38278953","revistaetcetera"
"1860024963626852485","Fri Nov 22 18:18:03 +0000 2024","29","#Urgente ¡MÉXICO NIEGA EXTRADICIÓN DE WALTER SOLÍS A ECUADOR POR SU ESTATUS DE REFUGIADO! La presidenta de México Claudia Sheinbaum confirmó que el exministro ecuatoriano Walter Solís detenido por Interpol no será extraditado a Ecuador debido a su estatus de refugiado. https://t.co/AHsZwBbxCP","1860024963626852485","https://pbs.twimg.com/media/GdAi2PGWMAAVexK.jpg","","es","Quito, Ecuador","4","36","27","https://x.com/ElDatoEcua/status/1860024963626852485","1287473710174212096","ElDatoEcua"
"1860015387255144570","Fri Nov 22 17:40:00 +0000 2024","3"," Las tres consejeras del IECM designadas por el INE a finales de septiembre pasado quieren ganar más que la presidenta Claudia Sheinbaum en franca violación a la Constitución y a la ley Federal de Austeridad Republicana #Opinión de @RaulRodriguezC https://t.co/5oLAtjha1H","1860015387255144570","","","es","Centro de la Ciudad de México","0","0","1","https://x.com/El_Universal_Mx/status/1860015387255144570","16676396","El_Universal_Mx"
"1860469630378344896","Sat Nov 23 23:45:00 +0000 2024","4","#TomaNota | La presidenta Claudia Sheinbaum anunció el inicio de las obras del nuevo puerto Manzanillo-Cuyutlán con una inversión de 63 mil mdp. #OnceNoticiasDigital https://t.co/tEIsuKd59a","1860469630378344896","","","es","México","0","0","1","https://x.com/OnceNoticiasTV/status/1860469630378344896","1413528254","OnceNoticiasTV"
"1860146248948285879","Sat Nov 23 02:20:00 +0000 2024","0"," Compromiso por Aguascalientes: La gobernadora Tere Jiménez y la presidenta Claudia Sheinbaum se comprometen a trabajar juntas para impulsar proyectos estratégicos en salud seguridad y más https://t.co/aEPhPTc4lA","1860146248948285879","","","es","México, Distrito Federal","0","0","0","https://x.com/lasillarota/status/1860146248948285879","152358615","lasillarota"
"1860182038982328368","Sat Nov 23 04:42:13 +0000 2024","13","Audio charla 4T con @KurtHackbarth Presidenta Claudia Sheinbaum en el G20. Gracias @MV0146 @Monicao2712 🇲🇽️ https://t.co/upfHGZZDUh","1860182038982328368","","","es","","0","1","10","https://x.com/balles72/status/1860182038982328368","1262557604506562560","balles72"
"1860362725211144528","Sat Nov 23 16:40:12 +0000 2024","0","#ClaudiaSheinbaum LA PRESIDENTA CLAUDIA SHEINBAUM RECIBIÓ LA MEDALLA NOBEL SUSTAINABILITY TRUST 2024 POR SU COMPROMISO CON LA SUSTENTABILIDAD VER NOTA: https://t.co/4Po5kBVGwn https://t.co/ejrJoLYzJm","1860362725211144528","https://pbs.twimg.com/media/GdFVz4NXsAAqy6w.jpg","","es","Cancún, México","0","0","0","https://x.com/macronews/status/1860362725211144528","259876618","macronews"
"1860108322214658213","Fri Nov 22 23:49:17 +0000 2024","0","PRESIDENTA CLAUDIA SHEINBAUM ASEGURA QUE PRESUPUESTO PARA 2025 ES MUY COMPLETO Y BALANCEADO - https://t.co/IscRiRb2yE","1860108322214658213","","","es","Oaxaca, México","0","0","0","https://x.com/misaelsanchezmx/status/1860108322214658213","804512605721137152","misaelsanchezmx"
"1860164293490257948","Sat Nov 23 03:31:42 +0000 2024","0","La presidenta Claudia Sheinbaum y la gobernadora de Aguascalientes Tere Jiménez se reunieron en el estado para acordar una serie de acciones. https://t.co/6YEFxzZe8b","1860164293490257948","","","es","Ciudad Imagen","0","2","0","https://x.com/Imagen_Mx/status/1860164293490257948","88957440","Imagen_Mx"
"1860460210168438884","Sat Nov 23 23:07:34 +0000 2024","0","#Morena apoya política económica de la Presidenta Claudia Sheinbaum Pardo (@Claudiashein) https://t.co/lKnoHVtzFf","1860460210168438884","","","es","Guadalajara, Jalisco","0","0","0","https://x.com/quierotv_gdl/status/1860460210168438884","131377324","quierotv_gdl"
"1860123324564799513","Sat Nov 23 00:48:54 +0000 2024","1","Invita Bienestar a evento con la Presidenta Claudia Sheinbaum en Michoacán Nota: https://t.co/llnKVDpZGZ","1860123324564799513","","","es","Morelia, Michoacán de Ocampo","0","0","0","https://x.com/red113michoacan/status/1860123324564799513","2831914140","red113michoacan"
"1860280886387965981","Sat Nov 23 11:15:00 +0000 2024","9"," El primer ministro de #Canadá @JustinTrudeau planteó a la presidenta Claudia Sheinbaum(@Claudiashein) su preocupación por que #China inunde de productos el mercado de América del Norte. @angelicariverah tiene los detalles en #OnceNoticiasMatutino https://t.co/Q1eDn0XzuP","1860280886387965981","https://pbs.twimg.com/amplify_video_thumb/1859969704988737536/img/vGG7_4wUVYAWwa9i.jpg","","es","México","0","0","2","https://x.com/OnceNoticiasTV/status/1860280886387965981","1413528254","OnceNoticiasTV"
"1860374736649236747","Sat Nov 23 17:27:55 +0000 2024","12","Inaugura la presidenta de México Claudia Sheinbaum el banderazo de obras para el segundo ingreso al Puerto de Manzanillo. : Andrea Meraz https://t.co/UZLxWxagtG","1860374736649236747","https://pbs.twimg.com/ext_tw_video_thumb/1860374691006873602/pu/img/aE9K0VsC1PJNnB-a.jpg","","es","Ciudad de Mexico","0","3","2","https://x.com/Radio_Formula/status/1860374736649236747","148372339","Radio_Formula"
"1860420556715360755","Sat Nov 23 20:30:00 +0000 2024","0","La Presidenta Claudia Sheinbaum inauguró los trabajos del nuevo Puerto de Manzanillo resaltando la participación de las Fuerzas Armadas https://t.co/u4b4yoJyWL","1860420556715360755","","","es","Nuevo Laredo, Tamaulipas","0","0","0","https://x.com/ElMananaOnline/status/1860420556715360755","20297125","ElMananaOnline"
"1860470098512761290","Sat Nov 23 23:46:52 +0000 2024","1","La presidenta Claudia Sheinbaum encabeza conmemoración de la Consolidación de la Independencia del Mar https://t.co/Ntu8r8MBrL","1860470098512761290","","","es","México","0","0","0","https://x.com/Milenio/status/1860470098512761290","24969337","Milenio"
"1860391362262139169","Sat Nov 23 18:33:59 +0000 2024","0","#BajoReserva Nos cuentan que el primer Paquete Económico de la presidenta Claudia Sheinbaum va viento en popa en el Congreso. https://t.co/VPAueNtN6n","1860391362262139169","","","es","México","0","0","0","https://x.com/Univ_Opinion/status/1860391362262139169","59177051","Univ_Opinion"
"1860179147492065517","Sat Nov 23 04:30:43 +0000 2024","468","No puede ser extraditado a Ecuador presidenta de México defiende a Walter Solís. Claudia Sheinbaum insistió durante una rueda de prensa en que el exministro tiene estatus de refugiado por lo que no puede ser llevado a Ecuador . ES EL COLMO!! REFUGIO DE LADRONES!!INCREÍBLE!! https://t.co/KmiN9Uv73K","1860179147492065517","https://pbs.twimg.com/media/GdCvE1UW8AAmCXk.jpg","","es","","17","93","255","https://x.com/MnicaArosemena1/status/1860179147492065517","1618060832474112001","MnicaArosemena1"
