"conversation_id_str","created_at","favorite_count","full_text","id_str","image_url","in_reply_to_screen_name","lang","location","quote_count","reply_count","retweet_count","tweet_url","user_id_str","username"
"1859779485089833428","Fri Nov 22 02:02:36 +0000 2024","6","El Congreso aprueba los superpoderes para la Secretaría de Seguridad de Harfuch. Esta reforma que la presidenta Claudia Sheinbaum envió al Senado y que fue rápidamente aprobada por la cámara Alta amplía las competencias de la Secretaría de Seguridad https://t.co/WpRAxP5Bjn","1859779485089833428","","","es","Madrid","0","0","3","https://x.com/el_pais/status/1859779485089833428","7996082","el_pais"
"1859988027029983734","Fri Nov 22 15:51:17 +0000 2024","348","PARABÉNS DEPUTADO @Chico_vigilante . LULA MELHOR PRESIDENTE. BOLSONARO NA CADEIA #BrasilMelhorComLula PRA FRENTE BRASIL COM @LulaOficial https://t.co/Fq9ynGwGK3","1859988027029983734","https://pbs.twimg.com/ext_tw_video_thumb/1859987462019301376/pu/img/VAgqmSOuYGosNHkc.jpg","","pt","Rio de Janeiro, Brasil","5","4","102","https://x.com/pinho_ray/status/1859988027029983734","2854930205","pinho_ray"
"1860454914029187333","Sat Nov 23 22:46:31 +0000 2024","4","Rollins sería una figura muy activa en la revisión del T-MEC en un contexto donde el gobierno de la presidenta Claudia Sheinbaum prohíbe las importaciones del maíz transgénico https://t.co/r5YkfR3ZgE","1860454914029187333","","","es","","0","0","3","https://x.com/elceo__/status/1860454914029187333","1047598652510937093","elceo__"
"1860301185283936482","Sat Nov 23 12:35:39 +0000 2024","1","#Rozones | Fueron la presidenta morenista Claudia Sheinbaum y las gobernadoras panistas de Aguascalientes Tere Jiménez y de Guanajuato Libia Denisse García quienes ayer realizaron recorridos cada una en su entidad por módulos para el registro de la pensión Mujeres Bienestar","1860301185283936482","","","es","México","0","0","0","https://x.com/LaRazon_mx/status/1860301185283936482","47379940","LaRazon_mx"
"1859974679332814868","Fri Nov 22 14:58:14 +0000 2024","219","La presidenta @Claudiashein propuso al Congreso reducir el presupuesto de organismos autónomos para destinarlo a la cultura y la educación. Cultura educación incluso una parte queremos elevar los salarios del Ejército https://t.co/YgK1PFx1Xs","1859974679332814868","https://pbs.twimg.com/ext_tw_video_thumb/1859974639075614720/pu/img/b8TO05jczh13WNGw.jpg","","es","Ciudad de México","11","208","39","https://x.com/lopezdoriga/status/1859974679332814868","236636515","lopezdoriga"
"1860406985960968581","Sat Nov 23 19:36:04 +0000 2024","570","No vayan a escribir #VicePresidentaClaudia porque en Palacio Nacional se enojan. https://t.co/5GYlQPprS2","1860406985960968581","https://pbs.twimg.com/media/GdF-S5fagAA4lLc.jpg","","es","México","9","107","374","https://x.com/ResistenciaCMx/status/1860406985960968581","1485313533135003650","ResistenciaCMx"
"1860024590552170892","Fri Nov 22 18:16:34 +0000 2024","993","Última hora La Presidenta @Claudiashein aparece en Puebla y manda contundente mensaje @SergioSalomonC Puebla trasciende https://t.co/1GCQbo65V1","1860024590552170892","https://pbs.twimg.com/amplify_video_thumb/1860024105077985280/img/d1i3pMuw7HjcHOkG.jpg","","es","","0","42","279","https://x.com/juncalssolano/status/1860024590552170892","899081012172300288","juncalssolano"
"1860324843620860089","Sat Nov 23 14:09:40 +0000 2024","69","No estoy llorando pero casi lloro de la impresión al escuchar a la señora presidenta la miserable espuriA Claudia Sheinbaum en la mañanera del pueblo criticar y mandar a la secta a tundir a Gabriel Quadri por tramitar su pensión del Bienestar. No chinguen. Ccp. Todo México https://t.co/0yF5MsTxTZ","1860324843620860089","https://pbs.twimg.com/media/GdEzlDDakAAPwie.jpg","","es","Rancho ""La Desesperanza""","1","0","21","https://x.com/ImpudorPolitico/status/1860324843620860089","1196542901993398272","ImpudorPolitico"
"1860349021744726260","Sat Nov 23 15:45:45 +0000 2024","781","La tripa lavada @Claudiashein pide respeto y sale a burlarse de @g_quadri QUE RECHINGUE A SU MADRE https://t.co/yGdWEFGXXu","1860349021744726260","https://pbs.twimg.com/media/GdFJk2kXwAAlAvf.jpg","","es","","2","58","377","https://x.com/skyelmatador/status/1860349021744726260","101690342","skyelmatador"
"1859771705495040350","Fri Nov 22 01:31:42 +0000 2024","443","Tentam destruir literalmente Jair Bolsonaro desde antes de 2018. Nós o povo que defende um Brasil livre e soberano sabemos de que lado está a verdade. Oremos por Bolsonaro e por todos os perseguidos políticos do Brasil. https://t.co/96D33RzLye","1859771705495040350","https://pbs.twimg.com/media/Gc88fshXoAAliBC.jpg","","pt","","1","4","133","https://x.com/ClaudeLuca_/status/1859771705495040350","186240150","ClaudeLuca_"
"1860414397555859495","Sat Nov 23 20:05:31 +0000 2024","3","#Entérate Durante su visita a Manzanillo la Presidenta Claudia Sheinbaum agradeció a las fuerzas armadas por su colaboración en la paz https://t.co/R4FzBJRBX2","1860414397555859495","","","es","México","1","0","1","https://x.com/muralcom/status/1860414397555859495","34080203","muralcom"
"1860394548024815715","Sat Nov 23 18:46:39 +0000 2024","314"," Claudia Sheinbaum (@Claudiashein) está contenta siendo vicepresidenta de México porque quien sigue mandando se llama Andrés Manuel López Obrador Guadalupe Acosta Naranjo (@acostanaranjo) durante el Encuentro Nacional Ciudadano del Frente Cívico Nacional. https://t.co/7FGgYqhyBy","1860394548024815715","https://pbs.twimg.com/ext_tw_video_thumb/1860394438247227392/pu/img/GI4S1u46n0LhYalc.jpg","","es","México","6","37","134","https://x.com/emeequis/status/1860394548024815715","52998787","emeequis"
"1860331908242264324","Sat Nov 23 14:37:44 +0000 2024","2","Nuestra compañera Andrea Meraz nos comparte información acerca de la agenda de la presidenta Claudia Sheinbaum en Manzanillo Colima. #FórmulaNoticias con Juan Becerra Acosta (@juanbaaq). https://t.co/IhPvp9UYpX","1860331908242264324","https://pbs.twimg.com/amplify_video_thumb/1860330484896784384/img/-pOAOvgnPbFmOBM1.jpg","","es","Ciudad de Mexico","0","0","2","https://x.com/Radio_Formula/status/1860331908242264324","148372339","Radio_Formula"
"1860346922889826774","Sat Nov 23 15:37:24 +0000 2024","33","⭕️Por distraerme con el Operativo Enjambre en Edomex no le había recordado a todo México que por culpa de éste par de TRAIDORES la señora presidenta espuriA Claudia Sheinbaum Ricardo Monreal Adán Augusto y AMLO aniquilaron al Poder Judicial y al INAI ¡Y no estoy llorando hdp! https://t.co/69z6CuI8H3","1860346922889826774","https://pbs.twimg.com/media/GdFHqwZXoAAmhH0.jpg","","es","","1","7","16","https://x.com/PonchoAviles1/status/1860346922889826774","1417288075915538436","PonchoAviles1"
"1860399612009251149","Sat Nov 23 19:06:46 +0000 2024","38","La presidenta Claudia Sheinbaum encabezó la ceremonia por el 199 Aniversario de la Consolidación de la Independencia en el Mar en Manzanillo Colima. https://t.co/jnTaAbfddu","1860399612009251149","https://pbs.twimg.com/media/GdF3hZaWQAALn6z.jpg","","es","Ciudad de México","3","23","6","https://x.com/lopezdoriga/status/1860399612009251149","236636515","lopezdoriga"
"1860173931337896410","Sat Nov 23 04:10:00 +0000 2024","31"," A Morena lo alcanzó la realidad: la elección derivada de la Reforma Judicial que presumió la presidenta Claudia Sheinbaum en la Cumbre del G20 #Opinión de @MarioMal https://t.co/BPwhi1mtqn https://t.co/mMFnoGQtbl","1860173931337896410","https://pbs.twimg.com/media/GdCWM92WMAApcG3.jpg","","es","Centro de la Ciudad de México","0","1","9","https://x.com/El_Universal_Mx/status/1860173931337896410","16676396","El_Universal_Mx"
"1860373881573315008","Sat Nov 23 17:24:32 +0000 2024","994","El 10E vamos a tomar posesión. Palabras de nuestro presidente electo @EdmundoGU durante su intervención en el encuentro global con activistas. ️ No les quepa duda que el 10Ene vamos a tomar posesión María Corina Machado presente en este gran congreso de líderes #El10ELaToma https://t.co/Vl0JbDCvCv","1860373881573315008","https://pbs.twimg.com/media/GdFgJtjWsAA9EUg.jpg","","es","Carabobo","4","15","587","https://x.com/VenteCarabobo/status/1860373881573315008","1010304546","VenteCarabobo"
"1860276963950071966","Sat Nov 23 10:59:25 +0000 2024","617","AHÍ LES DEJO MIJÍNES. DISFRUTEN SU SÁBADO. Y NO SE OLVIDEN DE VOTAR POR LA LISTA CINCO RC5. VOTEN POR LUISA. ASÍ ASEGURAMOS EL FUTURO DE TODO EL PAÍS. LUISA GONZALES 2025. LUISA PRESIDENTA 2025. https://t.co/JOCZPu8Pre","1860276963950071966","https://pbs.twimg.com/ext_tw_video_thumb/1860276781653118976/pu/img/WKZEeZpEthZ-1QyN.jpg","","es","Machala","10","31","408","https://x.com/JuanRamonCast12/status/1860276963950071966","2395341065","JuanRamonCast12"
"1859835346131022172","Fri Nov 22 05:44:35 +0000 2024","345","LA @Claudiashein SALIO MAS CORRUPTA Y MISERABLE QUE @lopezobrador_ EN MENOS TIEMPO. https://t.co/tZwzPuG3jH","1859835346131022172","https://pbs.twimg.com/media/Gc92XvUWsAAvzS4.jpg","","es","","1","21","208","https://x.com/skyelmatador/status/1859835346131022172","101690342","skyelmatador"
"1860391501232021690","Sat Nov 23 18:34:32 +0000 2024","1181"," @Claudiashein es feliz siendo vicepresidenta. En Palacio Nacional tenemos una doctorada pero el que manda vive en La Chingada : @acostanaranjo #EncuentroCiudadano2 #RumboAUnNuevoFuturo https://t.co/HKtfx6yIvB","1860391501232021690","https://pbs.twimg.com/amplify_video_thumb/1860391266837512192/img/dO4QuB1DFfBl9pVn.jpg","","es","Ciudad de México ","9","207","538","https://x.com/FCN_mx/status/1860391501232021690","1463963242250838031","FCN_mx"
"1860320571193721202","Sat Nov 23 13:52:41 +0000 2024","440","ESTOY LLORANDO Dicen los miserables chairos pendejos que en el Operativo Enjambre en Edomex Omar García Harfuch detuvo Altos Mandos no chinguen. Altos Mandos serían del gobernador Rocha Moya y la señora presidenta espuriA Claudia Sheinbaum para arriba. Ccp. Todo México https://t.co/sjUfzgJsb0","1860320571193721202","https://pbs.twimg.com/media/GdEvsvlaUAAQBiL.jpg","","es","Rancho ""La Desesperanza""","11","0","202","https://x.com/ImpudorPolitico/status/1860320571193721202","1196542901993398272","ImpudorPolitico"
"1860382232960975275","Sat Nov 23 17:57:43 +0000 2024","3654","Mañana domingo en mi columna para @El_Universal_Mx: Dicen que ahí viene la Presidenta . Claudia Sheinbaum y sus cercanos cerraron filas para comenzar a tejer movimientos quirúrgicos que significarán una silenciosa disputa de poder con el expresidente López Obrador.","1860382232960975275","","","es","México D.F.","44","209","849","https://x.com/ClaudioOchoaH/status/1860382232960975275","129937603","ClaudioOchoaH"
"1859814592823668939","Fri Nov 22 04:33:47 +0000 2024","333","@RealArturoH Claudia tiene muy claras sus prioridades y la lista la encabeza el Mayo Zambada.","1859817531411923089","","RealArturoH","es","Caminando","0","4","26","https://x.com/YayaMarchena/status/1859817531411923089","996043194830868480","YayaMarchena"
"1860379620639670575","Sat Nov 23 17:47:20 +0000 2024","6288","Claudia Sheinbaum está feliz de ser la vicepresidenta de México el que manda es Andrés Manuel López Obrador dejen de engañarse con rupturas porque son uno mismo sentenció @acostanaranjo en el encuentro nacional del FCN. ¡LOS HAREMOS CAER! https://t.co/GRILKUJJSe","1860379620639670575","https://pbs.twimg.com/ext_tw_video_thumb/1860379578222673921/pu/img/Ux3yw-O4C4pjhFgJ.jpg","","es","","16","322","2651","https://x.com/luzelenachavez8/status/1860379620639670575","1108601238126559234","luzelenachavez8"
"1860361457587704087","Sat Nov 23 16:35:09 +0000 2024","861","Esta ndeja piensa que si no eres a fin a ella no tienes derecho a lo que la Constitución mandata. Como ven a la estúpida @Claudiashein ? Por mi que vaya y CHPM. https://t.co/eNVEF5T9EF","1860361457587704087","https://pbs.twimg.com/media/GdFU4xvX0AAATiX.jpg","","es","","11","311","377","https://x.com/araceli03956935/status/1860361457587704087","566812392","araceli03956935"
"1860403089590628767","Sat Nov 23 19:20:35 +0000 2024","277","Queiroz depositava cheque Cid pagava as contas da esposa do Bozo do golpe. Lula jamais permitira que algum outro homem pagasse as contas de sua esposa e primeira dama Janja. E o gado quer comparar a Janja com aquela tranqueira tome tento gado a Janja é outro nível ... https://t.co/Wy78dYb8fw","1860403089590628767","https://pbs.twimg.com/media/GdF6gnwXcAAGlxq.jpg","","pt","","2","44","65","https://x.com/BrasilPost13/status/1860403089590628767","1355963617951297548","BrasilPost13"
"1860419471523086339","Sat Nov 23 20:25:41 +0000 2024","1899","La Presidente es más radical ideológicamente que su antecesor. Se sabe. Lo comenta tanto gente dentro de su gobierno como prominentes opositores. Así que no se confundan. Independientemente de que puedan seguir saliendo ordenes de Palenque ella está disfrutando lo que está","1860419471523086339","","","es","","15","120","598","https://x.com/lpazosp/status/1860419471523086339","170004676","lpazosp"
"1859925430134067587","Fri Nov 22 11:42:33 +0000 2024","600","A Rússia que deveria assumir o posto no órgão cedeu sua vez em favor da permanência de Dilma e a China também já havia sinalizado positivamente pela manutenção da brasileira no cargo. Lula tem intenção de reconduzir Dilma ao posto.","1859925434479300948","","camarotedacpi","pt","Brasília, Brazil","3","4","16","https://x.com/camarotedacpi/status/1859925434479300948","1383891189418528768","camarotedacpi"
"1859772738577236336","Fri Nov 22 01:35:48 +0000 2024","461","Jajajaja jajajaja jajajaja jajajaja jajajaja jajajaja jajajaja jajajaja jajajaja jajajaja jajajaja jajajaja jajajaja jajajaja jajajaja jajajaja jajajaja jajajaja jajajaja jajajaja jajajaja jajajaja jajajaja jajajaja jajajaja! La señora @Claudiashein es una cínica sin vergüenza!","1859772738577236336","","","es","Ciudad de México","2","53","256","https://x.com/RicardoAlemanMx/status/1859772738577236336","141668931","RicardoAlemanMx"
"1859956759034827158","Fri Nov 22 13:47:02 +0000 2024","702","Atención Mañana sábado a las 12:00pm (hora Caracas) María Corina Machado y el presidente electo Edmundo González Urrutía estarán con activistas internacionales para nuevamente alzar la voz por Venezuela. Nos organizamos para dar los siguientes pasos en esta ruta a la https://t.co/3KXSbdVomy","1859956759034827158","https://pbs.twimg.com/media/Gc_kz3DaEAASBXh.jpg","","es","Venezuela","6","9","446","https://x.com/ConVzlaComando/status/1859956759034827158","2364388706","ConVzlaComando"
"1860458227655135602","Sat Nov 23 22:59:41 +0000 2024","477","PARCERIA: Cláudio Castro é eleito novo presidente do COSUD O governador do Rio Cláudio Castro (PL) foi eleito por unanimidade entre os outros seis estados membros do Consórcio Sul-Sudeste para a presidência do órgão. Ele que assume o consórcio em março de 2025 agradeceu a https://t.co/wMBb8xzNPg","1860458227655135602","https://pbs.twimg.com/media/GdGsLVMWQAA2su0.jpg","","pt","","2","4","118","https://x.com/meioindep/status/1860458227655135602","1640887419925872647","meioindep"
"1859757988686483860","Fri Nov 22 00:37:11 +0000 2024","2393","La Presidenta @Claudiashein NO tiene la menor idea de lo podemos perder sin el TMEC y tampoco tienen en quien confiar para ese tema . No saldrán bien las cosas","1859757988686483860","","","es","","24","292","1165","https://x.com/mario_dico50/status/1859757988686483860","155342172","mario_dico50"
"1860414347417203118","Sat Nov 23 21:11:43 +0000 2024","597","@CostaJr2023 Claro que ela se tornou extremamente pragmática e exigente pois passou por uma das piores provações que um ser humano pode passar - e resistiu. E ainda teve a hombridade de sair por cima do perverso impeachment que lhe foi imposto pelo mercado.","1860431055804633408","","CostaJr2023","pt","Nova Bassano RS","0","1","5","https://x.com/DudaCaldieraro/status/1860431055804633408","354621319","DudaCaldieraro"
"1859953654587167004","Fri Nov 22 13:34:42 +0000 2024","341","En un mundo en el que el Edo. de derecho y las instituciones gubernamentales eficaces son un requisito indispensable para el desarrollo MORENA ha resultado ser un EXPERTO EN DEMOLICIÓN INSTITUCIONAL. Las nocivas consecuencias están a la vista y si @Claudiashein no se atreve a","1859953654587167004","","","es","","6","54","160","https://x.com/ClaudioXGG/status/1859953654587167004","204579019","ClaudioXGG"
"1860030792409424188","Fri Nov 22 18:41:13 +0000 2024","1139","¿Notaron cómo Claudia le bajó tres rayitas a su discurso confrontativo hacia Trump y Canadá? Ya lleva dos declaraciones en ese tono: - Migrantes - Importaciones de China. Dicen que no hay borracho que coma lumbre aunque yo si conozco a varios veamos.","1860030792409424188","","","es","México","2","60","162","https://x.com/macciudadano/status/1860030792409424188","99776184","macciudadano"
"1860357999241703453","Sat Nov 23 16:21:25 +0000 2024","583","María Corina (@MariaCorinaYA) en encuentro global de activistas: ️ Hoy no hay mejor momento para encontrarnos. La transición en Venezuela es una prioridad mundial. EEUU reconoció a Edmundo González como presidente Meloni dijo que Edmundo es el presidente electo por los https://t.co/vLVd4jJdye","1860357999241703453","https://pbs.twimg.com/media/GdFRvOkaIAAzohF.jpg","","es","Venezuela","3","9","290","https://x.com/ConVzlaComando/status/1860357999241703453","2364388706","ConVzlaComando"
"1860334023337181535","Sat Nov 23 14:46:09 +0000 2024","489","Sim o cavalheirismo a que eu chamo simplesmente boa educação faz todo o sentido para mim. Até te digo mais oh Clara adoro um homem que seja o primeiro a mandar mensagem um homem que volte para trás depois de ouvir naoooo um homem que diga eu pago desta da próxima https://t.co/2FS1c3hVFW","1860334023337181535","https://pbs.twimg.com/media/GdE77mHXwAAICU_.jpg","","pt","Sintra, Portugal","6","78","18","https://x.com/claudiashandi/status/1860334023337181535","1252976463189606401","claudiashandi"
"1860460385976963422","Sat Nov 23 23:28:41 +0000 2024","381","@elejercitodelam A Wanda que la bajen de todos lados es poco profesional ni si quiera se ocupa de los hijos x ir atras del presidiario se la pasa haciendo escandalos una verguenza","1860465522975871246","","elejercitodelam","es","Capital Federal Argentina","1","6","10","https://x.com/ClauditaNav/status/1860465522975871246","1191355772","ClauditaNav"
"1860382232960975275","Sat Nov 23 18:31:07 +0000 2024","466","@ClaudioOchoaH @El_Universal_Mx Si el grupo de Claudia ya comenzó a mover sus fichas empezando con Omar García a quién le está dando muchísimo poder de maniobra a Ernestina también como alfil en el Senado (y en los medios con Denise Maerker Sabina Berman y Viridiana Ríos) pero parece insuficiente frente al","1860390637809598874","","ClaudioOchoaH","es","Tepeapulco, Hidalgo","1","35","81","https://x.com/la_grenitas/status/1860390637809598874","1135682381288001537","la_grenitas"
