"conversation_id_str","created_at","favorite_count","full_text","id_str","image_url","in_reply_to_screen_name","lang","location","quote_count","reply_count","retweet_count","tweet_url","user_id_str","username"
"1868892631352184907","Tue Dec 17 05:35:00 +0000 2024","21","#Análisis ¬ Monreal es un personaje sumamente nocivo @alvaro_delgado y Alejandro @paezvarela analizan las acusaciones de corrupción que Adán Augusto López hizo contra Ricardo Monreal y la reacción de la Presidenta Claudia Sheinbaum. https://t.co/aziPxcxBmo https://t.co/3QeOkkiCGg","1868892631352184907","https://pbs.twimg.com/media/Ge-fqs_W0AAccyM.jpg","","es","México","1","0","18","https://x.com/SinEmbargoMX/status/1868892631352184907","244218738","SinEmbargoMX"
"1868732418561315320","Mon Dec 16 18:58:22 +0000 2024","0","#Querétaro De octubre a noviembre se han censado a 54 mil queretanos: Secretaría del Bienestar Querétaro Esto como parte del oprativo Censo de Salud y Bienestar anunciado por la presidenta Claudia Sheinbaum Pardo. https://t.co/QvBc1uar8X https://t.co/ZPe73AsMaC","1868732418561315320","https://pbs.twimg.com/media/Ge8SNeLXAAAfkaJ.jpg","","es","Querétaro","0","0","1","https://x.com/ADNQro/status/1868732418561315320","2432423784","ADNQro"
"1868895147888394355","Tue Dec 17 05:45:00 +0000 2024","18","#Análisis ¬ Sheinbaum recibe a Gustavo Petro en Palacio Nacional @alvaro_delgado y Alejandro @paezvarela analizan la reunión que la Presidenta Claudia Sheinbaum sostuvo este lunes con su homólogo de Colombia Gustavo Petro https://t.co/BFYybCGFPK https://t.co/qbRsaB3gCh","1868895147888394355","https://pbs.twimg.com/media/Ge-frzCWoAAZYUG.jpg","","es","México","0","1","7","https://x.com/SinEmbargoMX/status/1868895147888394355","244218738","SinEmbargoMX"
"1868688788769398928","Mon Dec 16 16:35:00 +0000 2024","8"," #EnVivo ¬ #CaféYNoticias Claudia desinfla reclamos ¬ Se va a resolver dice la Presidenta sobre acusación de Adán Augusto contra Monreal https://t.co/JpQF2yUP39 Nota completa: https://t.co/c1boFl36A8 https://t.co/ukTX5LowrB","1868696338239521214","https://pbs.twimg.com/media/Ge7wwbQagAAvKLD.jpg","SinEmbargoMX","es","México","0","1","0","https://x.com/SinEmbargoMX/status/1868696338239521214","244218738","SinEmbargoMX"
"1869147389120156099","Tue Dec 17 22:27:19 +0000 2024","904","MULHER DE MINISTRO DE LULA GANHA CARGO VITALÍCIO COMO PRESENTE DE NATAL https://t.co/0tJd1WuWwL A bandalheira só avança. https://t.co/0tJd1WuWwL","1869147389120156099","","","pt","","28","62","488","https://x.com/JornalDaCidadeO/status/1869147389120156099","994303120376303616","JornalDaCidadeO"
"1868804061841309907","Mon Dec 16 23:43:03 +0000 2024","376","¡Las mujeres estamos más presentes que nunca en la Constitución! Como atestiguamos en la #MañaneraDelPueblo de hoy la presidenta @Claudiashein firmó tres decretos promulgatorios que modifican a siete leyes no solo en beneficio de todas las mujeres mexicanas sino también de los https://t.co/6WYZyPVFJh","1868804061841309907","https://pbs.twimg.com/amplify_video_thumb/1868803943075041280/img/_cMeiJ0NDOdGbBHW.jpg","","es","","2","46","153","https://x.com/ErnestinaGodoy_/status/1868804061841309907","574103146","ErnestinaGodoy_"
"1869126401007509803","Tue Dec 17 21:03:55 +0000 2024","0","#Nacional La presidenta Claudia Sheinbaum presenta nueva Estrategia Nacional de Construcción de la Paz. https://t.co/GTFfLOB6UN https://t.co/z2Gzrj8ify","1869126401007509803","https://pbs.twimg.com/media/GfB4jOXXwAMCNDR.jpg","","es","Veracruz, Méx.","0","0","0","https://x.com/ElDictamen/status/1869126401007509803","20350761","ElDictamen"
"1868489978243596655","Mon Dec 16 02:55:00 +0000 2024","9","🇨🇴 🇲🇽 El mandatario colombiano tiene programada una reunión con la presidenta Claudia Sheinbaum este lunes 16 de diciembre https://t.co/BsBfJPhAfE","1868489978243596655","","","es","Centro de la Ciudad de México","0","4","5","https://x.com/El_Universal_Mx/status/1868489978243596655","16676396","El_Universal_Mx"
"1869095222707445956","Tue Dec 17 19:00:01 +0000 2024","11","🇲🇽 La presidenta de México Claudia Sheinbaum propuso ampliar el acuerdo comercial T-MEC al resto del continente americano. En la actualidad el pacto solo está signado por esa nación latinoamericana Estados Unidos y Canadá. https://t.co/VnAHuUbwj3 https://t.co/FOAibZJULH","1869095222707445956","https://pbs.twimg.com/media/GfBZ-38XEAAu0E9.jpg","","es","Moscú, Rusia","1","0","7","https://x.com/SputnikMundo/status/1869095222707445956","253020963","SputnikMundo"
"1869151366947410130","Tue Dec 17 22:43:07 +0000 2024","4","La oferta laboral que recibiría de la Federación el Rector de la UdeG Ricardo Villanueva se definiría en enero pues espera reunión con la Presidenta Claudia Sheinbaum. https://t.co/nPNQLu9eUZ","1869151366947410130","","","es","México","0","0","3","https://x.com/muralcom/status/1869151366947410130","34080203","muralcom"
"1869111812840423866","Tue Dec 17 20:05:57 +0000 2024","2","Ante la intención del presidente electo de Estados Unidos Donald Trump (@realDonaldTrump) para seguir adelante con la construcción del muro en su frontera con México la presidenta Claudia Sheinbaum (@Claudiashein) dijo que lo que se debería hacer es construir puentes e https://t.co/A79JPXfZTb","1869111812840423866","https://pbs.twimg.com/media/GfBrB5jWYAAgwEo.jpg","","es","México","0","0","0","https://x.com/LaRazon_mx/status/1869111812840423866","47379940","LaRazon_mx"
"1869015180308627840","Tue Dec 17 13:41:58 +0000 2024","0","️ #Opinión de @samuel_garcias Las reformas a la Ley del Infonavit ponen en las manos de la presidenta Claudia Sheinbaum los recursos operación y destino del Instituto haciendo a un lado a trabajadores empresarios e incluso la supervisión de la CNBV. https://t.co/WOOxveGUXw","1869015180308627840","","","es","Ciudad de México","0","0","0","https://x.com/elsolde_mexico/status/1869015180308627840","111110077","elsolde_mexico"
"1868769995725193384","Mon Dec 16 21:27:41 +0000 2024","2","Sheinbaum se reúne con Petro; dialogan sobre unidad de América y El Caribe La presidenta de México Claudia Sheinbaum recibió a su homólogo de Colombia Gustavo Petro en Palacio Nacional. https://t.co/k3xchwJWgf","1868769995725193384","","","es","México","0","0","1","https://x.com/ExpPolitica/status/1868769995725193384","380567317","ExpPolitica"
"1868672315724087612","Mon Dec 16 14:59:32 +0000 2024","487","Me dio mucho gusto ser parte de la #MañaneraDelPueblo hoy ya que una vez más la presidenta @Claudiashein demostró su compromiso con las mujeres del país al firmar el decreto de Reformas a Leyes Secundarias en beneficio de las mujeres entre las que se incluyen la Igualdad https://t.co/ATHSgIzeLa","1868672315724087612","https://pbs.twimg.com/amplify_video_thumb/1868671299188404224/img/6ZLNHBqsyUHzfnrE.jpg","","es","","3","43","195","https://x.com/ErnestinaGodoy_/status/1868672315724087612","574103146","ErnestinaGodoy_"
"1868755183704195411","Mon Dec 16 20:28:50 +0000 2024","29","La presidenta de México Claudia Shienbaum Pardo (@Claudiashein) recibió al presidente de Colombia Gustavo Petro (@petrogustavo) en Palacio Nacional; el diálogo entre ambos mandatarios fortalece la relación de cooperación y hermandad entre ambas naciones.","1868755183704195411","","","es","DistritoFederal","0","0","9","https://x.com/Letamaya/status/1868755183704195411","213852264","Letamaya"
"1868697596354810242","Mon Dec 16 16:40:00 +0000 2024","24","La Presidente Claudia Sheinbaum consideró como un mal entendido las declaraciones cruzadas del Senador Adán Augusto Hernández López y el Diputado Ricardo Monreal Ávila https://t.co/c1boFl3EpG https://t.co/SfYmU6lQfd","1868697596354810242","https://pbs.twimg.com/media/Ge7itlkbEAA2f0c.jpg","","es","México","1","6","9","https://x.com/SinEmbargoMX/status/1868697596354810242","244218738","SinEmbargoMX"
"1869029605635424287","Tue Dec 17 14:39:17 +0000 2024","98","#MañaneraDelPueblo | La Presidenta Claudia Sheinbaum habla sobre la reunión con @adan_augusto y @RicardoMonrealA ayer en Palacio Nacional. A veces nos reunimos para ver la agenda legislativa que tenemos este periodo de sesiones realmente los resultados son impresionantes 16 https://t.co/d5l97yUa5X","1869029605635424287","https://pbs.twimg.com/ext_tw_video_thumb/1869028369448210432/pu/img/B7yU824hmIMEbu_r.jpg","","es","","0","3","40","https://x.com/juncalssolano/status/1869029605635424287","899081012172300288","juncalssolano"
"1868639933843276095","Mon Dec 16 12:50:52 +0000 2024","342","A ésta altura no me parece alguien relevante. Que demuestre respeto hacia el presidente como debe ser. Fin. Un montón se engancharon a bardearla una persona que tuvo el privilegio de ser la vicepresidente del mejor gobierno de la historia y no lo supo aprovechar. No le den","1868639933843276095","","","es","La Orden","1","28","25","https://x.com/Flora_crestanel/status/1868639933843276095","1750664348341514240","Flora_crestanel"
"1868560229551820903","Mon Dec 16 07:34:09 +0000 2024","224","#ULTIMAHORA #ElCartelDeLasDalias así se conocen la cofradía @ClaudiaShein de mujeres en el gobierno que manipula intereses corporativos y estatales entre las sombras. Cuál vil sicarios manipulan las decisiones y corrompen jueces para robar propiedades a grandes empresarios. https://t.co/XdpD8GjgE7","1868560229551820903","https://pbs.twimg.com/media/Ge51TbIXcAAbIud.jpg","","es","Localhost","0","4","143","https://x.com/_ElAbogato_/status/1868560229551820903","1808546552408903680","_ElAbogato_"
"1869045318718980369","Tue Dec 17 15:41:43 +0000 2024","1","#LaMañaneradelPueblo ️| Te compartimos los puntos más relevantes de la #ConferenciaDePrensa de la presidenta Claudia Sheinbaum Pardo (@Claudiashein). #México #Tabasco #Relevante https://t.co/kIZYO1eznK https://t.co/iHeJbDv4bo","1869045318718980369","https://pbs.twimg.com/media/GfAutpzbMAAKGRY.jpg","","es","Tabasco, México.","0","0","0","https://x.com/TabascoHOY/status/1869045318718980369","81852072","TabascoHOY"
"1868469553266626831","Mon Dec 16 01:33:50 +0000 2024","755","Lula em entrevista ao Fantástico confirma minha preocupação na contramão de uma trupe raivosa que nega o óbvio: a necessidade de bom senso de Lula seus médicos e assessores. Aos 79 Lula não deve exagerar. E aplausos ao leal Stuckinha que o alertava! https://t.co/VzwVUqtlL4","1868469553266626831","","","pt","Rio de Janeiro, RJ","4","26","75","https://x.com/hilde_angel/status/1868469553266626831","174396298","hilde_angel"
"1869166817962610828","Tue Dec 17 23:44:31 +0000 2024","66","⭕#Entérate | #Vídeo | La Presidenta Claudia Sheinbaum desmintió las noticias falsas que la derecha ha propagado respecto a la reforma al Infonavit y adelantó que Octavio Romero asistirá a la #MañaneraDelPueblo para aclarar las dudas. : https://t.co/OBAHfTgici https://t.co/3Fl5jq8qnu","1869166817962610828","https://pbs.twimg.com/ext_tw_video_thumb/1869166721879220224/pu/img/soOxZlgeSkB2zAGo.jpg","","es","México","0","0","30","https://x.com/ReporterosMX_/status/1869166817962610828","1497368426502934530","ReporterosMX_"
"1868461943167582655","Mon Dec 16 01:03:36 +0000 2024","637","#SeñalInvestigativa | Los contratos irregulares en la personería de Medellín y los detalles de cómo la exfiscal Claudia Carrasquilla conocida como la dama de hierro actual concejal del Centro Democrático. En Youtube: https://t.co/SdvHcvloDl https://t.co/HOKoEEDBSe","1868461943167582655","","","es","Colombia","15","17","480","https://x.com/revistaRAYA/status/1868461943167582655","1526957664667897858","revistaRAYA"
"1869014622940152228","Tue Dec 17 13:39:45 +0000 2024","1","Conferencia matutina de la Presidenta Claudia Sheinbaum del 17 de diciembre de 2024 https://t.co/dBinhOYybV","1869014622940152228","","","es","Miguel Hidalgo, Distrito Feder","0","0","0","https://x.com/CapitalMexico/status/1869014622940152228","748110248","CapitalMexico"
"1869053972641943959","Tue Dec 17 16:16:07 +0000 2024","2","La presidenta de México Claudia Sheinbaum afirmó que aún falta tiempo para este acto protocolario. Además sostuvo que evaluará su decisión de asistir en caso de recibir esta invitación. https://t.co/nWxlLG1LiV","1869053972641943959","","","es","Ciudad de Mexico","0","0","0","https://x.com/Radio_Formula/status/1869053972641943959","148372339","Radio_Formula"
"1868481645072048278","Mon Dec 16 02:21:53 +0000 2024","1652","Aquí tienen quién es la candidata presidencial del petro-santismo : CLAUDIA LÓPEZ Martín y Esteban Santos lo reconfirman https://t.co/3FZcFaGiFo","1868481645072048278","https://pbs.twimg.com/amplify_video_thumb/1868481585080643584/img/Qs3IXv32snMtvDQV.jpg","","es","Bogotá, D.C., Colombia","25","292","799","https://x.com/VickyDavilaH/status/1868481645072048278","242730842","VickyDavilaH"
"1868649980153745479","Mon Dec 16 13:30:47 +0000 2024","5185","Muitos duvidam que Donald Trump entrando vai mudar a situação do Brasil. Se surpreenderão! O modo de agir e pensar por aqui se difere muito do Brasil por aqui não se engole desaforo https://t.co/7zUGNjoayr","1868649980153745479","https://pbs.twimg.com/media/Ge7HP_SW8AAphdv.jpg","","pt","Brasilia, Brasil","37","536","864","https://x.com/ClauAker/status/1868649980153745479","1544094079218327553","ClauAker"
"1869024877736558687","Tue Dec 17 14:20:30 +0000 2024","0","#MañaneraDelPueblo Nos fue bien. Hablamos de temas educativos culturales y otras coordinaciones detalló la presidenta Claudia Sheinbaum sobre su reunión con el presidente de Colombia Gustavo Petro https://t.co/CKvOlic9Xo","1869024877736558687","https://pbs.twimg.com/media/GfAcNfBXcAAq_Py.jpg","","es","Ciudad de México","0","0","0","https://x.com/QuadratinMexico/status/1869024877736558687","1663541358","QuadratinMexico"
"1868830976589414541","Tue Dec 17 01:30:00 +0000 2024","238","La Presidenta @Claudiashein se reunió con el presidente de Colombia @petrogustavo para estrechar los lazos que unen a ambos países intercambiar ideas que beneficien a todas y todos sus pobladores y avanzar en la unidad con las naciones progresistas de América Latina. 🇲🇽🇨🇴 https://t.co/BsldNfVYeF","1868830976589414541","https://pbs.twimg.com/media/Ge9aPeUXUAA_fRs.jpg","","es","","1","47","125","https://x.com/PartidoMorenaMx/status/1868830976589414541","889466488117235712","PartidoMorenaMx"
"1869003415688560739","Tue Dec 17 12:55:13 +0000 2024","0","La presidenta Claudia Sheinbaum (@Claudiashein) destaca que quienes aparecieron en las listas cumplieron requisitos; señala que los nombres incluidos hasta ahora no son definitivos pues falta pasar varios filtros https://t.co/DvRl2LSJ4g","1869003415688560739","","","es","México","0","0","0","https://x.com/LaRazon_mx/status/1869003415688560739","47379940","LaRazon_mx"
"1869026875021881801","Tue Dec 17 14:28:26 +0000 2024","52"," Son nuestros adversarios los que hacen grande todo esto pero hay mucha unidad asegura Claudia Sheinbaum sobre el pleito Adán y Monreal: se sacaron la foto con la secretaria de gobernación Asegura la presidenta que el movimiento de transformación es uno de los más https://t.co/EWv8n11LmW","1869026875021881801","https://pbs.twimg.com/amplify_video_thumb/1869026676786520064/img/zABqe9fQOIskKb1O.jpg","","es","México DF o CDMX por decreto","1","11","7","https://x.com/carolina_rocha_/status/1869026875021881801","80098132","carolina_rocha_"
"1869122648808276232","Tue Dec 17 20:49:00 +0000 2024","0","Durante la conferencia matutina Las mañaneras del pueblo la presidenta Claudia Sheinbaum Pardo y el Gabinete de Seguridad informaron sobre los resultados de la Estrategia Nacional de Seguridad. https://t.co/JpUVOVsz6h","1869122648808276232","","","es","🇲🇽🇲🇽🇲🇽","0","1","0","https://x.com/FerMoctezumaO/status/1869122648808276232","3434204479","FerMoctezumaO"
"1869108281660121240","Tue Dec 17 19:51:55 +0000 2024","2"," Nuestros adversarios que hacen grande todo esto pero hay mucha unidad en nuestro movimiento : La presidenta Claudia Sheinbaum puso alto a los dimes y diretes de Adán Augusto y Ricardo Monreal. #FórmulaNoticias con Joaquín López-Dóriga (@lopezdoriga) https://t.co/L8ufP7qqNM","1869108281660121240","https://pbs.twimg.com/amplify_video_thumb/1869106103159558144/img/Oh99fCzwHASoDk9Q.jpg","","es","Ciudad de Mexico","0","1","3","https://x.com/Radio_Formula/status/1869108281660121240","148372339","Radio_Formula"
"1869100405529153614","Tue Dec 17 19:20:37 +0000 2024","22","La presidenta de México Claudia Sheinbaum propuso ampliar el acuerdo comercial T-MEC al resto del continente americano. En la actualidad el pacto solo está signado por esa nación latinoamericana Estados Unidos y Canadá. #EsUnHonorEstarConClaudiaHoy @GonzlezRa12 #DeZurdaTeam https://t.co/xuRsjbhzwn","1869100405529153614","https://pbs.twimg.com/media/GfBg6L8WUAA3h5S.jpg","","es","","0","0","26","https://x.com/Amalialvarez10/status/1869100405529153614","1478495177048211458","Amalialvarez10"
"1868867975563886696","Tue Dec 17 03:57:01 +0000 2024","288","¿De verdad Claudia Sheinbaum tiene el control? Ni Senado ni Cámara ni la relación con 🇺🇸. Todo sigue en las sombras de AMLO mientras instituciones caen a pedazos. ¿Qué queda cuando se debilita todo? Caos y una presidenta que será culpable de lo bueno lo malo y lo desmoronado. https://t.co/T1wyP9yDNA","1868867975563886696","https://pbs.twimg.com/ext_tw_video_thumb/1868867570259914753/pu/img/le5z1XF1ybjGZw9x.jpg","","es","","3","6","159","https://x.com/minutocriticomx/status/1868867975563886696","1794508440527929344","minutocriticomx"
"1869097020209676536","Tue Dec 17 19:07:10 +0000 2024","2","#AlAire | La presidenta Claudia Sheinbaum da por terminado el conflicto de Ricardo Monreal y Adán Augusto. No habrá sesiones extraordinarias para aprobar las reformas pendientes. Aquí lo más destacado de #Telefórmula. : https://t.co/i4v5LJJ66Y : https://t.co/g0b4Uk4K8v https://t.co/H9QeTK6aEb","1869097020209676536","https://pbs.twimg.com/amplify_video_thumb/1869096555237593088/img/0YWvQ_0XX21q5Yog.jpg","","es","Ciudad de Mexico","0","0","0","https://x.com/Radio_Formula/status/1869097020209676536","148372339","Radio_Formula"
"1868978297507328509","Tue Dec 17 11:15:24 +0000 2024","56","Analistas consultados por #Banxico prevén que la economía entrará en estancamiento en el primer semestre de la Presidenta Claudia #Sheinbaum. #NoctámbulosREFORMA https://t.co/VINCCbbmVZ","1868978297507328509","","","es","Av. México Coyoacán 40","0","1","25","https://x.com/Reforma/status/1868978297507328509","27708897","Reforma"
"1869065624452046916","Tue Dec 17 17:02:25 +0000 2024","0","Presidenta Claudia Sheinbaum da banderazo de salida al inicio de la construcción del Parque Ecoturístico La Ceiba en Palenque Chiapas - @Claudiashein https://t.co/MjnvDsmloy https://t.co/sGqYgVKoP9","1869065624452046916","https://pbs.twimg.com/media/GfBBRy_XYAAKqj7.jpg","","es","México","0","0","0","https://x.com/GobiernosMx/status/1869065624452046916","1636199528","GobiernosMx"
"1868627472000172240","Mon Dec 16 12:01:21 +0000 2024","272"," Não é possível a gente aceitar o desrespeito à Constituição. Não é possível admitir que num país tão generoso como o Brasil tenha gente de alta graduação militar tramando a morte de um presidente da República do seu vice e do juiz que presidia a Corte Eleitoral . (Lula) https://t.co/hkvz8EQu2l","1868627472000172240","https://pbs.twimg.com/media/Ge6yxaLWYAAmseh.png","","pt","","1","23","58","https://x.com/BlogdoNoblat/status/1868627472000172240","16794066","BlogdoNoblat"
"1868769320761016443","Mon Dec 16 21:25:00 +0000 2024","2"," La presidenta Claudia Sheinbaum confió en que la confrontación entre Adán Augusto López y Ricardo Monreal se resolverá. https://t.co/V4j0hHR3eb","1868769320761016443","","","es","Ciudad Imagen","0","0","0","https://x.com/Imagen_Mx/status/1868769320761016443","88957440","Imagen_Mx"
"1869037481381040553","Tue Dec 17 15:10:35 +0000 2024","11","La Presidenta dijo que ya se encuentran fortaleciendo consulados en apoyo legal y administrativo en caso de que haya deportación masiva de migrantes Consulta los temas más importantes de la conferencia matutina de @Claudiashein https://t.co/pw8EvjIJm0 https://t.co/RXcnmxJhT5","1869037481381040553","https://pbs.twimg.com/media/GfAnDcsXYAAzCTj.jpg","","es","México","0","2","1","https://x.com/ElFinanciero_Mx/status/1869037481381040553","119051398","ElFinanciero_Mx"
"1868750141886546025","Mon Dec 16 20:08:48 +0000 2024","283","La presidenta mexicana @Claudiashein y el presidente colombiano @petrogustavo sostienen un encuentro en Palacio Nacional. Abordan la importancia de la unidad y la colaboración entre los pueblos de América Latina. https://t.co/MR03RGkxv0","1868750141886546025","https://pbs.twimg.com/media/Ge8iWIUbwAMtN4k.jpg","","es","México, DF","2","19","126","https://x.com/jenarovillamil/status/1868750141886546025","132346487","jenarovillamil"
"1868767259402838211","Mon Dec 16 21:16:49 +0000 2024","2","La Presidenta Claudia Sheinbaum recibió en Palacio Nacional al Mandatario de Colombia Gustavo Petro con quien conversó por espacio de dos horas sobre la unidad de gobiernos progresistas . #TrendingMURAL https://t.co/5v2oquBelF","1868767259402838211","","","es","México","1","1","2","https://x.com/muralcom/status/1868767259402838211","34080203","muralcom"
"1869165576138235943","Tue Dec 17 23:39:35 +0000 2024","0","El gobierno de la Presidenta Claudia Sheinbaum Pardo será el sexenio de la educación: titular de SEP https://t.co/4sJjQI3GGV a través de @corpcomojeda @SEP_mx","1869165576138235943","","","es","Toluca México","0","0","0","https://x.com/corpcomojeda/status/1869165576138235943","125607141","corpcomojeda"
"1868718403256496418","Mon Dec 16 18:02:41 +0000 2024","1101","Ante el éxito en la comunicación de @Claudiashein que se manifiesta con una mañanera del pueblo muy exitosa en las redes y una cuenta de TikTok muy viral con videos superando los 50 millones de vistas hoy @latinus_us del mafioso @RobertoMadrazo_ ataca de manera atroz a su https://t.co/VsDETAlKPY","1868718403256496418","https://pbs.twimg.com/media/Ge8Fe6OWMAAIf75.jpg","","es","","10","119","504","https://x.com/NachoRgz/status/1868718403256496418","68723105","NachoRgz"
"1869037371326685476","Tue Dec 17 15:10:09 +0000 2024","705","Parece que la presidenta Claudia sheinbaum no se ha dado cuenta que los adversarios los tiene dentro de su partido https://t.co/JWKIYE8RxJ","1869037371326685476","https://pbs.twimg.com/ext_tw_video_thumb/1869030308722446336/pu/img/V1fcZYUXzfANkdQk.jpg","","es","","4","39","231","https://x.com/pedroferriz3/status/1869037371326685476","119976960","pedroferriz3"
"1868830975976980783","Tue Dec 17 01:30:00 +0000 2024","13","Sheinbaum recibe a Petro para fortalecer lazos entre gobiernos progresistas ¬ Los periodistas Nancy Gómez y Manuel González informan en Noticias a las dos sobre la reunión de la Presidenta Claudia Sheinbaum con su homólogo de Colombia Gustavo Petro en Palacio Nacional https://t.co/D7MdymaQY4","1868830975976980783","https://pbs.twimg.com/media/Ge9O4BkbwAQdJOJ.jpg","","es","México","0","0","1","https://x.com/SinEmbargoMX/status/1868830975976980783","244218738","SinEmbargoMX"
"1868536536607973676","Mon Dec 16 06:00:00 +0000 2024","5"," Adán podría ir a fondo ¬ Pero aunque Claudia Sheinbaum Presidenta de México y cabeza de esa corriente política dijo ayer sábado que deberían investigarse las acusaciones de López Hernández https://t.co/qMejs3Uxgf","1868536536607973676","","","es","México","0","0","3","https://x.com/SinEmbargoMX/status/1868536536607973676","244218738","SinEmbargoMX"
"1869013770263249372","Tue Dec 17 13:36:22 +0000 2024","3","#MañaneradelPueblo | Inicia la conferencia matutina de la presidenta Claudia Sheinbaum (@Claudiashein); hoy se dará información sobre seguridad. https://t.co/0E7CNKwVkv","1869013770263249372","","","es","Tabasco, México.","0","2","1","https://x.com/TabascoHOY/status/1869013770263249372","81852072","TabascoHOY"
"1869012327150014708","Tue Dec 17 13:30:38 +0000 2024","24","Buenos días sigue con nosotros lo más destacado de la #MañaneraDelPueblo de la Presidenta Claudia Sheinbaum (@Claudiashein). https://t.co/xVr4ECsZkG","1869012327150014708","https://pbs.twimg.com/media/GfAQzsCWUAAC-8o.jpg","","es","México","0","1","11","https://x.com/ReporterosMX_/status/1869012327150014708","1497368426502934530","ReporterosMX_"
"1869045929011265709","Tue Dec 17 15:44:09 +0000 2024","0","#Nacional | Gustavo Petro visitó el Palacio Nacional de México y se reunió con la presidenta Claudia Sheinbaum Para ampliar la nota sigue el siguiente enlace: https://t.co/u8pr5XFVIk https://t.co/AEShYYJywx","1869045929011265709","https://pbs.twimg.com/media/GfAvBJAXwAAYTdR.jpg","","es","Montería - Córdoba","0","0","0","https://x.com/TV5Monteria/status/1869045929011265709","110426081","TV5Monteria"
"1868750818163540390","Mon Dec 16 20:35:00 +0000 2024","3","@NancyGogar @manolo_gv #EnVivo ¬ #NoticiasALasDos Claudia desinfla reclamos ¬ Se va a resolver dice la Presidenta sobre acusación de Adán Augusto contra Monreal https://t.co/LtpIp48ql9 Nota completa: https://t.co/c1boFl3EpG https://t.co/KW4rC2wVM5","1868756736234209659","https://pbs.twimg.com/media/Ge8nCaZasAAa03A.jpg","SinEmbargoMX","es","México","0","3","0","https://x.com/SinEmbargoMX/status/1868756736234209659","244218738","SinEmbargoMX"
"1868762248925397024","Mon Dec 16 21:23:47 +0000 2024","295","@ClaudiaLopez Pero en politica . Las reinas de la corrupción","1868769014555783454","","ClaudiaLopez","es","Bogotá, D.C., Colombia","0","10","52","https://x.com/juanda158392211/status/1868769014555783454","2970779998","juanda158392211"
