"conversation_id_str","created_at","favorite_count","full_text","id_str","image_url","in_reply_to_screen_name","lang","location","quote_count","reply_count","retweet_count","tweet_url","user_id_str","username"
"1861056652184531263","Mon Nov 25 14:37:37 +0000 2024","83570","essa é a dona Vilma de Carvalho e tem 67 anos avó de 4 netas e um neto (eu) e ela não ta passando perreco na cadeia porque no dia 8 de janeiro de 2023 ela tava fazendo um empadão de frango pra mim e pra minha família ao invés de estar quebrando o congresso nacional https://t.co/jbiW0GT5cd","1861056652184531263","https://pbs.twimg.com/media/GdPMqjzW8AA2Iz0.jpg","","pt","maconha","161","302","7764","https://x.com/cafezinkk/status/1861056652184531263","803304952013668352","cafezinkk"
"1860474259836993853","Sun Nov 24 00:03:24 +0000 2024","2718","Junto al Presidente @GabrielBoric tuve el honor de despedir a Mercedes Bulnes en el Congreso abrazar y dar mi pésame a sus hijos y su esposo Roberto Celedón. https://t.co/J1sGPVj9fm","1860474259836993853","https://pbs.twimg.com/media/GdG7eKwWIAARxUv.jpg","","es","Santiago, Chile","83","1116","443","https://x.com/Carolina_Toha/status/1860474259836993853","136034867","Carolina_Toha"
"1860896191199977847","Mon Nov 25 04:00:00 +0000 2024","419"," Solo el 13% de las carreteras se reporta en buen estado según el primer diagnóstico que realiza el gobierno de la presidenta Claudia Sheinbaum sobre las circunstancias en que fueron entregadas las vialidades e infraestructuras más utilizadas en el país https://t.co/1dfZtjtMWo https://t.co/LFBKVRj8Nw","1860896191199977847","https://pbs.twimg.com/media/GdL9m9GWgAAFd1c.jpg","","es","Centro de la Ciudad de México","13","40","244","https://x.com/El_Universal_Mx/status/1860896191199977847","16676396","El_Universal_Mx"
"1861151374299295958","Mon Nov 25 20:54:00 +0000 2024","491","Claudia piensa que se mudó a un mundo feliz cuando en realidad se mudó al rancho del Clan Manson. https://t.co/zACwsU0HPY","1861151374299295958","https://pbs.twimg.com/media/GdQjTxxWkAAbGeU.jpg","","es","Córdoba, Argentina","2","23","54","https://x.com/LeoAchilli/status/1861151374299295958","3981910168","LeoAchilli"
"1861043914192703655","Mon Nov 25 14:19:22 +0000 2024","0","@ArturoZaldivarL @CitlaHM @ONUMujeres @Claudiashein La presidenta Claudia Sheinbaum defendió su decisión de no presentar una reforma fiscal en el #PaqueteEconómico2025 . Todavía hay espacio para la recaudación aseguró en la #mañanera. https://t.co/e0vO6GkzTZ","1861052062320263180","https://pbs.twimg.com/ext_tw_video_thumb/1861051738540867584/pu/img/zY8qQ8in5N6sTlt3.jpg","IMER_Noticias","es","Xoco, Benito Juárez","0","1","0","https://x.com/IMER_Noticias/status/1861052062320263180","35938292","IMER_Noticias"
"1861135888392007917","Mon Nov 25 19:52:28 +0000 2024","437","La Presidenta Claudia Sheinbaum @Claudiashein reúne a gobernadores de todos los partidos empresarios académicos y distritos de riego para la firma del acuerdo por el derecho humano al agua y la sustentabilidad Nos une el reconocimiento del agua como un bien nacional como un https://t.co/QNOxIoL4I9","1861135888392007917","https://pbs.twimg.com/amplify_video_thumb/1861135790157287424/img/C_DZ2CGPiRlqj0rz.jpg","","es","México","1","31","188","https://x.com/juanbaaq/status/1861135888392007917","49540008","juanbaaq"
"1861116206868029528","Mon Nov 25 18:34:16 +0000 2024","0","▶ #Videos | La presidenta Claudia Sheinbaum (@Claudiashein) autoridades productores académicos e industrias firman el Acuerdo Nacional por el Derecho Humano al Agua y la Sustentabilidad con el que se acuerda la devolución de más de 2 mil millones de metros cúbicos de agua a https://t.co/gjehNWaeoy","1861116206868029528","https://pbs.twimg.com/ext_tw_video_thumb/1861115582650654720/pu/img/m1Oc2ivaJpGaovX1.jpg","","es","México","0","0","0","https://x.com/LaRazon_mx/status/1861116206868029528","47379940","LaRazon_mx"
"1861078255052202400","Mon Nov 25 16:03:27 +0000 2024","275"," Decirle a una mujer o a una niña tu no puedes no es una costumbre es una forma de violencia denunció la Presidenta Claudia Sheinbaum @Claudiashein. quien presentó la campaña nacional permanente *Es tiempo de mujeres sin violencia ¡Súmate y transforma! https://t.co/u84sTGQcs0","1861078255052202400","https://pbs.twimg.com/amplify_video_thumb/1861078149913583616/img/fBWu3KCs01Wk0ZUr.jpg","","es","México","0","8","91","https://x.com/juanbaaq/status/1861078255052202400","49540008","juanbaaq"
"1861165311053177139","Mon Nov 25 21:49:23 +0000 2024","784","La Presidenta Claudia Sheinbaum manda que quiten las gradas que les pusieron enfrente y en pleno acto evento se ordena un receso para hacerlo. Me encantó ese detalle de nuestra presidenta @Claudiashein Importantísimo evento en Xochimilco CDMX https://t.co/itA1IlKVme","1861165311053177139","https://pbs.twimg.com/ext_tw_video_thumb/1861165248096673792/pu/img/5yTGSw5nCDHpxCV3.jpg","","es","Angelino Heights","9","37","219","https://x.com/drastiko1/status/1861165311053177139","68821993","drastiko1"
"1861166859912958298","Mon Nov 25 21:55:32 +0000 2024","10129","Essa é Maria de Lourdes 82 anos avó de 14 netos. Dona Lourdes não está presa porque no dia 8 de janeiro de 2023 ao invés de atentar contra a democracia ela tava em casa fazendo um bolinho de chuva assistindo a novela da tarde e cuidando da própria vida. https://t.co/1ggsniuA9D","1861166859912958298","https://pbs.twimg.com/media/GdQxZUqWQAAhI-M.jpg","","pt","Sao Paulo, Brasil","16","27","552","https://x.com/hlnprzn/status/1861166859912958298","618638043","hlnprzn"
"1861116620791521790","Mon Nov 25 18:35:54 +0000 2024","3599","ÚltimaHora | La presidenta Claudia Sheinbaum (@Claudiashein) firmó el Acuerdo Nacional por el Derecho Humano al Agua y la Sustentabilidad que incluye a las 32 entidades el sector privado y representantes de los distritos de riego. Este forma parte del Plan Nacional Hídrico https://t.co/xibx1nvnXN","1861116620791521790","https://pbs.twimg.com/media/GdQDstPaoAItDet.jpg","","es","México","30","142","1062","https://x.com/OnceNoticiasTV/status/1861116620791521790","1413528254","OnceNoticiasTV"
"1861167829703139386","Mon Nov 25 21:59:24 +0000 2024","1478","Un honor participar en el Acuerdo Nacional por el Derecho Humano al Agua que encabeza la Presidenta Claudia https://t.co/Ani2ly8rpf aportan millones de metros cúbicos de agua a la Nación por parte de usuarios y se sanearán los Ríos Lerma Tula y Atoyac !!! https://t.co/IccIPMnx7v","1861167829703139386","https://pbs.twimg.com/media/GdQyRYEXYAAKpqq.jpg","","es","Ciudad de México","10","168","306","https://x.com/m_ebrard/status/1861167829703139386","64798737","m_ebrard"
"1861187224194179157","Mon Nov 25 23:16:28 +0000 2024","7","El doctor José Antonio De los Reyes Heredia rector general de la UAM asistió hoy como invitado a la firma del Acuerdo Nacional por el Derecho Humano al Agua y la Sustentabilidad en el Parque Ecológico de Xochimilco encabezado por la presidenta Claudia Sheinbaum Pardo. Al acto https://t.co/LN12Y4KwEe","1861187224194179157","https://pbs.twimg.com/media/GdRD5_BWsAEYS4G.jpg","","es","Ciudad de México","0","0","2","https://x.com/lauammx/status/1861187224194179157","751808886160519173","lauammx"
"1861123989294211514","Mon Nov 25 19:05:11 +0000 2024","6","#RELEVANTE Firma la presidenta Claudia Sheinbaum (@Claudiashein) el Acuerdo Nacional por el Derecho Humano al Agua y la Sustentabilidad el cual compromete a gobiernos sectores productivos y a la población para proteger conservar y distribuir el agua de manera sostenible. https://t.co/MnfsvHGh9u","1861123989294211514","https://pbs.twimg.com/amplify_video_thumb/1861123607855861760/img/6af7SoWzttZeJYI0.jpg","","es","Sonora y Ciudad de México.","0","1","0","https://x.com/michelleriveraa/status/1861123989294211514","102244899","michelleriveraa"
"1861112616917102905","Mon Nov 25 18:20:00 +0000 2024","12","En el marco del Día Internacional de la Eliminación de la Violencia contra la Mujer la Presidenta Claudia Sheinbaum presentó la campaña nacional permanente Es tiempo de mujeres sin violencia ¡Súmate y transforma! https://t.co/t3hWOzMsXD https://t.co/GbQP4EOFXc","1861112616917102905","https://pbs.twimg.com/media/GdPnDDnacAA6WNc.jpg","","es","México","0","1","6","https://x.com/SinEmbargoMX/status/1861112616917102905","244218738","SinEmbargoMX"
"1861126621518041584","Mon Nov 25 19:15:39 +0000 2024","12","#ElTecNMInforma Como parte del Programa Nacional Hídrico esta mañana la Presidenta de México Claudia Sheinbaum Pardo firmó el Acuerdo Nacional por el Derecho Humano al Agua y Sustentabilidad en la alcaldía Xochimilco. https://t.co/KdjTVScnCo","1861126621518041584","https://pbs.twimg.com/media/GdQMw8absAAHHuO.jpg","","es","México","0","1","8","https://x.com/TecNM_MX/status/1861126621518041584","910606424903892993","TecNM_MX"
"1860777856399282537","Sun Nov 24 20:09:47 +0000 2024","626"," Es tiempo de mujeres pero no solo es tiempo de mujeres es tiempo de mujeres sin violencia Anuncia la Presidenta Claudia Sheinbaum @Claudiashein implementación de una campaña permanente para garantizar que mujeres niñas y jóvenes vivan una vida libre de violencia. https://t.co/OT8l7gL759","1860777856399282537","https://pbs.twimg.com/amplify_video_thumb/1860777770403483648/img/2KOOsOKevhXIMsur.jpg","","es","México","0","46","230","https://x.com/juanbaaq/status/1860777856399282537","49540008","juanbaaq"
"1861100392907710957","Mon Nov 25 17:31:25 +0000 2024","1","La presidenta Claudia Sheinbaum encabeza la firma del acuerdo por derecho al aguay la sustentabilidad con gobernantes estatales representantes de distritos de riego y el sector privado. Es urgente gestionar eficazmente el agua dijo @aliciabarcena titular de @SEMARNAT_mx https://t.co/RKrZKs3GGy","1861100392907710957","https://pbs.twimg.com/ext_tw_video_thumb/1861099704219770881/pu/img/wCmcrr80bd04lDJj.jpg","","es","Xoco, Benito Juárez","0","1","1","https://x.com/IMER_Noticias/status/1861100392907710957","35938292","IMER_Noticias"
"1861054150433263898","Mon Nov 25 14:27:40 +0000 2024","229","La presidenta @Claudiashein reconoce el simbolismo que existe de su llegada: ES UN SÍMBOLO QUE TRANSFORMA LAS CONCIENCIAS NO ES SUFICIENTE CON EL SÍMBOLO HAY QUE HACER POLÍTICA https://t.co/kBoIY31s88","1861054150433263898","https://pbs.twimg.com/amplify_video_thumb/1861053919398334464/img/bihMqLV167MIMpEU.jpg","","es","México","1","14","63","https://x.com/arlinmedrano_/status/1861054150433263898","1491856780263149570","arlinmedrano_"
"1860877699423539288","Mon Nov 25 02:46:31 +0000 2024","3620","Lula no sabe que si el no venía Romina no mostraba las tetas Delgado no la ninguneaba Romina no se enojaba y quemaba a Penades Penades no caía en cana Romina en redención no inventaba una historia de travas que la deja a ella en la cárcel y a Orsi de presidente.","1860877699423539288","","","es","Uruguay","46","76","450","https://x.com/viejoolimpica/status/1860877699423539288","3234072741","viejoolimpica"
"1861103549553483860","Mon Nov 25 17:43:58 +0000 2024","41","| El primer hackeo al gobierno de Claudia Sheinbaum: RansomHub filtra más de 200 GB de la Consejería Jurídica. Ni la presidenta ni la Consejería han informado sobre el secuestro de datos por el que RansomHub pidió un rescate desde hace diez días. https://t.co/OnTFEzGfXw","1861103549553483860","","","es","México","3","0","19","https://x.com/LaFabricaMX_/status/1861103549553483860","1472810798414184450","LaFabricaMX_"
"1861096122380386511","Mon Nov 25 17:14:27 +0000 2024","34","Hoy la Presidenta Claudia Sheinbaum compartió en su Mañanera la idea un Concurso Nacional de Canto y Cultura que nació de una plática con el Gobernador de Durango Esteban Villegas. Esto como una acción parte de la estrategia para mitigar la violencia en el país. https://t.co/rJNq625dvN","1861096122380386511","https://pbs.twimg.com/ext_tw_video_thumb/1861096023663267840/pu/img/QGV4n7FeqDDL4bV5.jpg","","es","Durango, México.","0","4","7","https://x.com/OraleQChiquito/status/1861096122380386511","268858132","OraleQChiquito"
"1861164675171262935","Mon Nov 25 21:46:51 +0000 2024","51","OJO. Esta es buena propuesta de la presidenta Claudia Sheinbaum. Generar una nueva cultura musical que no sea de corridos tumbados. Prohibir no es una opción dijo. Esto es lo que comentó @Claudiashein en la #Mañanera https://t.co/c0x3ob8vZT","1861164675171262935","https://pbs.twimg.com/amplify_video_thumb/1861164611535360000/img/AIAIlSdrV48JG627.jpg","","es","Hermosillo, Sonora","1","14","6","https://x.com/elalbertomedina/status/1861164675171262935","136721079","elalbertomedina"
"1861162787147534386","Mon Nov 25 21:39:21 +0000 2024","41","Con gran compromiso firmamos el Acuerdo Nacional por el Derecho Humano al Agua y la Sustentabilidad junto a la Presidenta Claudia Sheinbaum Pardo. Este acuerdo permitirá garantizar el derecho a este recurso en cada rincón del país invertir en infraestructura hídrica hacer https://t.co/IimMQsBt8o","1861162787147534386","https://pbs.twimg.com/media/GdQtsMMaoAcjQIF.jpg","","es","Mexicali, Baja California","0","8","5","https://x.com/MarinadelPilar/status/1861162787147534386","77395093","MarinadelPilar"
"1861112738929377403","Mon Nov 25 18:20:29 +0000 2024","1","Presidenta Claudia Sheinbaum presenta campaña permanente: ¡Es tiempo de mujeres sin violencia! ¡Súmate y transforma! https://t.co/g9IF8u6ea8 https://t.co/wmbFKwgtNa","1861112738929377403","https://pbs.twimg.com/media/GdQALAcWAAAdRlm.jpg","","es","Guadalajara, Jalisco","0","0","0","https://x.com/ClickGdl/status/1861112738929377403","129328568","ClickGdl"
"1861113875338289647","Mon Nov 25 19:15:00 +0000 2024","6","5) Por ello y En el marco del Día Internacional de la Eliminación de la Violencia contra la Mujer la Presidenta Claudia Sheinbaum Pardo presentó la campaña nacional permanente Es tiempo de mujeres sin violencia ¡Súmate y transforma! . https://t.co/t3hWOzN0Nb","1861126458799988966","","SinEmbargoMX","es","México","0","1","3","https://x.com/SinEmbargoMX/status/1861126458799988966","244218738","SinEmbargoMX"
"1861043914192703655","Mon Nov 25 14:24:53 +0000 2024","0","@ArturoZaldivarL @CitlaHM @ONUMujeres @Claudiashein No es un subsidio al gas LP se fijó un precio límite y seguirá la misma política aseguró la presidenta Claudia Sheinbaum en la #mañanera. https://t.co/PBSpXNSlVp","1861053448768430481","https://pbs.twimg.com/ext_tw_video_thumb/1861053051924303872/pu/img/ta4guons7DopqlT0.jpg","IMER_Noticias","es","Xoco, Benito Juárez","0","1","0","https://x.com/IMER_Noticias/status/1861053448768430481","35938292","IMER_Noticias"
"1861192223598977335","Mon Nov 25 23:36:20 +0000 2024","4"," Querida presidenta no llegamos todas hacemos falta muchas recriminan las colectivas feministas a la presidenta Claudia Sheinbaum la muerte de mujeres víctimas de feminicidio y exigen más apoyos en 2025. Vía @Manu_Cuellar10 https://t.co/wnrnFGyAGY","1861192223598977335","https://pbs.twimg.com/ext_tw_video_thumb/1861192026340937728/pu/img/fC_R-_MpPIp2MJMC.jpg","","es","Puebla, México","0","1","1","https://x.com/e_consulta/status/1861192223598977335","25695532","e_consulta"
"1861121811515109787","Mon Nov 25 18:56:32 +0000 2024","0","⭕️ La Presidenta Claudia Sheinbaum presenta campaña permanente: ¡Es tiempo de mujeres sin violencia! ¡Súmate y transforma! Decirle a una mujer o a una niña tú no puedes no es una costumbre es una forma de #violencia . Frente a cualquier #feminicidio cero https://t.co/cS6u68pM9r","1861121811515109787","https://pbs.twimg.com/media/GdQIScpXIAAwvwb.jpg","","es","Planet Earth","0","0","1","https://x.com/GustavoRenteria/status/1861121811515109787","90551880","GustavoRenteria"
"1861076778523206137","Mon Nov 25 15:57:35 +0000 2024","6"," La presidenta Claudia Sheinbaum anunció que en 2025 se lanzará un concurso de música de banda y corridos para promover narrativas que no hagan apología de la violencia. Una iniciativa para impulsar la creatividad y construir una cultura de paz en México. #ClaudiaSheinbaum https://t.co/arpvYwo4bv","1861076778523206137","https://pbs.twimg.com/amplify_video_thumb/1861076598528851968/img/__GJLEerB7LlfFxW.jpg","","es","México","0","0","2","https://x.com/Punto4T/status/1861076778523206137","1260287955194830852","Punto4T"
"1861115806085529815","Mon Nov 25 18:32:40 +0000 2024","0","Presidenta Claudia Sheinbaum presenta campaña permanente: ¡Es tiempo de mujeres sin violencia!¡Súmate y transforma! https://t.co/KrNbTohXiB","1861115806085529815","","","es","Edomex","0","1","0","https://x.com/edomexaldia/status/1861115806085529815","161420743","edomexaldia"
"1860785485267759532","Sun Nov 24 20:40:06 +0000 2024","52","️ Solamente en la inscripción del Poder Ejecutivo más de 9 mil jóvenes en todo el país que quieren ser jueces honestos magistrados magistradas honestas ministros y ministras honestos señala la presidenta Claudia Sheinbaum. https://t.co/3UUMXIo5HV https://t.co/QAPLqQRFIj","1860785485267759532","https://pbs.twimg.com/ext_tw_video_thumb/1860785437960290304/pu/img/ot9ae67H4WGboNMh.jpg","","es","Centro de la Ciudad de México","7","70","14","https://x.com/El_Universal_Mx/status/1860785485267759532","16676396","El_Universal_Mx"
"1861105067199205791","Mon Nov 25 17:50:00 +0000 2024","26"," Después que los gaseros propusieron liberar el precio del Gas L.P. la presidenta Claudia Sheinbaum rechazó la propuesta y aseguró que este hidrocarburo debe tener un precio razonable por lo que las familias no deberán pagar más por el gas https://t.co/zKovoyr8Kr","1861105067199205791","","","es","Centro de la Ciudad de México","0","6","4","https://x.com/El_Universal_Mx/status/1861105067199205791","16676396","El_Universal_Mx"
"1860851808966455804","Mon Nov 25 01:03:40 +0000 2024","236","não tem doença cansaço tristeza nada nada que faça ela tirar o sorriso do rosto e a felicidade de encontrar vocês. digo e repito natália é a pessoa mais doce que eu conheço o meu grande (re)encontro de vida e é por isso que venho de coração pedir pra vcs pra manerarem.","1860851815039791440","","marysclaudis","pt","Brasil","1","1","10","https://x.com/marysclaudis/status/1860851815039791440","39886239","marysclaudis"
"1861064232395042977","Mon Nov 25 15:07:44 +0000 2024","1238","Vamos a demostrarle al gobierno de Estados Unidos (y a Trump) con datos todo lo que aportan los migrantes en trabajo consumo e impuestos: nuestra presidenta Claudia Sheinbaum. https://t.co/h15DjT5Z1x","1861064232395042977","https://pbs.twimg.com/ext_tw_video_thumb/1861064204888780800/pu/img/CpwRLjykvXdiWB6M.jpg","","es","","6","71","514","https://x.com/JorgeArmandoR_/status/1861064232395042977","1589064425855754241","JorgeArmandoR_"
"1860754004046741991","Sun Nov 24 18:35:00 +0000 2024","219","Esta es parte de la declaración de Claudia una víctima de violación por parte de los policías aún en actividad cuya identidad mantenemos en reserva por su seguridad. Las declaraciones completas las encuentras en YouTube: https://t.co/OSUDkUDGB4 https://t.co/iqN7meGsru","1860754004046741991","https://pbs.twimg.com/amplify_video_thumb/1860753798521618432/img/ZY4cCCoOvn8eu-g7.jpg","","es","Lima, Perú.","2","10","93","https://x.com/Bunker_pe/status/1860754004046741991","1770558009606868992","Bunker_pe"
"1861116413353611675","Mon Nov 25 18:35:05 +0000 2024","18","Tenemos en la Presidenta Claudia Sheinbaum Pardo a una mujer que está siendo ejemplo para toda una generación en cuestión de igualdad. #25deNoviembre #EsTiempoDeMujeresSinViolencia https://t.co/nhA6sW69K7","1861116413353611675","https://pbs.twimg.com/media/GdQDgwQWQAAA8aZ.jpg","","es","Ciudadana del mundo 🌎 ","0","8","7","https://x.com/CPJannyBarrera/status/1861116413353611675","3395319734","CPJannyBarrera"
"1861147101180154207","Mon Nov 25 20:37:02 +0000 2024","0","La presidenta Claudia Sheinbaum firmó el Acuerdo Nacional por el Derecho Humano al Agua y la Sustentabilidad que une a empresarios instituciones académicas y gobernadores https://t.co/U6GkGWQFop","1861147101180154207","","","es","","0","0","0","https://x.com/heraldodemexico/status/1861147101180154207","846899281806082053","heraldodemexico"
"1861195857724350520","Mon Nov 25 23:50:46 +0000 2024","1692","claudia souto colocando o brasil pra mostrar a sua cara pra ver quem paga pra gente ficar assim","1861195857724350520","","","pt","","3","3","121","https://x.com/bertharussells/status/1861195857724350520","1530926652586336257","bertharussells"
"1861153074376589417","Mon Nov 25 21:00:46 +0000 2024","0","▶️ Pablo Lemus comparte breve saludo con la presidenta Claudia Sheinbaum: ️ Nos vemos pronto no te he dado cita no por otra cosa... ️ Pablo Lemus. https://t.co/wEYGURwvRa","1861153074376589417","https://pbs.twimg.com/amplify_video_thumb/1861152798458458112/img/G59caosTu0Uv4yUZ.jpg","","es","Guadalajara, Jalisco","1","0","0","https://x.com/TelediarioGDL/status/1861153074376589417","1082292173314371584","TelediarioGDL"
"1861061635697250383","Mon Nov 25 14:57:25 +0000 2024","0","#Mañanera La presidenta Claudia Sheinbaum Pardo afirmó que tener una mujer en la Presidencia es un símbolo que #transforma las conciencias pero enfatizó que no es suficiente . Señaló que es necesario impulsar políticas para los derechos de las #mujeres. https://t.co/AMADfni9sd","1861061635697250383","https://pbs.twimg.com/media/GdPRsZIWgAA0O8D.jpg","","es","Villahermosa, Tabasco, México","0","0","0","https://x.com/TVTenlinea/status/1861061635697250383","62558942","TVTenlinea"
"1861094819302645857","Mon Nov 25 17:09:17 +0000 2024","36","Hoy junto a nuestra Presidenta Claudia Sheinbaum Pardo (@Claudiashein ) firmaremos el Acuerdo Nacional por el Derecho Humabo al Agua y la Sustentabilidad.","1861094819302645857","","","es","Mexicali, Baja California","0","4","9","https://x.com/MarinadelPilar/status/1861094819302645857","77395093","MarinadelPilar"
"1861184659603992634","Mon Nov 25 23:06:16 +0000 2024","0","Las alertas de violencia de género requieren una revisión porque su implementación no significa que disminuyan los feminicidios dado que en muchas ocasiones solo se convierten en trabas burocráticas admitió la presidenta Claudia Sheinbaum. https://t.co/8poqwdKfxv","1861184659603992634","","","es","","0","0","0","https://x.com/dalies10/status/1861184659603992634","127608115","dalies10"
"1861083563770409387","Mon Nov 25 16:24:33 +0000 2024","9","La administración de la presidenta Claudia Sheinbaum Pardo presentó la campaña Es tiempo de mujeres sin violencia este #25N2024. https://t.co/DhRF4sib7E","1861083563770409387","","","es","CDMX / Guadalajara / Monterrey","0","0","3","https://x.com/Reporte_Indigo/status/1861083563770409387","31023547","Reporte_Indigo"
"1861079902071468317","Mon Nov 25 16:10:00 +0000 2024","16"," La presidenta Claudia Sheinbaum dijo que se van a revisar de fondo las Alertas de Género ya que consideró que se vuelven asuntos burocráticos que no necesariamente disminuyen las violencias https://t.co/3C5191qfoY","1861079902071468317","","","es","Centro de la Ciudad de México","1","0","1","https://x.com/El_Universal_Mx/status/1861079902071468317","16676396","El_Universal_Mx"
"1861068549864796458","Mon Nov 25 15:24:53 +0000 2024","20","La presidenta Claudia Sheinbaum (@Claudiashein) tiene una aprobación del 74% señala encuesta de Buendía &amp; Márquez para El Universal. Hay confianza reconocimiento de su preparación y capacidad. https://t.co/qUemBJANRb","1861068549864796458","https://pbs.twimg.com/media/GdPVmTeWMAAoTk7.png","","es","Tampico, Tamaulipas","0","1","10","https://x.com/olgapsosa/status/1861068549864796458","114916252","olgapsosa"
"1861142068695077188","Mon Nov 25 20:17:02 +0000 2024","325","Que este #25N se escuche fuerte ¡Es tiempo de mujeres sin violencia! En sus primeros 50 días de gobierno la Presidenta @Claudiashein ha refrendado su compromiso con las mujeres y niñas de México con una reforma constitucional inédita en esta materia. ¡Vamos por más! https://t.co/3VAqLdru0P","1861142068695077188","https://pbs.twimg.com/media/GdQa2H-XYAA291M.jpg","","es","México","3","0","126","https://x.com/ArturoZaldivarL/status/1861142068695077188","2903980137","ArturoZaldivarL"
"1861074621618893082","Mon Nov 25 15:49:01 +0000 2024","501","Claudia Sheinbaum dedicó 1 minuto con 8 segundos a la violencia en Tabasco en la mañanera . Asesinaron a 7 personas en menos de 12 horas 6 en un bar y 1 en una boda no es cosa menor. La Presidenta prefirió dedicar más tiempo a presumir una encuesta que le da 74% de aprobación. https://t.co/KarAIU7ilT","1861074621618893082","https://pbs.twimg.com/amplify_video_thumb/1861074540404604928/img/zU4Jpnyd4AtDrenv.jpg","","es","Hecha en la UNAM, Fes Acatlán","11","45","180","https://x.com/Erika_Velasco_/status/1861074621618893082","152831244","Erika_Velasco_"
"1861183747422392734","Mon Nov 25 23:02:39 +0000 2024","217"," Uma sensação inexplicável e uma felicidade imensa nas palavras da nossa goleira! 🇧🇷 A Cláudia foi a primeira atleta da história do Juventude a ser convocada para a #SeleçãoFeminina! Confira a entrevista completa! Fabio Souza / CBF https://t.co/9HRlCYLTQl","1861183747422392734","https://pbs.twimg.com/ext_tw_video_thumb/1861183643793670147/pu/img/cSWY0kjJqYeiW3Ft.jpg","","pt","","2","1","17","https://x.com/SelecaoFeminina/status/1861183747422392734","1384274110960660496","SelecaoFeminina"
