"conversation_id_str","created_at","favorite_count","full_text","id_str","image_url","in_reply_to_screen_name","lang","location","quote_count","reply_count","retweet_count","tweet_url","user_id_str","username"
"1842572962291171508","Sat Oct 05 14:30:02 +0000 2024","8","#LiberaLaReacción que continúa con más plática en compañía de Paty López Silvia Solis y nuestra invitada Atziri Carranza López. Sintonicen #EquidadRadio que hablaremos sobre la toma de poder de la PRESIDENTA Claudia Sheinbaum 🇲🇽 https://t.co/aVpI3lgsTX","1842572962291171508","https://pbs.twimg.com/media/GZIiWByb0AAu01H.jpg","","es","Ciudad de México","0","6","1","https://x.com/Reactor105/status/1842572962291171508","30996535","Reactor105"
"1842577556907909131","Sat Oct 05 14:48:17 +0000 2024","7","López ignoró toda su administración el hecho de que entre las fuerzas armadas existe corrupción. No en sino entre. Sheinbaum desarrolla su estrategia con la misma venda. A los ciudadanos nos mete un balazo un criminal o un soldado da lo mismo.","1842577556907909131","","","es","Guadalajara, Mexico","0","1","4","https://x.com/dgtagle/status/1842577556907909131","58871229","dgtagle"
"1842589104409850121","Sat Oct 05 15:34:10 +0000 2024","7","La calle de los presidentes: Así es la avenida Cuitláhuac al sur de CDMX donde viven #AMLO y Claudia Sheinbaum. Cuartoscuro https://t.co/CVghgbDZCb","1842589104409850121","https://pbs.twimg.com/media/GZIwOyVWoAAvs0I.jpg","","es","","1","3","4","https://x.com/EF_Nacional/status/1842589104409850121","1495862630799613957","EF_Nacional"
"1842589304385896887","Sat Oct 05 15:34:58 +0000 2024","39","En México hay aproximadamente 2.4 millones de trabajadoras del hogar y aún así a la oposición se le hace ingenioso llamar presirvienta a Claudia Sheinbaum de manera peyorativa. Pues de una vez les digo paniaguados para el 2030 ya tienen 2.4 millones de votos menos.","1842589304385896887","","","es","Estado de México ","1","5","10","https://x.com/CarlosVZenteno/status/1842589304385896887","2278141705","CarlosVZenteno"
"1842566376537702797","Sat Oct 05 14:03:52 +0000 2024","86","Señoras y señores Su Majestad el Rey Felipe VI de España ha enviado un mensaje contundente e inmejorable a México (y a Claudia Sheinbaum). https://t.co/qMzIBhYASF","1842566376537702797","https://pbs.twimg.com/ext_tw_video_thumb/1842481221491712000/pu/img/oYYLNYnt9v9o45a0.jpg","","es","Bolivia","1","3","22","https://x.com/riosmauricio/status/1842566376537702797","32438133","riosmauricio"
"1842572788462387311","Sat Oct 05 14:29:20 +0000 2024","2","Claudia Sheinbaum no perdió tiempo en militar para el machismo.","1842572788462387311","","","es","Buenos Aires","0","0","2","https://x.com/DiegoCBe/status/1842572788462387311","185092379","DiegoCBe"
"1842575471025787125","Sat Oct 05 14:40:00 +0000 2024","1","Comenzó la administración de Claudia #Sheinbaum Pardo como presidenta de México quien se enfrenta a un panorama desafiante y deberá echar mano de sus secretarios para obtener resultados tangibles en poco tiempo https://t.co/otTUvp4qPx","1842575471025787125","https://pbs.twimg.com/media/GY65A2uWAAA3BbC.jpg","","es","","0","0","1","https://x.com/elceo__/status/1842575471025787125","1047598652510937093","elceo__"
"1842582812286709886","Sat Oct 05 15:09:10 +0000 2024","250","#ACTUALNEWS: President Joe Biden called President Claudia Sheinbaum of Mexico yesterday to congratulate her on her historic inauguration as the first woman to serve as President of Mexico. The President thanked President Sheinbaum for warmly welcoming First Lady Jill Biden and","1842582812286709886","","","en","","1","0","64","https://x.com/onestpress/status/1842582812286709886","792222102011187200","onestpress"
"1842588055284379944","Sat Oct 05 15:30:00 +0000 2024","1","La expresión machista del comediante Rafael Inclán en contra de la presidenta Claudia Sheinbaum aunque pretendía ofender a la primera mandataria puso de relevancia el valor económico que las amas de casa aportan al país con las labores no remuneradas. https://t.co/E4pCW3rXIK &gt;","1842588055284379944","","","es","Oaxaca, Mexico","0","0","1","https://x.com/nvinoticiasoax/status/1842588055284379944","100279749","nvinoticiasoax"
"1842593822758371378","Sat Oct 05 15:52:55 +0000 2024","41","Buenos días a todos los que apoyan a la 4T. Para los que pensaban que sería fácil con Claudia Sheinbaum por ser mujer están perfectamente equivocados. Cuánta razón le asiste cuando dice que la presidencia y el congreso son electos por el pueblo. No así los ministros de la https://t.co/y1hLp4TgvS","1842593822758371378","https://pbs.twimg.com/ext_tw_video_thumb/1842593703312977920/pu/img/NM3aes773wvG0UVC.jpg","","es","México ","0","3","17","https://x.com/mespin10/status/1842593822758371378","1185575835262246912","mespin10"
"1842551080716259538","Sat Oct 05 13:03:05 +0000 2024","3","¡Buenos días! Hoy en la #Portada NOTICIAS Voz e Imagen de #Oaxaca ️ Labor de amas de casa equivale al 18% del PIB ️Anuncia Sheinbaum nueva beca escolar Para descargarla desde nuestro portal da click aquí https://t.co/NwA6e4JQn4 https://t.co/KZLCrs65ox","1842551080716259538","https://pbs.twimg.com/media/GZIOcVwXQAEUOek.jpg","","es","Oaxaca, Mexico","0","0","0","https://x.com/nvinoticiasoax/status/1842551080716259538","100279749","nvinoticiasoax"
"1842592403229921568","Sat Oct 05 15:47:17 +0000 2024","67","Conversé con Ariadna Montiel secretaria de Bienestar del Gabinete de nuestra presidenta Claudia Sheinbaum. #MargaritaValde #Bienestar https://t.co/lAFnuBpgYH","1842592403229921568","https://pbs.twimg.com/media/GZI0BohWwAA6TXk.jpg","","es","Durango, México","0","1","14","https://x.com/SenadoraV/status/1842592403229921568","1039722934397362176","SenadoraV"
"1842575529217499346","Sat Oct 05 14:40:14 +0000 2024","10","Le @POTUS s est entretenu avec la présidente 🇲🇽 Sheinbaum pour la féliciter de son investiture en tant que 1ère femme présidente du Mexique. « Je me réjouis de poursuivre ce partenariat solide et collaboratif qui fera progresser la prospérité et la sécurité dans nos deux pays. » https://t.co/0NMG4nvO1b","1842575529217499346","https://pbs.twimg.com/media/GZIkrghXQAARAvw.jpg","","fr","","0","1","0","https://x.com/USAenFrancais/status/1842575529217499346","252194895","USAenFrancais"
"1842565412208386382","Sat Oct 05 14:00:02 +0000 2024","1"," #TemaDePortada| Trabajaré con May y con Sheinbaum. Nota completa: https://t.co/ridpYgvkHE |#Noticias |#México |#DiarioPresente https://t.co/xH345FeApC","1842565412208386382","https://pbs.twimg.com/media/GZIXjNTW8AAeFwq.jpg","","es","Villahermosa. Tab. Mx","0","0","0","https://x.com/DiarioPresente/status/1842565412208386382","82608449","DiarioPresente"
"1842570226740936801","Sat Oct 05 14:19:10 +0000 2024","0","Este sábado Arturo Santamaría apunta que el sólo hecho de que Claudia Sheinbaum tenga una personalidad distinta bastante firme y fuerte ya revela un claro estilo político diferente al de López Obrador https://t.co/NDgjEfpWEZ https://t.co/S7bhyx1izE","1842570226740936801","https://pbs.twimg.com/media/GZIf0JVW4AAuAkI.jpg","","es","Sinaloa, México","0","0","1","https://x.com/noroestemx/status/1842570226740936801","58606864","noroestemx"
"1842592504715124876","Sat Oct 05 15:47:41 +0000 2024","1","Alejandra Del Moral se une al gobierno de Sheinbaum en la SRE https://t.co/hG1eqWKArQ #Nacional ","1842592504715124876","","","es","Villahermosa, Tabasco","0","0","0","https://x.com/XEVATabasco/status/1842592504715124876","1077962244","XEVATabasco"
"1842581453093413303","Sat Oct 05 15:03:46 +0000 2024","1","🇺🇸🇲🇽 Le président américain a appelé Claudia Sheinbaum afin de la féliciter pour son investiture historique en tant que première femme présidente du Mexique. https://t.co/ewkMwkhwgi","1842581453093413303","","","fr","Luxembourg","0","0","0","https://x.com/lessentiel/status/1842581453093413303","29430922","lessentiel"
"1842568912078258573","Sat Oct 05 14:13:56 +0000 2024","17","La nueva Sheinbaum @peniley_ramirez https://t.co/zXxV2OcGaU","1842568912078258573","https://pbs.twimg.com/media/GZIep3ZaEAA33ge.jpg","","es","","1","0","7","https://x.com/FelipeLeonLopez/status/1842568912078258573","253616741","FelipeLeonLopez"
"1842559025445007834","Sat Oct 05 13:34:39 +0000 2024","11","https://t.co/e1ajuuqka6","1842559025445007834","","","zxx","Coyoacán, Ciudad de México","0","0","6","https://x.com/modonesi71/status/1842559025445007834","1455508338","modonesi71"
"1841252157317627985","Tue Oct 01 23:01:37 +0000 2024","13","¿Cómo inicia el sexenio de la presidenta Claudia Sheinbaum? Volumen 2: Variables sociales 50 millones de mexicanos sin acceso a servicios de salud. La carencia por acceso a los servicios de salud aumentó de 16.2% en 2018 a 39.1% en 2022. ️ https://t.co/Cio5Ri0LC2 https://t.co/2cAWXcj5z4","1841252157317627985","https://pbs.twimg.com/media/GY1xE18XsAcXgNQ.jpg","","es","México","0","1","11","https://x.com/MexicoComoVamos/status/1841252157317627985","561376286","MexicoComoVamos"
"1842579645310586940","Sat Oct 05 14:56:35 +0000 2024","1648","Mexico s ethnically Jewish president Claudia Sheinbaum invokes prayer to pagan gods during inauguration. Follow: @AFpost https://t.co/ocbfhUk3xG","1842579645310586940","https://pbs.twimg.com/amplify_video_thumb/1842579588653670400/img/50Ay1Cxf7FtZA3EF.jpg","","en","","73","157","173","https://x.com/AFpost/status/1842579645310586940","1622588070246641666","AFpost"
"1842577213637701784","Sat Oct 05 14:46:55 +0000 2024","4","Amigo de Sheinbaum. Aquí puede tener asilo ya sabemos que México ama a los pederastas mucho más si son políticos o religiosos.","1842577213637701784","","","es","USA/Mexico","1","0","3","https://x.com/NeverTheEx/status/1842577213637701784","1415390723298390016","NeverTheEx"
"1842580505629499469","Sat Oct 05 15:00:00 +0000 2024","1","️ La presidenta de México Claudia Sheinbaum aseguró en su toma de posesión que hará que Tula Hidalgo sea la ciudad más limpia del país con un proyecto de economía circular más ambicioso del mundo. ¿De qué va? https://t.co/Rc3Zso5hot","1842580505629499469","","","es","Pachuca de Soto, Hidalgo","0","0","0","https://x.com/ElSoldeHgo/status/1842580505629499469","2530517137","ElSoldeHgo"
"1842587268269380049","Sat Oct 05 15:26:53 +0000 2024","4","Sheinbaum no me cortes el chilito ️","1842587268269380049","","","es","México D.F.","0","0","0","https://x.com/Yaael_TV/status/1842587268269380049","64024082","Yaael_TV"
"1842590200603746811","Sat Oct 05 15:38:32 +0000 2024","0","Sheinbaum: no caeré en la provocación de la SCJN - https://t.co/WUKZV5YZcw https://t.co/yHUBGwfuGT","1842590200603746811","https://pbs.twimg.com/media/GZIyBdBaIAA_l74.jpg","","es","México","0","0","0","https://x.com/megavisionmx/status/1842590200603746811","130936353","megavisionmx"
"1842527656769913074","Sat Oct 05 11:30:00 +0000 2024","0"," Claudia Sheinbaum asegura que la decisión del pueblo sobre la reforma judicial no puede ser detenida por solo 8 ministros. https://t.co/WAV3fghuXU","1842527656769913074","","","es","Zacatecas, Zacatecas, México","0","0","0","https://x.com/soldezacatecas/status/1842527656769913074","130535653","soldezacatecas"
"1842557854869311527","Sat Oct 05 13:30:00 +0000 2024","0"," ¡La situación se torna crítica! Claudia Sheinbaum critica abiertamente el paro en el Poder Judicial destacando que está afectando la seguridad del país. https://t.co/Dn82ntKCBQ","1842557854869311527","","","es","Zacatecas, Zacatecas, México","0","0","0","https://x.com/soldezacatecas/status/1842557854869311527","130535653","soldezacatecas"
"1842566351690539252","Sat Oct 05 14:03:46 +0000 2024","1","»Espero continuar con esta sólida y colaborativa asociación que promoverá la prosperidad y la seguridad en ambos países» dijo Biden sobre la llamada con Sheinbaum. Detalles: https://t.co/aMkLZfLu5B","1842566351690539252","","","es","México/Puebla/Oaxaca","0","0","1","https://x.com/ZonaRoja_Oaxaca/status/1842566351690539252","482567348","ZonaRoja_Oaxaca"
"1842583552803971260","Sat Oct 05 15:12:07 +0000 2024","0","Diputado del PAN defiende a Claudia Sheinbaum tras insultos de VOX #ElBuenTono #Nacional #Morena #Presidenta #Gabinete #Economía #ConVisiónAlCambio2024 #PAN https://t.co/NHLkYblTys","1842583552803971260","","","es","Córdoba, Veracruz.","0","0","0","https://x.com/El_BuenTono/status/1842583552803971260","362120021","El_BuenTono"
"1842565418470490321","Sat Oct 05 14:00:03 +0000 2024","3","Pakistan has unique distinction Of the 193 UN member nations 13 currently have a woman leader and 60 have ever had a woman serve as head of government. Mexico joined this list most recently after inaugurating its first female president Claudia Sheinbaum this week","1842565418470490321","","","en","Islamabad","0","0","0","https://x.com/bilalgilani/status/1842565418470490321","51561840","bilalgilani"
"1842571701881618770","Sat Oct 05 14:25:01 +0000 2024","1","Suprema Corte dio 'golpe aguado' no de Estado por querer frenar la reforma judicial: Sheinbaum https://t.co/m11K6SLXFI #Nacional ","1842571701881618770","","","es","Villahermosa, Tabasco","0","0","0","https://x.com/XEVATabasco/status/1842571701881618770","1077962244","XEVATabasco"
"1842588879796453439","Sat Oct 05 15:33:17 +0000 2024","2","#EnElMundoDCA | Sheinbaum acusa a la Suprema Corte de golpe aguado por querer frenar la reforma judicial. ️Redacción Web EFE https://t.co/VlltGegSLa","1842588879796453439","https://pbs.twimg.com/media/GZIwyKKWAAA92YS.jpg","","es","GUATEMALA","0","0","0","https://x.com/DiariodeCA/status/1842588879796453439","260318585","DiariodeCA"
"1842580653755314249","Sat Oct 05 15:00:36 +0000 2024","4","#Sheinbaum y la 4T juegan con la idea de desconocer la supremacía de la SCJN en el control constitucional de los derechos fundamentales y las garantías que los protegen. De hacerlo se colocarían al inicio de sus 6 años de gobierno como parias de la legalidad internacional. https://t.co/abPRUYC9lK","1842580653755314249","https://pbs.twimg.com/media/GZIpVuNW4AE5dlA.jpg","","es","México","0","0","3","https://x.com/Mex_Libertario/status/1842580653755314249","2661645776","Mex_Libertario"
"1842582079386865812","Sat Oct 05 15:06:15 +0000 2024","9","La ceremonia de toma de posesión de Claudia Sheinbaum el pasado 1º de octubre en la cámara de diputados y la posterior investidura popular en el Zócalo capitalino fueron no solo una secuencia protocolaria sino actos políticos de gran alcance simbólico. https://t.co/YPPLwZVOrG","1842582079386865812","","","es","","0","0","1","https://x.com/jacobinlat/status/1842582079386865812","1260412086347317251","jacobinlat"
"1842578119825207646","Sat Oct 05 14:50:31 +0000 2024","0","#EditorialEE | Comienza el sexenio de Claudia Sheinbaum https://t.co/x45jiUCmOO https://t.co/BcPlYIw3zp","1842578119825207646","https://pbs.twimg.com/media/GZInCN_XYAAULr1.jpg","","es","Colombia","0","0","1","https://x.com/EEopinion/status/1842578119825207646","14884514","EEopinion"
"1842563159565209780","Sat Oct 05 13:51:05 +0000 2024","1","La presidenta de México Claudia Sheinbaum cumplió este viernes su primera visita oficial al estado de Veracruz oriente de México para encabezar la conmemoración de... https://t.co/QTWbBdvLW0","1842563159565209780","","","es","Honduras","0","0","0","https://x.com/LaTribunahn/status/1842563159565209780","53519151","LaTribunahn"
"1842582407201059031","Sat Oct 05 15:07:34 +0000 2024","1","#México I Los españoles no tenemos que pedir perdón sentencia portavoz de VOX; llama analfabeta e ignorante a Claudia Sheinbaum. https://t.co/3GCM9dfcAV","1842582407201059031","","","es","Saltillo, Coahuila","0","2","1","https://x.com/vanguardiamx/status/1842582407201059031","18193312","vanguardiamx"
"1842553234390409640","Sat Oct 05 13:11:38 +0000 2024","49","La nueva Sheinbaum de @peniley_ramirez https://t.co/Yy1kWM5xVZ","1842553234390409640","https://pbs.twimg.com/media/GZIQZkHWEAE65iA.jpg","","es","Ciudad de México ","0","12","25","https://x.com/JoseiRasso/status/1842553234390409640","1256366203339190276","JoseiRasso"
"1842565411294126570","Sat Oct 05 14:00:01 +0000 2024","3","Se alista Tizayuca para recibir a Claudia Sheinbaum este fin de semana https://t.co/qMz0CG2joT","1842565411294126570","","","es","Pachuca, Hidalgo, México","0","0","0","https://x.com/CriterioHidalgo/status/1842565411294126570","104707685","CriterioHidalgo"
"1842550351225864429","Sat Oct 05 13:00:11 +0000 2024","64","La progre antiespañola de Sheinbaum ni siquiera es mexicana. Es búlgara. Y ella es otra más de esos delincuentes que se roban a México y culpan a España del subdesarrollo.","1842550351225864429","","","es","","2","6","27","https://x.com/ARRIBAE14445034/status/1842550351225864429","1664068108254863360","ARRIBAE14445034"
"1842547788460281997","Sat Oct 05 12:50:00 +0000 2024","0"," #Educación | Mariana Terán presente en mañanera de la presidenta Claudia Sheinbaum https://t.co/P26IvB5YBd https://t.co/VzCrTNOANk","1842547788460281997","https://pbs.twimg.com/media/GZHz6L6W0AA2qEM.jpg","","es","Zacatecas, Zacatecas.","0","0","0","https://x.com/lajornadazac/status/1842547788460281997","290126693","lajornadazac"
"1842581921437810753","Sat Oct 05 15:05:38 +0000 2024","15","🇪🇸🇲🇽 SHEINBAUM RESPONDE AL DIPUTADO ESPAÑOL QUE LA INSULTÓ Claudia Sheinbaum le respondió al diputado de Vox Alejandro Nolasco quien la llamó absoluta analfabeta e ignorante por pedir al rey de España que se disculpe con el pueblo de México. https://t.co/upwMBktydJ","1842581921437810753","https://pbs.twimg.com/ext_tw_video_thumb/1842581677068980224/pu/img/nMIbAZ31gClQ8fHg.jpg","","es","Nicaragua","1","2","6","https://x.com/pedrodelcamino/status/1842581921437810753","1141849465634119680","pedrodelcamino"
"1842557854903152945","Sat Oct 05 13:30:00 +0000 2024","0","️#ColumnaDigital| Escala Crítica Sheinbaum Presidenta con A: definiciones para responder a la voluntad ciudadana Escrito por: Víctor M. Sámano Labastida |#Noticias |#ColumnaDigital |#DiarioPresente https://t.co/9VZ5jzutDW","1842557854903152945","","","es","Villahermosa. Tab. Mx","0","0","0","https://x.com/DiarioPresente/status/1842557854903152945","82608449","DiarioPresente"
"1842520115637784647","Sat Oct 05 11:00:02 +0000 2024","1"," ¿Qué esperan las mujeres mexicanas de Sheinbaum? 🇲🇽 Como jefa de gobierno de la capital Sheinbaum impulsó políticas de protección a la mujer de apoyos a grupos vulnerables y de acceso al aborto. Con esto muchas organizaciones de mujeres esperan que introduzca cambios https://t.co/2IQZKlfgj8","1842520115637784647","https://pbs.twimg.com/ext_tw_video_thumb/1842411073938264066/pu/img/9EVyvyJWVwv1ciip.jpg","","es","Buenos Aires (Argentina)","0","0","0","https://x.com/canal26noticias/status/1842520115637784647","176540641","canal26noticias"
"1842568669139783981","Sat Oct 05 14:12:58 +0000 2024","0","#Nacional | Alejandra del Moral se suma al equipo de #SRE del gobierno de #Sheinbaum https://t.co/LfqnWoNDv3","1842568669139783981","","","es","Villahermosa, Tabasco, México","0","0","1","https://x.com/xevtfm/status/1842568669139783981","150913226","xevtfm"
"1842550311891664991","Sat Oct 05 13:00:01 +0000 2024","1"," OLA DE VIOLENCIA Claudia Sheinbaum lamenta la muerte de migrantes a manos del Ejército de #Chiapas https://t.co/IXTYnaenIp","1842550311891664991","","","es","Mexico City","0","0","1","https://x.com/elgmx/status/1842550311891664991","38293203","elgmx"
"1842520113800523907","Sat Oct 05 11:00:02 +0000 2024","27","A Mexican cardinal and three priests two of them exorcists have differing takes on the cleansing ritual that was performed during the inauguration of the country s new president Claudia Sheinbaum. https://t.co/1EdoO7GDr2","1842520113800523907","","","en","United States","5","9","7","https://x.com/cnalive/status/1842520113800523907","32422915","cnalive"
"1842580511455432775","Sat Oct 05 15:00:02 +0000 2024","0","#México I En Veracruz Claudia Sheinbaum inicia su primera gira nacional como presidenta https://t.co/5OAyTZ49zT","1842580511455432775","","","es","Saltillo, Coahuila","0","0","0","https://x.com/vanguardiamx/status/1842580511455432775","18193312","vanguardiamx"
"1842522349318422812","Sat Oct 05 11:08:55 +0000 2024","16","María Teresa Mesa acudió a intentar hablar con la presidenta Claudia Sheinbaum para solicitar que su gobierno lo saqué del Mar Rojo donde rebeldes lo tienen desde hace 10 meses #Veracruz #BocadelRio #Misantla #MarRojo https://t.co/QevZ3RHPbQ","1842522349318422812","https://pbs.twimg.com/ext_tw_video_thumb/1842522279739039744/pu/img/XEwfpCOMWJFjJZr2.jpg","","es","Veracruz","1","1","14","https://x.com/rodrigo_dector/status/1842522349318422812","130364561","rodrigo_dector"
"1842566411803099407","Sat Oct 05 14:04:00 +0000 2024","2","#cdmx #reynosafollow #mtyfollow #guadalajara #slp EL «PURO BURLADERO»: «DIPUTADO MORENISTA DETENIDO en 1998 por RATA y ANDAR ARMADO se FUE a TURISTEAR a ESPAÑA y hasta ANDA BUSCANDO CASA» el no tiene broncas con la madre patria como Sheinbaum y su tutor. https://t.co/qZ9exmgvnG https://t.co/oQIdXU55D4","1842566411803099407","https://pbs.twimg.com/media/GZH19S7XwAAVuQw.jpg","","es","Tamaulipas.","1","0","2","https://x.com/VaxTamaulipas/status/1842566411803099407","2646272473","VaxTamaulipas"
"1842539979420930250","Sat Oct 05 12:18:58 +0000 2024","9","🇲🇽Claudia Sheinbaum asume como la primera presidenta de México ️@DacilLanza lo analiza en #HabraConsecuencias Canal 20 de Telecentro El Destape 1070 VIVO: https://t.co/kMmecI0lCL https://t.co/wTxkL3KIZi","1842539979420930250","https://pbs.twimg.com/amplify_video_thumb/1842539884143058944/img/pPoCSxeThgsQdXVz.jpg","","es","Argentina","2","0","2","https://x.com/eldestape_radio/status/1842539979420930250","366713453","eldestape_radio"
"1842583020651577689","Sat Oct 05 15:10:00 +0000 2024","1","Una interpretación literal no permitiría que Claudia Sheinbaum fuera presidenta por Mtro. Mario Rosales B. @Rosales76059 La pura interpretación literal no es conveniente. Léalo aquí: https://t.co/CHxb1r9g6n https://t.co/5yvNZSb8Jm","1842583020651577689","https://pbs.twimg.com/media/GZImsL8WMAAIWKk.jpg","","es","México","0","0","1","https://x.com/Mex_Libertario/status/1842583020651577689","2661645776","Mex_Libertario"
"1842103608445157641","Fri Oct 04 07:24:59 +0000 2024","5","#ConOrtegaALas10 | El gabinete de la presidenta Claudia Sheinbaum (@Claudiashein) está basado en experiencia en el sexenio anterior se hablaba de 90% lealtad y 10% capacidad con ella ya vemos un cambio: @KenSmithramos exjefe de la Negociación Técnica del TLCAN. : @JC_Barajas https://t.co/cHo70gTO8z","1842103608445157641","https://pbs.twimg.com/media/GZB3ZNnXwAAddOL.jpg","","es","México","2","3","3","https://x.com/ElFinanciero_Mx/status/1842103608445157641","119051398","ElFinanciero_Mx"
"1842585711008215541","Sat Oct 05 15:20:41 +0000 2024","1","Sheinbaum anuncia plan para fortalecer los derechos de las mujeres en México https://t.co/vhGV0b6gLo","1842585711008215541","","","es","Guatemala","0","0","0","https://x.com/TN23NOTICIAS/status/1842585711008215541","228171408","TN23NOTICIAS"
"1842580510922670378","Sat Oct 05 15:00:01 +0000 2024","0","Las políticas macro-económicas durante el sexenio de AMLO tendían a mantener el statu quo de acumulación del capital uno esperaría que Sheinbaum avanzara en la modificación de la infraestructura económica. ️Enrique G. Gallegos https://t.co/rTXut1IzY6","1842580510922670378","","","es","Ciudad de México","0","0","1","https://x.com/Somoselmedio/status/1842580510922670378","490151722","Somoselmedio"
"1842581004805935600","Sat Oct 05 15:01:59 +0000 2024","1","#BuenosDías ️ ️ Se incluirán 12 municipios en la declaratoria de emergencia ️ Aquarium de Veracruz será único en el país dice PMA ️ El poder del pueblo permite elección de jueces: Sheinbaum https://t.co/GumYwFtvMV https://t.co/VeinYHcEOe","1842581004805935600","https://pbs.twimg.com/media/GZIpqE2WgAAbrl1.jpg","","es","Xalapa, Veracruz, México ","0","0","0","https://x.com/jornadaveracruz/status/1842581004805935600","264288749","jornadaveracruz"
"1842565968741933246","Sat Oct 05 14:02:14 +0000 2024","6","¿Hoy que @Claudiashein se convierte en la primera presidenta de México culmina un largo y sinuoso camino en la evolución de los derechos político-electorales de las mujeres? ️ Karen Rojas Kauffmann (@krojas2018) https://t.co/y7lULbr04S","1842565968741933246","","","es","Mexico","0","0","1","https://x.com/Gatopardocom/status/1842565968741933246","216807756","Gatopardocom"
"1842540766830145862","Sat Oct 05 12:22:06 +0000 2024","104","Le faltan 5 años 11 meses 26 días 16 horas 37 minutos 54 segundos (o bien 2186 días). Ya pasó 0.197% del sexenio (4 días). #cuantolefalta","1842540766830145862","","","es","La Cuarta Dimensión (La 4D)","1","1","16","https://x.com/cuantolefalta/status/1842540766830145862","1338193765656264704","cuantolefalta"
"1842286682009108566","Fri Oct 04 19:32:27 +0000 2024","2","#ÚltimaHora || La presidenta Claudia Sheinbaum recibió una llamada del presidente de EU Joe Biden. Abordaron temas de cooperación bilateral en materia económica cultural y comercial. Agradezco su felicitación tras asumir como la primera presidenta de México dijo. https://t.co/5quZ6zzhni","1842286682009108566","https://pbs.twimg.com/media/GZEc1IVXcAAfEqJ.jpg","","es","Xoco, Benito Juárez","0","0","2","https://x.com/IMER_Noticias/status/1842286682009108566","35938292","IMER_Noticias"
